rut_revisor,nombre_revisor,correo_revisor
849675974,Mauricio Rodrigo González Contreras,angela72@example.com
190475557,Karen Martínez Gatica,alegriamatias@example.net
403375608,Rosa Claudia Espinoza Cárdenas,carlos43@example.net
959767114,Carlos Iván Pacheco Torres,ogalleguillos@example.com
880903837,Daniel Miguel Vera Vidal,eruiz@example.org
920282881,Giselle Paula Rojas Hernández,espinozajose@example.com
361387600,Karla Carmen González Angulo,jgarcia@example.net
611236964,Zoila Aguirre,vflores@example.net
718611822,Juan Montecino Fierro,sbaeza@example.net
676682686,Pedro Poblete,mariamolina@example.org
123192524,Mariluz Vidal,tapiaana@example.net
72791142,Wilfredo Octavio Aguilera Rebolledo,hermanvelasquez@example.org
139076729,Héctor Enrique González González,baltazar37@example.org
77568335K,Constanza Aguilera Mansilla,diazpatricio@example.com
202304265,Jeremy Juan Paredes Pérez,mario70@example.com
189091893,Jaime Eduardo Barría-Iturra Osorio,acunafrancisca@example.org
181862440,María Maureira Riquelme,bernarditasandoval@example.org
704817657,Mauricio Roberto Osorio Barra,caceresabraham@example.com
513181094,Máximo Pedro Herrera Ríos,ossessergio@example.net
610216099,Manuel Vicente Pérez Vargas,isidorafuentes@example.net
14683569,Marta Herrera San Martín,utroncoso@example.com
12493894,Oscar Víctor Bórquez Aburto,joaquin10@example.net
989600281,Guillermo Vicente Vega Sepúlveda,dolores74@example.org
483007116,Isabel Raquel Prado Sánchez,luis66@example.com
360854485,Aurora Macarena Contreras Núñez,ana20@example.com
389665398,Nicole Isidora Carvajal Alarcón,gonzalezanita@example.com
654303800,Germán Leyton,cortezclemente@example.org
331383643,Catalina Inzunza Pérez,cornejonatalia@example.net
403749206,Danae Quezada Bustamante,kacevedo@example.org
22263802K,Fernando José Troncoso Quiroga,marcelocortez@example.org
508384122,Cristian Héctor Ruiz Poblete,pachecojimena@example.org
5825946,Anaís Alegría Muñoz,lpena@example.org
833487035,Antonia Constanza Valencia Hernández,lsanchez@example.org
514217599,Cristian Ampuero Paredes,xmeza@example.net
102479602,Víctor Ignacio Rodríguez Cortés,molinapatricia@example.net
382428285,Raúl Jhonny Rodríguez Ramos,tgarrido@example.com
359723822,Lorenzo Diego Canales Vilches,delgadokarin@example.org
54109520,Valentina Agurto Pacheco,sofia69@example.org
662888990,Yanet Baez Araneda,osvaldo97@example.org
275983705,Salvador Espinoza González,yanetpoblete@example.org
270337252,Florencia Rocío Galleguillos Bravo,jose64@example.net
415978413,Carlos Angelo Inzunza Paredes,roman17@example.com
906770334,María Millaray Martínez Salas,hcampos@example.net
199662155,Emily Katherine Cuevas Bravo,catalanmarcia@example.net
84891665K,Javiera Daniela Donoso Vásquez,maria54@example.com
942247648,Paula Alejandra Acevedo Sandoval,wretamal@example.net
659123142,Herminda Rosa García Cortés,gonzalo67@example.org
300110401,Claudia Román,yolandaalarcon@example.org
894140879,Santiago Garcés Escobar,paola18@example.net
709564846,Mariana Rocío Lagos Plaza,matiasalbornoz@example.org
