id_articulo,rut_revisor,fecha_revision,comentarios,calificacion
266,892844682,2025-02-12,Laboriosam amet mollitia eum et aliquid recusandae cum.,3
266,114634794,2025-03-31,Deserunt voluptate aliquam accusamus quisquam ea quis tempore id maiores ex iste.,2
266,162244973,2024-11-12,Dicta natus cupiditate culpa repellat veniam assumenda quas occaecati.,7
267,28930715K,2024-03-12,Saepe ipsam optio ab laudantium omnis dolores enim quasi magni id voluptatem.,3
267,114634794,2025-01-18,Odit dolore necessitatibus dignissimos mollitia praesentium commodi aperiam unde necessitatibus.,6
267,450557234,2024-08-05,Qui distinctio et hic corrupti modi blanditiis necessitatibus.,7
268,433800532,2025-05-04,Labore recusandae accusantium velit explicabo reprehenderit repellendus perferendis quibusdam.,3
268,592753936,2025-04-29,Pariatur ipsum quisquam nobis excepturi illum dolorem dolorum recusandae omnis facilis autem recusandae.,3
268,450557234,2025-05-01,Inventore nostrum atque laborum sit fugiat.,3
269,928198014,2025-05-04,Consectetur eum id illum quas velit hic amet.,1
269,70958872,2025-02-28,A qui natus nihil dicta facere illo odit dicta dolorem provident beatae necessitatibus.,2
269,892844682,2025-03-26,Ea ut debitis doloribus quas animi vel praesentium.,7
270,892844682,2025-03-17,Rem optio sequi autem error harum quidem fugiat eos occaecati et animi.,3
270,355429725,2025-02-11,Facere dolorum doloremque ipsum accusantium assumenda ea delectus pariatur.,3
270,708305499,2025-03-09,Delectus minima non voluptas recusandae incidunt dolorum molestiae.,2
271,138996832,2024-09-06,Placeat occaecati dignissimos esse neque sit neque vitae suscipit totam maxime alias blanditiis.,4
271,70958872,2024-07-12,Libero tempore officiis at eligendi velit voluptatem sunt.,3
271,768141746,2024-10-02,Rem ipsum repudiandae explicabo explicabo totam tempora quod explicabo deserunt nesciunt quam expedita fugit.,7
272,138996832,2025-01-05,Repudiandae itaque reiciendis voluptas voluptate incidunt.,4
272,450557234,2024-09-14,Amet voluptates a accusantium accusantium nemo.,7
272,708305499,2024-12-27,Fugiat voluptatem eveniet ipsa autem saepe sint explicabo nam debitis numquam necessitatibus.,3
273,114634794,2025-04-17,Ex mollitia ullam architecto asperiores exercitationem dolores.,7
273,708305499,2025-03-30,Facere magnam illo illum quas odit libero distinctio accusantium nesciunt.,5
273,131282516,2024-10-07,Assumenda consequuntur at error laborum quod ratione voluptatem fuga voluptatibus praesentium maiores.,4
274,138996832,2025-04-18,Quasi totam suscipit natus inventore quibusdam.,3
274,450557234,2025-02-06,Debitis aspernatur recusandae minima similique unde.,7
274,433800532,2025-03-26,Aliquam velit totam consequatur consectetur reprehenderit repellat velit sint maxime libero neque.,5
275,991843914,2025-01-12,Vero magnam veniam quae architecto officiis deleniti perferendis ducimus accusantium magni.,6
275,708305499,2025-04-26,Velit repellendus laudantium voluptatibus adipisci consequuntur commodi incidunt deserunt debitis ut.,4
275,755771K,2024-06-02,Omnis earum ducimus officia occaecati tenetur velit unde quaerat incidunt laborum.,7
276,506342201,2025-04-28,Quasi iste adipisci perspiciatis eveniet cupiditate omnis occaecati hic blanditiis aspernatur optio quos.,4
276,569915724,2025-05-08,Iure quod vel quisquam eius harum repellendus maxime ullam.,7
276,976806999,2025-04-21,Consequuntur sunt asperiores ipsam voluptatibus facilis facilis.,3
277,496401530,2024-10-03,Consequatur vel corporis eveniet aspernatur quis ipsa qui doloremque eligendi dignissimos suscipit.,5
277,81249905K,2025-04-04,Dolorum dolorem dolorem sequi rem ullam ipsum vel maiores minima fugiat incidunt cumque.,5
277,20964147K,2024-09-29,Explicabo fugit ut ducimus dolores facere molestias saepe sed laborum optio omnis vero.,6
278,686369072,2024-06-19,Blanditiis laudantium temporibus culpa hic quia labore suscipit mollitia optio.,7
278,877648990,2025-02-08,Autem consectetur sint culpa error deleniti explicabo consectetur minima aperiam magni assumenda.,7
278,991843914,2024-01-21,Possimus iure sequi animi voluptas nesciunt porro ad.,4
279,912363694,2025-04-24,Odio ullam possimus voluptatibus corrupti provident explicabo neque.,2
279,928198014,2025-04-28,Repellat possimus itaque placeat laboriosam vel sapiente minus minus odit.,4
279,433800532,2025-05-09,A modi eaque quasi alias deleniti.,1
280,768141746,2025-05-09,Quia reiciendis laborum repellat blanditiis rem quam laborum provident sunt.,6
280,355429725,2023-08-02,Aliquam dicta corporis expedita tenetur facilis voluptatum autem cupiditate corrupti.,3
280,686369072,2023-08-21,Dolores architecto soluta consequatur molestiae repellat occaecati harum.,5
281,892844682,2024-09-18,Fugiat assumenda quas iure quis enim veniam.,6
281,177614769,2024-05-20,Voluptate a dolores reprehenderit voluptatem illo soluta a.,5
281,708305499,2023-06-13,Odio inventore aspernatur excepturi est neque blanditiis minima quod eos laudantium.,5
282,246261849,2025-04-13,Amet ducimus ipsa rerum laborum accusantium minus vitae.,1
282,506342201,2025-04-24,Neque id nostrum autem temporibus illum distinctio.,3
282,850748896,2025-03-18,Harum beatae error a doloremque excepturi.,1
283,131282516,2024-07-04,Perspiciatis fugiat sapiente assumenda rerum iusto cum labore architecto mollitia.,7
283,877648990,2024-01-18,Ratione vitae consequuntur deleniti quia quam alias corporis saepe delectus soluta eligendi excepturi.,2
283,81249905K,2024-05-03,Quis quaerat pariatur architecto nobis perspiciatis.,4
284,70958872,2024-12-08,Voluptas esse id cum quod delectus eligendi totam.,6
284,811361135,2025-01-03,Nesciunt nesciunt dolor esse natus eum aspernatur illo non occaecati.,3
284,661478306,2025-03-31,Officia eius laborum ipsum ex error.,2
285,850748896,2024-07-21,Perspiciatis libero odit labore incidunt tempore pariatur reiciendis molestiae ab iure.,6
285,592753936,2024-10-12,Pariatur atque reiciendis quas itaque cupiditate quae animi rem expedita voluptate.,6
285,215759008,2025-05-03,In commodi explicabo officia doloribus in ea.,2
286,686369072,2024-07-06,Ab aperiam ipsam doloremque quisquam labore soluta quas cupiditate hic accusamus.,7
286,450557234,2025-03-05,Fugiat tenetur error consequuntur dolorum porro.,2
286,131282516,2024-05-29,Fugit minima quam beatae doloribus animi delectus.,2
287,81249905K,2025-03-21,Nemo quos explicabo temporibus nisi possimus reprehenderit fugit vitae delectus ab atque aperiam.,4
287,162244973,2025-02-27,Sapiente totam velit ab iste earum eius quaerat cumque reprehenderit voluptatem odit ex iusto.,4
287,592753936,2025-04-02,Deserunt explicabo molestias architecto excepturi possimus nulla nemo nesciunt magni quaerat suscipit ipsa.,4
288,808227355,2024-06-21,Qui odit totam dolores minus earum magni dicta tenetur ullam iure laboriosam.,4
288,470086734,2024-01-20,Rem dolore nisi similique nam dignissimos consequuntur cupiditate aliquam.,5
288,131282516,2025-01-18,Velit cum ab inventore atque fugiat eligendi nisi.,1
289,28930715K,2025-04-02,Deserunt omnis expedita vero dignissimos facere assumenda inventore placeat quis nobis.,3
289,661478306,2025-03-14,Voluptatibus ad architecto deserunt veniam dolores explicabo fugit quidem sint cumque.,4
289,708305499,2025-03-09,Eius a eius eaque iste voluptatum sed voluptatum eveniet voluptas.,7
290,81249905K,2025-02-13,Tenetur repellat repellendus fuga veniam dolorum.,5
290,450557234,2025-03-04,Laudantium deserunt delectus rerum odit et.,4
290,215759008,2024-12-30,Animi culpa accusamus alias odit totam doloribus doloremque sint minus voluptatem hic praesentium.,6
291,928198014,2025-01-06,Voluptatem laudantium minima laborum iure corrupti cum ex accusantium asperiores ipsam.,3
291,450557234,2024-08-02,Exercitationem eveniet facere expedita soluta inventore maiores ipsa nulla quia.,2
291,768141746,2023-11-21,Deserunt quam architecto et exercitationem perferendis.,4
292,177614769,2025-04-26,Ea fuga aut quod tempore occaecati molestias.,1
292,991843914,2025-05-01,Quam excepturi tempore iusto asperiores temporibus asperiores similique possimus.,1
292,138996832,2025-03-30,Minus quae id minus eos occaecati asperiores quos.,7
293,405734389,2025-04-13,Eos dicta at reiciendis in excepturi ratione porro inventore harum expedita.,4
293,496401530,2025-04-29,Culpa culpa repellendus consequuntur possimus eum non sint repellat.,7
293,928198014,2025-04-24,Maiores facilis impedit aperiam tenetur tempora voluptas hic delectus pariatur voluptas.,5
294,450557234,2024-04-03,Vitae neque earum saepe laboriosam labore.,4
294,506342201,2024-12-01,Expedita exercitationem delectus esse assumenda ipsum voluptatem saepe architecto.,4
294,991843914,2024-09-06,Labore ea maxime sunt sunt alias.,5
295,928198014,2025-02-09,Iure sit voluptatum totam dolorem reprehenderit quis vero maiores.,4
295,506342201,2025-05-05,Unde explicabo nobis magni cupiditate error quibusdam deserunt eaque.,3
295,548798477,2025-02-02,Asperiores eum voluptates enim distinctio itaque ipsa.,4
296,768141746,2024-09-06,Ea reiciendis aspernatur doloremque possimus voluptatum adipisci eos vel.,4
296,949663183,2025-04-26,Quos sequi animi sapiente repellendus dolores nam asperiores.,4
296,892844682,2025-01-23,Neque velit ex excepturi cumque rem officia eveniet nemo natus eum eos rerum.,6
297,131282516,2025-03-31,Eveniet laborum quisquam iste temporibus minus mollitia sequi beatae.,3
297,215759008,2025-05-07,Labore asperiores dolorum vitae illo molestias voluptates rerum nam possimus.,1
297,928198014,2025-04-01,Minus ea fugiat blanditiis dicta illo cum harum repellendus quia impedit debitis.,3
298,755771K,2024-01-04,Voluptate quasi ipsam earum accusamus doloremque suscipit dolorum ratione.,6
298,877648990,2025-02-05,Eum harum nam dolores quisquam temporibus illo accusantium amet laboriosam adipisci.,1
298,991843914,2023-11-05,Perferendis repudiandae doloremque quis ea recusandae eligendi quasi nihil asperiores esse eos corporis.,6
299,131282516,2024-01-30,Fugit architecto commodi asperiores debitis eligendi hic deleniti voluptas esse laudantium libero optio.,4
299,598225230,2024-09-30,Molestiae voluptatibus adipisci iusto cum harum totam modi nemo.,5
299,215759008,2024-09-06,Labore libero sequi ratione quas reprehenderit perspiciatis est consectetur delectus.,5
300,912363694,2024-05-11,Eos voluptate quia dolore ipsam nihil autem quam cumque ipsa porro.,3
300,506342201,2024-06-08,Temporibus optio accusantium quidem ab dolores maiores aperiam veritatis laboriosam in odio quibusdam.,4
300,131282516,2024-06-16,Quaerat eos ratione doloribus qui esse beatae laboriosam blanditiis quas voluptates.,7
301,496401530,2025-02-09,Consequatur ducimus quaerat commodi ea nostrum.,5
301,506342201,2024-04-01,Exercitationem ipsam nobis ratione fugit fugiat provident voluptate voluptatibus corporis numquam iusto excepturi.,6
301,162244973,2025-03-16,Optio quis rem labore excepturi nemo mollitia ipsum aliquam at vitae.,4
302,506342201,2025-04-29,Consequatur impedit totam porro nihil occaecati beatae odio ad.,1
302,598225230,2025-03-20,Quos quod nesciunt officia nemo architecto libero dolorum.,7
302,131282516,2024-10-30,Sint quasi doloremque placeat id deleniti sapiente voluptatum sint magni tempore praesentium.,2
303,496401530,2024-07-24,Minima eaque expedita voluptatibus velit iste molestiae beatae cupiditate cum consequuntur ipsa maxime.,7
303,768141746,2025-04-19,Eos in earum iure quasi eum deleniti beatae qui.,4
303,20964147K,2025-01-04,Ut exercitationem accusamus qui accusantium rerum natus ab.,3
304,22835581K,2025-03-07,Fugit tempore molestiae rerum sequi accusantium ipsam repudiandae aspernatur sapiente suscipit veritatis.,4
304,960262786,2024-12-18,Laboriosam fugiat qui sunt dolores optio alias.,2
304,20964147K,2025-01-08,Magnam dicta quis odit vero magni voluptate maiores tempora quia id sit nam.,4
305,81249905K,2024-05-13,Dolor suscipit totam dignissimos nisi doloribus incidunt hic a.,7
305,598225230,2024-09-29,Labore minima esse laudantium reprehenderit fugit tempore dolor cumque.,3
305,850748896,2024-05-11,Alias ullam fuga nulla hic placeat dolorem eos deserunt sequi ratione.,4
306,81249905K,2025-04-21,Aspernatur corporis quam quos distinctio earum similique blanditiis doloribus explicabo suscipit eveniet.,1
306,241803562,2025-04-03,Aut est quas eos omnis sint itaque dolorem unde omnis illum blanditiis.,2
306,162244973,2025-04-20,In quis rem minus reprehenderit voluptate ipsam delectus veniam voluptate quos.,7
307,70958872,2025-04-29,Perferendis itaque iure eligendi earum voluptas nulla alias.,5
307,81249905K,2025-05-12,Nulla id pariatur vitae totam commodi iusto voluptatibus sapiente dolor reprehenderit.,4
307,693767296,2025-04-23,Repudiandae possimus optio impedit deleniti eaque aliquid nulla doloremque est ducimus accusamus nihil.,6
308,433800532,2024-02-14,Voluptatum facere laborum occaecati similique harum quidem expedita.,1
308,592753936,2024-07-01,Possimus voluptates voluptatibus distinctio et fugit ut cumque corporis blanditiis perspiciatis maxime numquam.,5
308,721081540,2024-07-16,Dolorem fuga delectus corrupti repudiandae enim consequuntur vel doloribus blanditiis error.,6
309,598225230,2024-08-02,Sed mollitia sed minima suscipit hic nihil.,5
309,70958872,2024-11-10,Fugit sint fuga sed commodi maiores voluptates dolores doloremque inventore ut nemo nostrum.,7
309,991843914,2024-09-06,Nisi deserunt mollitia sunt pariatur hic necessitatibus minus quas laudantium ratione facere.,6
310,654001588,2025-01-17,Ea excepturi architecto iure vero fuga quasi nihil voluptate animi.,2
310,405734389,2024-10-29,Ex aliquam expedita labore ea alias consectetur vel aspernatur rem nam.,5
310,960262786,2025-02-05,Alias quaerat necessitatibus nostrum provident cumque repellat.,1
311,70958872,2024-04-18,Et cupiditate delectus veniam iure vero sint provident suscipit autem adipisci molestiae.,1
311,755771K,2024-04-28,Corrupti dicta quaerat quo animi rerum.,4
311,877648990,2024-05-17,Sequi perferendis quas accusantium nihil voluptates.,7
312,470086734,2024-04-30,Quo molestiae asperiores dignissimos asperiores necessitatibus pariatur adipisci.,3
312,949663183,2025-02-28,Quas sapiente eius eligendi mollitia perspiciatis qui excepturi distinctio.,4
312,63303232,2024-08-15,Rem laborum illo ipsa ipsam sint minima distinctio.,2
313,768141746,2024-07-02,Libero cupiditate asperiores molestias consequatur laborum voluptatibus qui assumenda architecto laboriosam laborum.,6
313,496401530,2024-03-06,Eius ab molestiae fugit reprehenderit et dolor sit fugiat a ea incidunt soluta.,5
313,63303232,2023-12-21,Iure nobis iure aperiam modi eius.,3
314,70958872,2023-09-15,Repudiandae at iusto quidem illum laudantium quae quae.,1
314,177614769,2025-04-03,Asperiores cum assumenda voluptatibus in velit odio ipsam facilis quasi aspernatur blanditiis reprehenderit.,2
314,808227355,2024-06-25,Optio quis nisi quam earum dolores porro molestias alias quae modi reiciendis.,7
315,81249905K,2025-02-11,Facilis commodi molestiae repellat quas minima.,5
315,808227355,2024-03-06,Esse excepturi quae ea natus ullam illum maiores dolor ad numquam.,7
315,960262786,2025-03-30,Nulla tempore dolorum veritatis repellendus veniam dolore odit exercitationem.,3
316,928198014,2023-12-23,Earum sit rem exercitationem provident reiciendis voluptates porro ipsam blanditiis quae a nemo possimus.,1
316,70958872,2023-06-02,Tempora quas quidem corporis magnam maiores praesentium inventore recusandae nemo.,6
316,960262786,2024-04-06,Perspiciatis quis quam et quaerat distinctio repudiandae a placeat et architecto.,5
317,548798477,2025-01-09,Sint ab nemo libero sint eaque consectetur voluptates non natus assumenda officia.,2
317,496401530,2025-02-14,Similique laboriosam sapiente totam ipsa voluptatum voluptatibus aliquid laborum sequi incidunt rerum nisi.,1
317,22835581K,2025-04-30,Provident laborum incidunt ea dolore amet reiciendis voluptatum voluptatem nostrum similique beatae.,3
318,131282516,2025-02-01,Doloribus aperiam qui atque doloribus est aperiam quod.,6
318,81249905K,2025-02-11,Atque eaque expedita laboriosam possimus impedit voluptate sapiente.,1
318,598225230,2025-01-27,Adipisci perspiciatis eius dolorem aspernatur sapiente molestias ipsam iusto laboriosam perferendis libero fugit.,4
319,355429725,2024-10-27,Cumque earum quam quisquam numquam nisi.,4
319,912363694,2024-10-02,Animi autem veniam voluptates amet aperiam beatae voluptatem nesciunt nesciunt nam.,4
319,862875117,2025-02-06,Aut nulla non officiis vero magni excepturi id illo reiciendis assumenda consequuntur minus.,7
320,592753936,2025-03-09,Quod modi aliquid asperiores quibusdam optio.,4
320,928198014,2024-11-28,Repellendus numquam minus minus esse dolorum consequuntur culpa exercitationem animi.,5
320,496401530,2025-01-20,Ab eligendi officiis dignissimos veritatis id at sunt soluta dolorem officia.,5
321,569915724,2024-12-08,Esse natus beatae saepe repellendus deserunt quos porro officiis perspiciatis porro est.,2
321,63303232,2025-03-03,Eius praesentium praesentium eum exercitationem eius ad quod sit.,5
321,808227355,2025-04-17,Voluptatem nostrum at iusto fuga labore.,5
322,569915724,2025-05-04,Occaecati rem ipsa hic magni et inventore reprehenderit.,2
322,543383023,2025-05-01,Molestias eius harum iste quis laborum sit pariatur eligendi repellat sint numquam.,6
322,960262786,2025-04-01,Quae explicabo eius autem temporibus ipsa minima officia nulla omnis occaecati.,3
323,755771K,2025-04-16,Aliquam earum expedita in consequuntur reprehenderit voluptate praesentium ipsa repellat.,3
323,877648990,2023-08-14,Voluptatum nesciunt veritatis ex eligendi placeat officia.,7
323,138996832,2025-04-07,Eveniet cumque et fugit voluptates enim odit natus magnam praesentium error.,4
324,138996832,2024-11-09,Aperiam reiciendis facilis corrupti ullam fugit nostrum pariatur excepturi eaque voluptate quaerat.,1
324,915957536,2024-11-12,Ad vitae ab laborum ut incidunt.,7
324,928198014,2024-10-22,Error facilis corporis accusamus magni quo aliquid tenetur quidem.,1
325,496401530,2024-07-12,Provident repellendus facilis ipsam consectetur odit inventore.,5
325,654001588,2025-01-09,Ipsam eum autem animi quia totam.,2
325,470086734,2023-11-17,Quibusdam fugiat quibusdam fugiat quisquam deserunt repellendus quae animi.,5
326,177614769,2024-10-31,Impedit iste debitis sint reiciendis molestias accusamus tempore voluptatibus earum quae nam.,5
326,138996832,2024-09-16,Numquam harum aliquam porro soluta iste.,7
326,928198014,2024-11-06,Illum quisquam impedit distinctio similique enim aliquid ducimus omnis ea ducimus expedita nostrum.,5
327,755771K,2025-02-24,Doloribus dolore explicabo modi vel voluptates.,5
327,138996832,2025-03-21,Molestias quam velit quis placeat odio nostrum fugiat amet laudantium architecto ad.,1
327,70958872,2024-12-27,Sunt quos fugiat mollitia enim quod totam molestias iste.,6
328,215759008,2025-04-29,Ipsa dicta numquam commodi incidunt at atque earum quos doloremque neque odio est.,4
328,808227355,2025-05-10,Ipsum eius nam inventore deserunt ipsam inventore optio temporibus incidunt dolor sed.,5
328,81249905K,2025-05-07,Recusandae sequi reprehenderit eos quibusdam tempore illo cumque expedita culpa nulla error.,5
329,470086734,2025-05-07,Iure voluptates at ratione eum quasi maiores omnis.,7
329,177614769,2025-04-17,Quibusdam commodi ipsa hic labore voluptates pariatur quo.,7
329,22835581K,2025-03-14,Sint dolores quaerat excepturi quaerat cumque perferendis dolorem est.,3
330,131282516,2025-03-20,Doloremque nobis aliquid ratione voluptas exercitationem.,6
330,949663183,2024-11-22,Aliquam aliquid doloribus odio rerum rerum praesentium occaecati culpa quam.,3
330,808227355,2024-04-17,Suscipit esse sit commodi quam blanditiis omnis.,6
331,721081540,2024-10-16,Itaque animi architecto dignissimos magnam accusamus nobis dolorum voluptatum assumenda debitis voluptatum.,7
331,433800532,2024-06-18,Illo soluta exercitationem aut officia recusandae voluptatibus beatae ratione ipsum unde rem alias.,4
331,960262786,2025-01-29,Magni dolorem eos quisquam nostrum ea tempora sint quod porro mollitia eos.,6
332,598225230,2025-05-08,Voluptatem quasi ratione deserunt repudiandae alias tenetur animi quos delectus nulla.,5
332,70958872,2025-05-02,Itaque dolorem eveniet ratione incidunt dolores asperiores soluta iusto illum.,4
332,138996832,2025-05-12,In reiciendis exercitationem reprehenderit occaecati minima neque repudiandae mollitia dolor id.,3
333,162244973,2025-05-12,Officiis natus natus iusto sit earum.,5
333,433800532,2025-05-04,Minima incidunt dolorum natus iusto consequatur facilis velit non fugit blanditiis.,3
333,661478306,2025-04-03,Sapiente quibusdam voluptatem esse illo et nihil accusamus magni doloribus autem voluptatum.,4
334,862875117,2025-04-06,Sapiente facilis nihil numquam assumenda minima.,4
334,355429725,2025-01-22,Sint aliquid necessitatibus dolores libero nostrum eveniet architecto voluptatum laboriosam blanditiis similique.,4
334,20964147K,2025-04-27,Adipisci consequuntur esse ipsam accusamus animi dignissimos accusamus.,1
335,661478306,2024-11-04,Nesciunt deleniti alias exercitationem in eum sint quae maxime ex.,1
335,949663183,2024-11-26,Odit perferendis quaerat iusto neque inventore temporibus inventore neque laudantium.,5
335,81249905K,2025-01-09,Harum ipsa officiis quia illo ratione accusantium quaerat vitae.,7
336,850748896,2025-01-05,Rem nam laboriosam quasi doloribus repellat.,6
336,569915724,2025-03-30,Aliquid culpa reiciendis tenetur doloribus similique neque dignissimos suscipit laborum ex perferendis.,1
336,755771K,2025-02-26,Ipsum mollitia fugit pariatur facere illum officiis quia atque ab.,1
337,928198014,2024-11-29,Quisquam ullam sint magni explicabo perferendis animi eaque tenetur vel impedit.,2
337,496401530,2024-08-24,Praesentium mollitia rerum amet alias rem reprehenderit enim voluptatibus atque neque ipsam.,1
337,654001588,2024-08-22,Ab omnis magnam enim cumque nulla reprehenderit ipsam doloribus.,1
338,960262786,2025-01-12,Quos nostrum architecto possimus ratione deserunt et illo porro doloremque praesentium.,6
338,543383023,2025-02-13,Voluptatibus sequi voluptates ex adipisci voluptatum reprehenderit corrupti libero dolorum suscipit.,6
338,592753936,2025-02-18,Quisquam aliquam est ullam et eos.,4
339,592753936,2024-10-19,Facilis suscipit hic nesciunt autem atque velit repellat.,7
339,63303232,2024-04-15,Iure consequatur quae aliquid eius illo cupiditate voluptatibus laudantium dolorem quis.,3
339,928198014,2024-12-30,Iusto quas repellat autem officiis debitis nemo veniam laudantium.,3
340,496401530,2025-03-23,Quisquam nam sunt aliquam laborum ex.,6
340,114634794,2024-08-02,Commodi repellendus delectus sit quidem veritatis porro veritatis.,3
340,960262786,2023-12-18,Quos odio minus voluptatem incidunt nulla ad non deserunt voluptatum perspiciatis.,5
341,755771K,2024-08-27,Iure accusamus earum dignissimos mollitia cum fugit soluta.,2
341,177614769,2024-12-25,Velit aspernatur eligendi ratione excepturi placeat et maxime libero.,2
341,949663183,2024-12-20,Quidem quisquam aperiam debitis harum a totam.,6
342,850748896,2024-04-07,Debitis et nisi quaerat saepe minus impedit impedit dicta corporis.,1
342,892844682,2024-08-02,Quas voluptatem sapiente maxime aliquam vitae architecto voluptatem iusto recusandae pariatur itaque.,4
342,70958872,2023-10-03,Optio deserunt molestiae consectetur dolore atque.,5
343,548798477,2025-03-07,Tempore nobis in quasi in voluptatem illo eaque inventore unde aliquid aspernatur consectetur.,7
343,215759008,2024-09-08,Quasi aut nisi dolorum incidunt velit impedit recusandae voluptatibus est tempora blanditiis.,4
343,949663183,2024-12-22,Deleniti quod aspernatur earum maiores ipsam provident quis expedita.,4
344,598225230,2024-06-05,Nulla iste inventore excepturi quisquam accusantium fugit.,5
344,661478306,2024-12-03,Quod beatae dolores animi magni aliquam veniam neque dolorem quae ea.,6
344,355429725,2024-03-28,Aperiam corrupti consequatur ea impedit iste nesciunt iste est.,7
345,450557234,2024-10-29,Maxime iste saepe quasi alias exercitationem facere tenetur.,7
345,470086734,2025-01-29,Inventore facere vero aperiam nulla modi harum ad consequuntur.,7
345,768141746,2025-01-22,Rem sunt at nemo ratione beatae magni minima natus beatae dicta.,3
346,928198014,2025-04-10,Illum hic rerum atque officiis consequuntur.,4
346,661478306,2025-04-29,Sed debitis fugit dolore numquam unde accusantium unde nulla doloribus ex.,6
346,470086734,2025-03-16,Fugiat ratione voluptate totam modi consectetur facere commodi fuga eligendi quidem illo placeat facere.,4
347,912363694,2025-03-31,Qui autem nihil pariatur architecto rem voluptatem nesciunt voluptas ea enim ab magnam.,6
347,114634794,2024-10-16,Beatae quasi iste fugit tenetur sequi autem nulla explicabo dolorem asperiores.,2
347,241803562,2024-09-24,Incidunt similique nam laborum amet laboriosam ratione aperiam animi.,2
348,177614769,2025-03-17,Corrupti esse a voluptates laborum consequuntur error ducimus repellendus soluta.,1
348,63303232,2025-04-23,Inventore excepturi quibusdam unde repudiandae suscipit delectus.,4
348,693767296,2025-04-20,Velit dolores tempore suscipit enim numquam totam numquam laborum modi similique repellendus.,2
349,991843914,2023-11-10,Repellat magnam amet cumque ad sit blanditiis laudantium.,5
349,506342201,2024-02-21,Aliquid dicta harum quo aliquid totam sequi provident.,4
349,450557234,2025-02-27,Minus voluptatibus autem unde aut numquam fugit.,5
350,928198014,2025-01-15,Maiores quaerat temporibus officia id expedita quaerat corporis hic molestiae perferendis minus.,1
350,915957536,2024-05-20,Iste magni quasi modi totam reprehenderit vero excepturi nemo.,1
350,661478306,2024-09-18,Aspernatur accusamus enim praesentium laboriosam itaque facere.,6
351,892844682,2025-04-25,Quod accusamus eius sunt temporibus enim non.,6
351,177614769,2025-04-07,Sapiente corporis et adipisci voluptatibus neque aliquam maiores temporibus saepe maiores.,7
