id_articulo,rut_revisor,fecha_revision,comentarios,calificacion
263,801784372,2024-07-31,Quam delectus dignissimos aperiam placeat rem aliquid magnam vero in.,6
263,118421027,2025-01-09,Vero magni quae vitae vero consectetur repellat eaque sit fugit rerum voluptatem sapiente.,1
264,482947700,2024-11-18,Sit possimus vitae eius eos eaque architecto maiores.,7
264,76761221,2024-03-14,Voluptatibus natus explicabo placeat ab commodi rem quibusdam libero nostrum.,1
264,706028730,2025-03-11,Aspernatur doloribus ea doloribus cupiditate vitae culpa nam earum saepe quas nihil.,6
265,719733581,2025-04-23,Numquam assumenda facere vel dignissimos maxime hic ea.,3
265,429691303,2025-04-13,Rerum omnis voluptatibus reiciendis sint asperiores aut.,7
265,76761221,2025-04-25,Natus maxime neque earum deserunt iste accusantium.,1
266,424016810,2025-02-24,Sit consequatur eius aspernatur voluptas nobis officiis atque.,1
266,606167458,2025-03-21,Velit quam reprehenderit repellat numquam commodi debitis quod molestiae magnam non recusandae veniam.,1
266,801784372,2025-03-01,Expedita labore voluptate velit repellat expedita quisquam dolore id ad.,7
267,745051308,2024-12-21,Voluptas asperiores laborum consequuntur similique id assumenda at pariatur.,1
267,606167458,2025-04-23,Quas quas cumque minus eveniet similique eum tenetur facere aperiam officiis veritatis.,2
267,108315393,2025-04-04,Earum cupiditate reprehenderit cum error facilis.,4
268,486934158,2024-08-01,Sit sed ducimus nobis earum corrupti in rerum libero exercitationem incidunt.,1
268,170449924,2024-10-10,Nobis distinctio doloribus placeat dolore itaque aliquid nam.,1
268,717291441,2025-01-20,Minus inventore ab odio molestias laborum porro ad sapiente.,5
269,52362735K,2025-02-28,Fugiat non voluptates adipisci facilis nemo voluptatibus blanditiis.,7
269,847822864,2024-12-18,Libero vel a deleniti aspernatur accusantium vel praesentium numquam magnam.,2
269,384963978,2025-05-03,Doloremque cumque repellat sit sunt eius cumque.,6
270,738874307,2025-02-15,Hic quae voluptatum nam dolore consequatur numquam dolor in placeat quod earum.,7
270,706028730,2023-11-21,Molestiae nostrum vero impedit delectus molestias ullam vitae error.,4
270,719733581,2024-02-12,Voluptas ad perferendis odio molestiae dicta commodi.,6
271,738874307,2025-02-25,Nulla minus quo hic asperiores sequi.,5
271,19348520,2024-11-04,Architecto delectus voluptate corporis libero molestias dolores.,3
271,52362735K,2024-12-20,Mollitia minus minus error magnam natus esse dignissimos iure saepe eos aspernatur.,1
272,488481576,2024-12-26,Adipisci ullam porro quis fugit ipsa.,6
272,118421027,2025-04-07,Temporibus laudantium voluptas aperiam cumque rem minus repellendus quod molestiae ea veniam amet.,2
272,606167458,2024-08-20,Temporibus nesciunt provident sunt iste quis sunt quod alias molestias fugit.,4
273,678358037,2025-02-11,Totam doloremque quibusdam laboriosam corrupti itaque neque sint.,2
273,170449924,2025-02-04,Deserunt consequuntur est quibusdam quam harum consequuntur optio.,2
273,261965569,2024-09-28,Eos fugit consequuntur quibusdam eos facere eius a non ratione.,7
274,108315393,2024-10-26,Asperiores fugiat iste blanditiis explicabo repudiandae inventore iusto saepe neque.,6
274,813950057,2024-12-30,Adipisci facere dicta labore quam magnam.,7
274,76761221,2024-04-23,Ullam suscipit hic mollitia dolorem quasi inventore ad.,7
275,813950057,2025-02-09,Eligendi odit fugiat distinctio id esse esse iure ea tempore.,1
275,82810988K,2025-02-15,Sequi illo qui qui tempore dolorum placeat odit.,3
275,502640062,2025-03-23,Repellat corporis ducimus sint nesciunt est consequatur.,1
276,288452296,2024-04-11,Excepturi enim optio qui eligendi ducimus rerum nemo nostrum quibusdam eius error.,1
276,533052614,2024-04-30,Error distinctio error a laboriosam maiores voluptatum ut veniam assumenda quo quidem cupiditate.,4
276,261965569,2024-09-12,Exercitationem adipisci amet ducimus ut suscipit.,1
277,335015215,2024-09-11,Placeat nisi maxime quod aspernatur inventore veritatis.,7
277,824531293,2025-01-29,Labore natus recusandae sint quaerat quaerat ut provident quis adipisci.,4
277,500961252,2025-04-09,Fuga magnam saepe quos earum veritatis ratione quis beatae libero est assumenda.,3
278,847822864,2024-05-08,Repellendus repellendus voluptatem temporibus numquam corporis rerum fuga consectetur qui et molestias.,6
278,170449924,2024-12-22,Quod dolorem ullam dolorem culpa facilis.,7
278,723173418,2023-12-09,Illo ut tenetur incidunt provident delectus aut illo quaerat iste.,4
279,553961653,2025-04-07,Accusantium tempore ratione assumenda labore odit expedita sint facilis.,5
279,723173418,2024-12-21,Provident voluptatibus fuga ab ea eum nisi perferendis molestias voluptatibus explicabo assumenda molestiae exercitationem.,5
279,745051308,2025-01-02,Amet reprehenderit repellendus nulla dolor qui laboriosam saepe repellendus mollitia iure recusandae hic.,3
280,52362735K,2025-01-21,Ipsum reprehenderit facilis enim cum autem temporibus dignissimos nisi deleniti quibusdam.,2
280,723173418,2025-03-11,Eveniet aspernatur harum fuga hic explicabo laborum.,1
280,261965569,2024-09-06,Sapiente cupiditate suscipit distinctio nisi possimus quod.,4
281,476744407,2025-04-26,Tempora nemo recusandae quo quos quas voluptate iusto amet fuga veritatis perspiciatis enim.,6
281,502640062,2025-04-20,Impedit non animi assumenda deserunt suscipit dolore consectetur cupiditate consequatur nisi eum adipisci.,4
281,19348520,2025-04-23,Facilis in cupiditate vero tenetur molestiae.,3
282,717291441,2024-08-25,Expedita repudiandae ducimus quam dolorum earum quisquam quam odit fugit tempora in asperiores.,6
282,108315393,2024-02-02,Maxime occaecati molestiae repudiandae aliquam ipsum.,3
282,563746866,2023-10-04,Fugit repudiandae quisquam repellendus error nemo molestiae ad velit blanditiis.,5
283,824531293,2025-04-20,Vitae molestias libero corporis amet ratione.,5
283,108315393,2025-03-10,Similique doloribus accusantium impedit deserunt voluptatum alias voluptatum est perferendis cum.,7
283,649665834,2025-03-18,Ut dolore quae minus perferendis officia quidem impedit.,5
284,123403398,2023-10-01,Blanditiis repellendus at debitis fugit aut aliquid veritatis dolor et veritatis porro.,7
284,261965569,2024-04-13,Quisquam accusamus error quos ducimus aspernatur occaecati excepturi aut alias atque.,4
284,170449924,2023-06-19,Quaerat libero exercitationem cumque at optio rem ullam deleniti molestias.,7
285,649665834,2025-05-09,Ea dolorem nam porro nisi alias quidem.,6
285,706028730,2025-02-05,Incidunt laborum aliquam veniam quibusdam placeat.,5
285,717291441,2024-09-06,Harum impedit accusantium quae explicabo nobis molestiae.,1
286,563746866,2023-12-18,Ex quasi quae perferendis optio iusto ea quia unde explicabo delectus impedit.,5
286,108315393,2025-03-20,Asperiores unde minima modi occaecati reprehenderit corporis perspiciatis esse expedita perferendis at.,4
286,19348520,2025-02-20,Voluptatem sed esse recusandae quasi delectus culpa neque ullam facere quam.,7
287,820677293,2024-12-18,Eos culpa reiciendis sed sequi dolorem cupiditate.,6
287,533052614,2024-02-24,Odit dolore officiis fugiat vel cum.,3
287,579522135,2025-03-11,Culpa praesentium qui pariatur maiores iste officiis possimus est.,7
288,532645603,2025-03-12,Autem adipisci alias veritatis excepturi alias porro tenetur quo eius.,6
288,335015215,2025-03-28,Magnam vitae debitis quis tenetur cumque.,5
288,76761221,2025-02-02,Veniam quis ratione saepe fugiat in alias quis veniam.,2
289,52362735K,2025-04-24,Error tempore iusto iure voluptate dicta voluptate dolores.,4
289,847822864,2025-03-23,Debitis delectus impedit quod dolores quidem occaecati labore hic aspernatur unde.,3
289,717291441,2025-04-11,Enim voluptatem libero voluptatum dolores quibusdam in asperiores.,1
290,813950057,2023-11-10,Architecto autem temporibus libero voluptatibus aspernatur expedita quam.,1
290,429691303,2025-02-01,Sapiente corrupti magni exercitationem reprehenderit incidunt reiciendis praesentium.,3
290,108315393,2023-09-22,Velit vero voluptatum hic distinctio laborum.,6
291,717603192,2025-02-25,Harum nemo consequatur vitae suscipit officiis ratione atque incidunt dolores rem pariatur.,3
291,579522135,2023-12-17,Impedit laborum distinctio explicabo odio iusto in quae cumque.,6
291,335015215,2024-12-08,Recusandae consequatur nobis asperiores incidunt tempora earum.,4
292,847822864,2025-03-20,Recusandae voluptas voluptatem modi consequuntur earum iusto cupiditate impedit similique quidem.,3
292,723173418,2024-09-04,Doloremque est assumenda et inventore numquam nobis dicta ipsa sint ab eius.,2
292,486934158,2024-08-21,Asperiores perspiciatis veritatis excepturi hic ea consequuntur delectus nam architecto quas.,1
293,482947700,2024-11-06,Libero cum sint expedita consequuntur quod delectus quisquam beatae reprehenderit suscipit voluptatum explicabo.,2
293,288452296,2024-11-04,Temporibus ipsa repellat laboriosam quibusdam ad.,5
293,602868621,2024-12-05,Impedit blanditiis harum corporis doloremque omnis voluptates accusantium optio.,6
294,801784372,2025-03-24,Optio exercitationem eius illo amet veritatis recusandae libero ex similique quaerat.,6
294,76761221,2024-11-30,Distinctio porro officia molestiae delectus earum.,1
294,847822864,2025-03-02,Repudiandae esse fugit corrupti ducimus aliquam corporis animi laborum iusto quibusdam.,2
295,553961653,2024-09-25,Cupiditate non nulla sapiente dicta nesciunt perspiciatis.,2
295,170449924,2025-02-13,Doloremque officiis consequuntur sed amet nihil suscipit porro.,1
295,468498243,2024-06-10,Rerum quo nisi nisi odit unde totam laboriosam a ducimus.,3
296,606167458,2024-08-29,Impedit ipsum iste dolores deleniti voluptatum veniam quae sapiente excepturi.,7
296,820677293,2024-01-06,Ab recusandae officia maiores minima possimus repellat quos quam voluptas consequuntur voluptates.,1
296,19348520,2024-12-10,Laboriosam praesentium quibusdam ratione ea voluptatem eligendi provident beatae sapiente.,1
297,288452296,2024-06-13,Id omnis doloribus quibusdam labore expedita iusto ut pariatur veniam expedita atque.,5
297,118421027,2024-10-26,Voluptatem nisi vero cumque similique autem cumque saepe.,5
297,533052614,2025-01-27,Ad architecto corrupti possimus consectetur cupiditate at quasi.,6
298,820677293,2024-06-05,Nulla molestias officiis illo atque unde atque quam natus distinctio culpa non enim.,2
298,308396703,2024-11-28,Quod modi tempora sit eveniet eius vero modi.,4
298,764712099,2025-03-03,Aut tenetur delectus ipsa nihil porro laborum dolorum natus fugiat quam voluptatum esse.,1
299,801784372,2025-03-31,Odio dignissimos quod accusantium iste magnam doloremque ipsa accusamus molestias corporis.,7
299,824531293,2025-02-16,Consequuntur facilis exercitationem et dicta laboriosam architecto totam quidem similique.,5
299,288452296,2025-04-21,Fugiat beatae quisquam atque molestiae at eum.,4
300,52362735K,2024-08-13,Perferendis soluta suscipit quaerat commodi maxime.,5
300,801784372,2024-08-15,Unde similique incidunt possimus hic est dolores voluptatum assumenda blanditiis commodi asperiores ipsum.,3
300,123403398,2024-11-02,Possimus pariatur error nam neque quas optio blanditiis.,4
301,82810988K,2024-12-23,Iste magnam est mollitia nisi omnis modi.,1
301,604679753,2024-12-04,Excepturi officia inventore aperiam ducimus distinctio.,1
301,52362735K,2025-02-28,Mollitia eum sapiente quasi harum ab laboriosam fuga culpa officiis.,7
302,723173418,2024-04-08,Placeat quasi molestias distinctio alias illum totam nostrum explicabo quia veritatis.,1
302,602868621,2024-09-15,Aut corporis magnam facilis ipsa iure.,2
302,261965569,2025-02-15,Maxime eveniet pariatur veritatis itaque voluptate quod.,3
303,606167458,2025-03-07,Ad sit fuga enim molestiae nesciunt harum dolorum praesentium.,6
303,801784372,2024-03-29,Ullam impedit est possimus odit aperiam perferendis quo labore dignissimos itaque.,5
303,604679753,2025-04-30,Amet veritatis quasi totam ipsam tempora animi laudantium.,5
304,500961252,2025-04-22,Aspernatur inventore quos error culpa quaerat iusto fugiat quaerat rerum voluptas dolorum.,4
304,486934158,2025-01-21,Ipsam aliquid amet placeat maiores laborum sunt nostrum harum ipsa culpa dolorum deleniti ipsum.,2
304,468498243,2025-04-10,Ipsam deleniti voluptatum dignissimos sit amet.,4
305,717603192,2024-08-11,Rerum beatae voluptas doloribus qui debitis dolorem deleniti doloremque.,1
305,429691303,2024-07-25,Ipsa tempora sint sint assumenda exercitationem.,2
305,764712099,2025-01-01,Accusantium at dolore saepe eaque at ut et laboriosam molestiae magni ex voluptatem.,5
306,847822864,2025-04-14,Ipsa dolorum quas ipsam sint maxime culpa pariatur.,2
306,801784372,2025-03-04,Assumenda minima dolore consequatur cumque illum soluta dolores labore consectetur necessitatibus eius.,1
306,118421027,2024-12-12,Eaque distinctio ab incidunt quibusdam non beatae.,7
307,19348520,2025-04-03,Ratione possimus impedit corrupti ex quas nihil mollitia molestias.,4
307,602868621,2025-04-05,Non vero eaque ipsum soluta nobis perspiciatis illo itaque error asperiores.,6
307,76761221,2025-04-05,Dignissimos eaque accusantium recusandae culpa possimus libero enim atque eligendi iusto at expedita.,3
308,261965569,2025-05-01,Exercitationem quasi error quas nemo voluptatem esse delectus veritatis placeat.,1
308,764712099,2024-07-06,Repellat natus nulla quas asperiores soluta molestiae ut voluptatem repudiandae nulla.,5
308,824531293,2024-01-09,Reiciendis nobis distinctio natus sit delectus reiciendis facere natus.,5
309,82810988K,2024-02-07,Cumque nam excepturi cupiditate dolorem assumenda porro eos quam at est.,2
309,265376711,2024-12-09,Earum cumque id sunt earum sunt sint dolor explicabo ex.,2
309,719733581,2025-04-17,Architecto saepe harum eum rem autem iste ducimus odit laboriosam rerum fugit itaque.,4
310,717291441,2025-02-09,Adipisci adipisci ab quia optio velit consequuntur odit eum.,7
310,76761221,2025-01-15,Eligendi officiis ex iste ex maxime doloribus maiores veritatis odit dolorum.,3
310,518808435,2025-04-14,Numquam quos pariatur libero nobis atque est repellat accusamus numquam architecto a fugiat.,5
311,553961653,2024-10-25,Eligendi dolorem rerum enim aspernatur aspernatur veniam est dolores et sint amet.,3
311,488481576,2024-10-18,Neque blanditiis libero nostrum harum corporis ut quo.,4
311,579522135,2024-12-01,Ipsam laborum accusantium nulla sint voluptatem ratione necessitatibus impedit adipisci.,1
312,384963978,2025-01-08,Autem minima exercitationem est vel distinctio perferendis reiciendis.,1
312,308396703,2024-10-28,Veritatis aspernatur dolorem repellat voluptatibus odit provident alias.,2
312,738874307,2024-06-23,Praesentium impedit aliquid repudiandae soluta nulla a maiores porro ducimus.,4
313,335015215,2024-10-25,Tempora rem nobis adipisci vitae quia facere asperiores quibusdam nulla fugit cum natus.,4
313,824531293,2024-05-10,Tenetur iure laboriosam neque eligendi placeat.,5
313,482947700,2023-12-06,Hic nisi et voluptatum quo ut vero et natus expedita laborum.,1
314,170449924,2025-02-12,Quas voluptatibus autem repudiandae tempore cupiditate eum.,7
314,717291441,2025-04-30,Totam fugiat consequuntur unde exercitationem nesciunt.,1
314,310818232,2024-12-22,Totam et consequatur unde ipsa dolores dolorum est.,7
315,52362735K,2024-12-15,Quas illo ut vero aliquam possimus minus.,7
315,532645603,2024-07-18,Consectetur repellat nihil vitae eaque perferendis quidem occaecati saepe esse.,7
315,500961252,2024-08-25,Provident aperiam magni ipsa enim ipsam facilis quos nihil perspiciatis aperiam.,5
316,649665834,2024-03-28,Distinctio ut magnam natus repudiandae voluptatibus magni consectetur ipsa.,6
316,19348520,2025-03-18,Facilis ab facilis ducimus deserunt aliquam a libero repudiandae repudiandae et.,6
316,261965569,2025-04-26,Quod nostrum eos voluptatum minus quam autem quos.,7
317,723173418,2024-06-05,Minima quos eligendi exercitationem quis veritatis.,2
317,563746866,2025-01-28,Velit doloremque a ipsum blanditiis recusandae necessitatibus ad iste harum mollitia quisquam.,5
317,82810988K,2025-04-17,Dolores quam quo esse aut nisi vero nihil soluta nesciunt magni porro.,2
318,429691303,2024-07-16,Eum ea dolorum cupiditate aut ullam enim quibusdam veritatis reiciendis.,5
318,19348520,2025-03-25,Rem esse nesciunt temporibus odit modi tempora repudiandae voluptatum aliquam voluptates tempore ea.,2
318,717291441,2025-02-07,Atque quasi ex magnam harum eum occaecati cum voluptates laborum in.,3
319,649665834,2024-08-14,Reprehenderit ratione facilis laboriosam dicta quae magnam accusantium voluptate occaecati officia placeat eius.,4
319,384963978,2024-10-11,Voluptate praesentium voluptates doloremque possimus eum pariatur fugiat ut.,7
319,717291441,2025-01-04,Consequatur facilis delectus consectetur reprehenderit at commodi nobis totam nostrum.,1
320,738874307,2025-01-12,Vel et quaerat hic inventore culpa incidunt.,4
320,118421027,2025-02-17,Quos iusto vel consequuntur est dolor.,5
320,384963978,2025-02-09,Enim laudantium pariatur nesciunt saepe quibusdam quae magnam dolorem placeat eligendi.,3
321,265376711,2025-02-10,Commodi voluptates dignissimos natus modi alias doloribus ipsam voluptate assumenda quaerat praesentium aperiam veniam.,2
321,261965569,2024-11-20,Assumenda ullam laudantium cum minima pariatur quisquam a.,6
321,801784372,2025-04-24,Animi omnis odit rem fuga rerum nemo at quidem provident atque.,1
322,488481576,2024-07-11,Excepturi blanditiis voluptates nemo fugit similique eius porro.,7
322,310818232,2024-10-29,Esse in aspernatur quam modi tenetur quibusdam perferendis facere reiciendis exercitationem.,4
322,824531293,2024-10-05,Deleniti recusandae dolorem debitis sed error adipisci voluptate aspernatur.,3
323,717291441,2024-08-07,Doloremque laborum necessitatibus veritatis quod est ad esse modi adipisci fugiat reiciendis repellat.,1
323,108315393,2023-08-27,Distinctio aperiam alias recusandae exercitationem commodi recusandae qui.,2
323,579522135,2024-05-17,Modi nemo sequi alias laboriosam laudantium repudiandae repellendus.,6
324,717291441,2025-05-11,Mollitia iste neque perferendis assumenda rerum facere suscipit ea impedit recusandae iure.,4
324,486934158,2025-04-27,Inventore quasi ex architecto iure corrupti modi.,6
324,502640062,2025-05-05,Aspernatur voluptas vel eveniet animi ab.,6
325,764712099,2025-05-08,Earum aut minus rerum necessitatibus debitis alias fuga ipsa repudiandae voluptatem magni ipsam.,3
325,488481576,2025-05-08,Maiores quae assumenda beatae libero in animi commodi ipsam consequatur consequuntur dignissimos nemo illo.,4
325,170449924,2025-05-09,Voluptatum sint nam alias commodi natus.,3
326,310818232,2024-10-31,Qui similique reiciendis modi pariatur ipsum totam soluta beatae excepturi eveniet quisquam.,4
326,745051308,2025-02-24,Adipisci repellendus ullam laborum dicta rem hic repellendus tempora nisi.,2
326,602868621,2025-02-10,Dicta nam est assumenda hic ad suscipit temporibus repudiandae.,6
327,19348520,2024-01-28,Praesentium itaque quisquam quidem harum accusamus ullam ullam adipisci quo pariatur.,7
327,108315393,2024-09-14,Excepturi voluptas itaque sed laborum praesentium odio eveniet tempore vel laboriosam ullam.,6
327,717291441,2025-03-01,Error laudantium ipsa quas laborum unde quae officia quas pariatur occaecati.,4
328,468498243,2024-02-10,Voluptatibus consequuntur voluptate fugiat dolor facere dolor minima pariatur vero praesentium quam culpa.,3
328,745051308,2024-11-16,Similique nisi commodi saepe repellat vitae occaecati amet cum quaerat repellendus ipsum.,1
328,476744407,2024-05-24,Sit doloremque autem itaque aliquam aspernatur ipsa repellat.,2
329,604679753,2024-10-13,In aut ipsam repudiandae explicabo expedita repudiandae in quaerat eius nesciunt quos laboriosam.,4
329,678358037,2023-07-06,Neque laboriosam ipsa quae veniam libero nemo autem ipsum consequuntur nam aperiam ex tenetur.,7
329,518808435,2024-12-17,Praesentium doloribus libero adipisci accusamus rem esse aliquam blanditiis cupiditate sapiente modi non.,7
330,579522135,2024-06-29,Aliquid laborum assumenda tempore magnam voluptatibus doloribus ratione possimus quod beatae.,2
330,602868621,2024-10-31,Optio iste ab illo blanditiis commodi ab.,1
330,678358037,2025-03-14,Voluptates consectetur minima dicta possimus accusantium.,5
331,170449924,2025-01-16,Nobis quae nesciunt fuga libero voluptates.,6
331,265376711,2025-03-16,Doloribus veritatis quaerat exercitationem sed repudiandae inventore nihil consequatur repellendus odit saepe nostrum.,1
331,717291441,2024-12-10,Dicta tempore nobis dolor ipsam recusandae non inventore maxime consequuntur.,3
332,488481576,2024-04-27,Natus soluta magnam consequuntur eum repudiandae inventore vero dolorum quo.,4
332,706028730,2023-11-04,Nesciunt autem molestiae nobis quisquam tempore nisi explicabo accusamus dolorem autem.,1
332,482947700,2024-01-09,Magnam quasi autem et laboriosam ipsa nisi reiciendis architecto rem soluta ab officiis.,5
333,429691303,2025-02-26,Natus atque asperiores vero totam natus corrupti temporibus velit quia quo accusamus.,6
333,723173418,2025-04-19,Ipsum deleniti autem nihil accusamus in temporibus cumque.,5
333,118421027,2025-03-31,Fugiat perferendis dolor dicta explicabo quasi nostrum repellendus quis.,5
334,19348520,2025-01-15,Cupiditate non dolorum voluptate praesentium veniam tempore.,3
334,717291441,2025-02-19,Asperiores quae libero itaque quod reiciendis.,3
334,108315393,2025-03-04,Saepe expedita quisquam quod excepturi rerum necessitatibus maiores repudiandae repellat id asperiores optio commodi.,3
335,801784372,2024-04-11,Iste vero impedit suscipit accusantium id repudiandae suscipit maiores quod enim culpa.,7
335,518808435,2025-03-29,Explicabo quibusdam quo sed aliquam optio quos aut accusamus voluptate beatae.,2
335,717291441,2024-11-14,Quisquam optio dolore incidunt adipisci ut deleniti laboriosam.,7
336,486934158,2024-12-15,Delectus ab expedita doloribus laboriosam odio vitae maxime commodi facilis.,4
336,261965569,2025-04-03,Reiciendis provident fugit quis explicabo eos vitae eveniet cupiditate possimus illum aspernatur eaque.,2
336,310818232,2025-02-09,Nam illo ut libero ex at ut molestias in error.,4
337,745051308,2025-05-03,Rerum distinctio eum autem dignissimos sunt.,5
337,118421027,2025-04-02,Recusandae saepe officia in illum voluptate deleniti est hic quod necessitatibus eveniet.,6
337,563746866,2025-03-28,Fuga quae voluptatibus illum maiores at id ut odio.,1
338,288452296,2025-03-13,Aspernatur eligendi mollitia nam aperiam blanditiis fugit aspernatur esse est voluptates minima corrupti.,7
338,52362735K,2024-10-06,Voluptas illum porro laboriosam numquam ipsa nemo doloribus modi molestiae quam iure rerum rem.,6
338,76761221,2025-05-03,Ut magnam ad quisquam dicta eveniet ut amet praesentium nihil.,1
339,500961252,2024-09-24,Quis cumque asperiores accusamus similique numquam architecto cum similique soluta.,1
339,76761221,2025-01-03,Voluptates in quasi vero tenetur eius odio dolorem temporibus soluta ex ipsa iure.,3
339,738874307,2024-11-21,Doloribus animi incidunt sapiente quisquam quibusdam porro suscipit soluta est nam ut voluptatibus optio.,1
340,649665834,2024-10-29,Fugiat repellat rerum quos quam eveniet eligendi architecto eaque quia.,5
340,602868621,2025-02-16,Porro sit vitae vitae labore incidunt ipsam.,4
340,813950057,2024-12-07,Minima nobis debitis labore impedit pariatur non praesentium voluptate repellat accusantium nulla aliquam.,1
341,170449924,2025-05-04,Facere asperiores molestias laboriosam quibusdam quae vero veritatis distinctio aut dolore.,4
341,602868621,2025-04-17,Modi asperiores quo ad suscipit accusantium laborum.,7
341,482947700,2025-04-22,Labore mollitia accusantium placeat error ea minus ratione illum.,6
342,7493924,2024-02-27,Incidunt deserunt quis enim provident nesciunt laudantium accusamus aut vitae.,7
342,500961252,2024-05-17,Amet eos quia perferendis suscipit ullam in.,7
342,261965569,2024-03-27,Nesciunt quidem nisi laboriosam qui maxime quia velit voluptate eius voluptas dolor cumque.,6
343,468498243,2025-04-14,Quia atque rem consectetur quam aperiam suscipit dolor facilis ab voluptatem ratione nisi.,5
343,310818232,2025-04-21,Earum quae porro rem qui dolore impedit facilis dicta officia nostrum laudantium laboriosam.,4
343,738874307,2025-04-06,Ratione ducimus vel ipsam incidunt debitis perspiciatis quam ipsam cumque labore nam.,6
344,649665834,2024-10-01,Accusantium temporibus unde numquam suscipit eveniet quis alias.,5
344,602868621,2024-10-31,Aut unde adipisci tempora amet quae facilis odio repudiandae.,1
344,486934158,2025-03-24,Quidem impedit consequuntur cupiditate exercitationem molestias commodi dicta iure iure.,6
345,649665834,2025-02-04,Voluptatibus sunt ratione molestiae laboriosam dolorum culpa voluptatibus necessitatibus saepe modi aspernatur cumque distinctio.,2
345,706028730,2025-05-05,Quidem voluptatum delectus tenetur at nobis veritatis tempora cupiditate incidunt cupiditate magnam earum.,4
345,429691303,2025-01-21,Illum explicabo odit assumenda quaerat sequi autem fugiat cum.,1
346,824531293,2024-04-03,Laudantium veritatis ad reiciendis repellendus incidunt harum.,1
346,310818232,2024-08-22,Commodi cupiditate nisi repellat rem officia nihil amet libero eius alias amet dolor.,4
346,723173418,2024-01-05,Recusandae optio enim sequi neque ullam ab laborum voluptas molestias.,3
347,801784372,2024-09-09,Voluptatum provident cum ea fugiat sed quod ullam maiores.,2
347,717603192,2025-04-29,Vitae nostrum totam quas mollitia doloribus minus quasi nostrum adipisci.,4
347,824531293,2024-10-01,Cum explicabo dolore cumque possimus doloremque enim natus minus debitis.,4
348,649665834,2025-04-21,Ratione soluta repudiandae consectetur similique pariatur accusantium eum accusantium.,3
348,518808435,2025-04-17,Explicabo voluptatum et eaque rem necessitatibus atque praesentium dolores consequatur.,3
348,706028730,2025-05-07,Quasi tempore corrupti necessitatibus delectus quos ipsa tenetur ullam fugiat.,3
