id_articulo,rut_revisor,fecha_revision,comentarios,calificacion
89,518808435,2024-07-03,Officiis delectus veritatis quaerat alias modi perspiciatis rerum excepturi molestias corporis.,3
89,738874307,2025-03-28,Atque id cumque corporis veritatis suscipit cupiditate illo.,6
90,604679753,2025-03-05,Quas harum cum est earum temporibus atque nam similique dicta.,3
90,52362735K,2024-07-01,Ratione consectetur illum explicabo architecto est ab.,3
90,82810988K,2024-10-01,Aut ratione iusto non odit expedita debitis ad dolorum odit.,1
91,649665834,2025-04-23,Deserunt fuga natus exercitationem harum quia assumenda impedit ex aliquam enim.,1
91,170449924,2024-10-08,Tempore ullam minus magni eius repellat eveniet.,4
91,123403398,2024-04-12,Voluptatibus officiis excepturi reiciendis dolores aperiam minus voluptatem minima.,3
92,482947700,2025-01-20,Qui neque beatae quibusdam porro officia dolorum repellendus qui reiciendis.,4
92,678358037,2025-04-26,Nostrum quae ipsa doloribus atque autem error reiciendis facilis consequuntur veniam.,6
92,706028730,2025-03-08,Omnis aliquid incidunt magnam fugit quidem voluptatibus voluptatem.,3
93,604679753,2025-04-27,Minus et blanditiis aperiam sed enim maiores voluptas.,2
93,261965569,2025-05-06,Vel illum maxime aspernatur eaque ex mollitia.,1
93,706028730,2025-05-09,Molestias adipisci excepturi dolores dolorem eveniet.,7
94,502640062,2024-10-31,Itaque laudantium repudiandae quam inventore nisi.,1
94,649665834,2024-09-18,Quasi accusantium nobis dolorum maiores voluptatem blanditiis cupiditate quae minima nam quaerat at.,3
94,482947700,2025-02-17,Repellendus sint natus nesciunt soluta quidem nulla.,3
95,723173418,2024-11-01,Culpa explicabo culpa rem praesentium neque odit commodi.,5
95,52362735K,2024-12-09,Aliquid reiciendis dolorum distinctio debitis maiores alias possimus sed ad quaerat et.,3
95,170449924,2024-08-15,Corporis recusandae magnam neque inventore iste veniam fugiat ipsa.,6
96,108315393,2025-02-11,Quae dolor dignissimos voluptatem quos aspernatur voluptatibus nam non placeat.,6
96,486934158,2025-04-15,Eius provident laboriosam odit ipsa mollitia beatae doloremque aspernatur ad nesciunt sit hic.,1
96,310818232,2025-02-22,Vero eveniet delectus amet deserunt quisquam blanditiis similique suscipit.,2
97,813950057,2024-02-14,Dolorum aperiam optio reprehenderit consequatur consectetur esse delectus quas temporibus cumque enim optio.,3
97,502640062,2024-02-10,Iusto tempore esse odit quibusdam eos distinctio repellat dicta.,1
97,335015215,2024-03-01,Sequi veritatis sint nulla accusamus voluptates.,4
98,463840083,2025-02-14,Provident repudiandae nam dolor excepturi quod eum assumenda perspiciatis.,5
98,261965569,2024-03-08,Nostrum totam quas voluptate odio molestiae maiores quisquam perferendis corrupti doloremque sint.,1
98,563746866,2024-12-05,Recusandae unde pariatur iusto debitis odio a perspiciatis ipsam.,6
99,649665834,2024-02-05,Nulla reprehenderit animi ut modi quos doloribus inventore veritatis dolores deleniti error placeat.,5
99,486934158,2024-11-11,Quisquam eveniet commodi aliquid quasi ullam officia doloremque sequi.,5
99,604679753,2023-10-22,Excepturi quas adipisci harum nesciunt molestias dolores et nulla esse ea.,2
100,265376711,2025-03-02,Mollitia quod voluptas dignissimos enim minus quibusdam nihil consequuntur assumenda quas cumque officia.,7
100,502640062,2025-04-11,Eos sunt fugiat repudiandae maiores neque itaque architecto quod.,6
100,261965569,2025-03-05,Eum non perferendis labore ut optio reiciendis enim.,3
101,706028730,2025-03-16,Excepturi eligendi consequatur deserunt iste necessitatibus dolores.,3
101,606167458,2025-04-27,Esse blanditiis voluptates est error accusantium doloribus ab ullam accusamus.,7
101,532645603,2025-03-13,Voluptatum rem tempore error atque corporis doloremque odit alias sit.,5
102,468498243,2024-12-13,Laborum praesentium similique fuga tempora impedit sint perspiciatis nulla laboriosam sequi.,3
102,604679753,2024-05-20,Ex magni minima ex non aut.,4
102,649665834,2024-09-29,Numquam dolore ex dignissimos officiis harum voluptate nostrum ea excepturi.,5
103,719733581,2023-11-25,Dolores animi eos porro ex recusandae accusantium reiciendis molestiae.,5
103,801784372,2024-12-23,Iusto similique nostrum commodi impedit est praesentium vitae veniam.,3
103,52362735K,2024-02-02,Repellat ratione necessitatibus reprehenderit earum architecto a nulla architecto necessitatibus aliquid odio animi molestiae.,2
104,649665834,2024-12-02,Eos enim reiciendis maxime hic eos dolore esse voluptate iusto eveniet eos.,1
104,604679753,2025-03-10,Eligendi sit cumque harum officia ducimus excepturi dolorum.,6
104,476744407,2025-03-08,Quae magnam deleniti corrupti neque assumenda beatae voluptatum vitae sed incidunt voluptate illo.,2
105,476744407,2025-03-29,Dolores voluptatem ea animi sed accusamus nulla.,7
105,19348520,2024-11-20,Nesciunt iusto ad deleniti ducimus veritatis eaque earum rem inventore in porro doloremque.,1
105,429691303,2025-02-18,Laborum voluptatem error dolor expedita iusto iste.,3
106,76761221,2025-05-04,Repellat blanditiis quibusdam consequuntur quam quam inventore amet.,4
106,602868621,2025-01-01,Reprehenderit quis ab enim temporibus enim officiis odio alias reiciendis nihil explicabo.,7
106,429691303,2024-07-28,Quaerat deleniti consequatur sed hic cum cupiditate soluta maiores.,1
107,482947700,2024-10-21,Placeat iste molestiae tenetur cupiditate rerum quam velit.,7
107,486934158,2024-07-24,Praesentium molestiae nulla saepe quidem aperiam reiciendis quae.,5
107,745051308,2025-02-14,Voluptas delectus dolore eaque cum eos molestias magnam delectus quod minima incidunt minima.,3
108,500961252,2025-03-16,Omnis consequatur recusandae consectetur doloribus veritatis voluptatem modi fugit nostrum suscipit.,3
108,19348520,2025-03-06,Non eos dolorem non amet aspernatur.,1
108,518808435,2025-04-17,Inventore libero deserunt nobis suscipit inventore ex vitae et iste beatae.,2
109,82810988K,2023-10-24,Officiis dolore natus facere exercitationem odio vel quae ut dignissimos ullam.,2
109,723173418,2025-01-16,Assumenda repudiandae repellat adipisci quos sint iste reiciendis.,5
109,170449924,2024-02-21,Neque sunt expedita ab occaecati qui.,6
110,19348520,2025-04-28,Id sint distinctio animi id quisquam itaque distinctio placeat vero commodi.,1
110,813950057,2025-04-07,Quas similique saepe non qui minus repellendus unde labore.,7
110,482947700,2025-04-03,Facere animi odit delectus adipisci expedita numquam totam.,3
111,717291441,2025-04-24,Corrupti consequuntur laboriosam reiciendis tempore sequi tenetur numquam dicta.,4
111,82810988K,2024-03-14,Recusandae vel ipsa nisi ipsa voluptatibus asperiores rem in repellat ea corrupti.,3
111,265376711,2024-04-19,Sed quae qui nobis vero dicta reiciendis eligendi perspiciatis amet.,6
112,717603192,2024-03-03,Dolorum vel aliquid eligendi omnis veritatis ut nesciunt vitae omnis veritatis sint.,2
112,579522135,2024-12-29,Unde enim eos numquam exercitationem quis beatae iusto ab odit.,1
112,604679753,2024-05-27,Ex culpa atque qui beatae quidem libero fugit.,4
113,801784372,2023-12-29,Commodi sapiente nisi laudantium exercitationem accusantium.,2
113,764712099,2024-06-25,Delectus consectetur aspernatur provident qui ducimus possimus atque beatae perspiciatis totam pariatur adipisci.,1
113,579522135,2024-08-01,Iure aliquid quam ipsum quo sit dicta eos sequi quaerat voluptas.,3
114,801784372,2024-11-15,Numquam aperiam officiis unde culpa corporis minus cum dignissimos possimus rem sit.,3
114,813950057,2024-06-16,Nisi eligendi doloremque dolorem deserunt aut ipsum vero ducimus dicta ex perspiciatis molestiae.,1
114,52362735K,2025-03-15,Tempore ipsa quod tempora ipsam ducimus ipsa adipisci numquam itaque nostrum nostrum facilis.,4
115,308396703,2025-04-14,Nostrum possimus at repudiandae rem quis debitis quas molestiae libero.,6
115,265376711,2024-09-05,Aliquam corrupti iure eveniet reiciendis ab aperiam.,7
115,764712099,2024-12-20,Numquam nobis aut necessitatibus nemo labore mollitia.,6
116,649665834,2025-05-11,Odio voluptatem rem eum quibusdam dicta excepturi mollitia eos itaque ullam.,5
116,723173418,2025-02-13,Vitae fuga nam itaque in iusto.,1
116,745051308,2024-07-06,Dolores iure alias natus eligendi eligendi est sed dolore at optio facere consequatur.,6
117,723173418,2024-05-20,Tempora sit nesciunt voluptatum tenetur asperiores libero iusto eius neque debitis placeat laborum.,6
117,486934158,2024-01-31,Ratione eius at sequi nesciunt illo harum porro.,6
117,482947700,2024-05-12,Voluptatum tempore dolores est iste vel magni officia velit numquam nemo explicabo accusantium.,6
118,265376711,2025-05-02,Nihil adipisci perferendis dolorem quia labore officiis porro reprehenderit.,6
118,553961653,2025-05-03,Minima qui dolores officia neque totam amet voluptatibus accusamus reprehenderit porro ipsa.,4
118,738874307,2025-04-06,Amet distinctio reiciendis dolore nam dolores libero fuga quae expedita.,4
119,170449924,2024-02-14,Esse magnam enim eum autem aliquam corporis nobis numquam nesciunt aperiam.,6
119,553961653,2024-01-08,Eius repellat at eveniet id nemo commodi enim molestiae odit quidem.,1
119,745051308,2024-06-01,Asperiores quibusdam inventore voluptate officia fuga minus.,2
120,170449924,2025-02-27,Aspernatur nulla maxime aut et consectetur neque quia.,7
120,52362735K,2025-04-18,Et voluptatibus animi facilis laborum culpa deleniti totam.,2
120,649665834,2025-04-04,Autem est sed accusamus eius minus numquam sapiente perspiciatis labore.,1
121,52362735K,2025-04-05,Aspernatur enim architecto nesciunt fuga sunt at aspernatur doloremque veniam.,5
121,532645603,2025-02-19,Repellendus est libero enim velit ex explicabo eveniet dicta quis laborum.,5
121,606167458,2025-03-15,Temporibus ipsum distinctio iure ducimus rem dolor maxime non nesciunt.,6
122,476744407,2024-07-12,Quam quibusdam recusandae reiciendis voluptates mollitia aliquam voluptatem soluta autem eaque.,7
122,288452296,2024-08-27,Sint quos cupiditate incidunt totam consequatur veritatis doloremque dolorum eos nulla quam ratione.,7
122,563746866,2024-07-21,Error laborum mollitia necessitatibus explicabo ipsum enim impedit dolorum neque a voluptas qui.,4
123,118421027,2025-03-29,Aperiam suscipit error perferendis perferendis autem distinctio.,4
123,604679753,2024-11-15,Cumque nihil fuga in id modi dolore dolorem a accusamus omnis ullam ullam.,5
123,563746866,2025-03-07,Atque dolor nam eligendi quas quod fugiat.,7
124,745051308,2024-12-24,Corrupti nihil distinctio dolores earum culpa voluptas.,1
124,468498243,2025-01-02,Perferendis cumque aperiam porro ad iure corporis nesciunt odio.,3
124,738874307,2025-02-07,A maxime ipsam at quaerat quidem eius voluptate odio illum aliquid.,2
125,486934158,2025-05-07,Sunt quia expedita laudantium tempora eum.,2
125,801784372,2024-09-16,Impedit magni placeat consequuntur necessitatibus reprehenderit voluptatum eum.,2
125,649665834,2025-01-15,Accusantium modi expedita aspernatur esse odit odio labore saepe sed.,7
126,602868621,2024-05-29,Eaque neque sequi laudantium exercitationem quasi commodi facilis et atque autem.,1
126,482947700,2024-05-09,Rem itaque corrupti consequuntur incidunt beatae id distinctio autem.,5
126,553961653,2023-12-12,Optio quaerat aliquid doloremque voluptates voluptatibus illo distinctio corporis reprehenderit.,1
127,649665834,2024-09-09,Necessitatibus earum provident sapiente libero consectetur labore accusantium et alias ea dignissimos.,6
127,706028730,2024-10-03,Eos eius fugiat praesentium cupiditate optio fugit et.,4
127,518808435,2025-03-20,Debitis assumenda velit unde ducimus repellendus dolor sunt praesentium officiis quos ea.,6
128,579522135,2024-03-21,Quasi laborum illum aspernatur possimus itaque iure quas.,7
128,717291441,2024-11-23,Molestiae illum labore error officia nihil mollitia.,6
128,563746866,2025-04-19,Veniam fuga magnam necessitatibus placeat modi adipisci dolore.,4
129,801784372,2024-12-18,Accusamus nam cumque voluptate possimus repudiandae nostrum corrupti quae nesciunt officia.,5
129,764712099,2024-12-14,Quia dolorum inventore optio cumque dolores officia ipsa.,1
129,824531293,2025-02-25,Commodi ratione eaque voluptates provident sequi dolore totam beatae asperiores eligendi repudiandae.,3
130,717291441,2023-12-06,Laudantium repellat et dolore quis eum occaecati repudiandae id.,2
130,310818232,2023-12-23,Atque fuga repellat debitis eligendi reprehenderit reprehenderit fugiat itaque.,3
130,335015215,2025-04-19,Alias accusantium repellat blanditiis magni quasi veritatis officia maxime tempora.,4
131,76761221,2024-09-17,Velit similique quasi a quia dignissimos atque voluptatem voluptates.,7
131,500961252,2024-12-24,Tempore similique minus animi nobis assumenda tenetur facilis repudiandae magnam odit officia.,1
131,170449924,2023-10-23,Voluptatem corporis quam aut nesciunt recusandae ipsa ut necessitatibus reprehenderit.,1
132,820677293,2024-08-04,Adipisci harum expedita vel beatae debitis.,1
132,500961252,2024-08-07,Dolorum dolorum voluptatem minima maiores officia praesentium reprehenderit deserunt asperiores neque minus praesentium.,2
132,429691303,2024-03-03,Quasi consectetur perferendis quia nesciunt omnis.,2
133,738874307,2024-07-15,Temporibus tempore cumque necessitatibus cum libero laudantium quam aliquam placeat.,3
133,384963978,2025-03-03,Consectetur non deleniti illo fugiat minus blanditiis id quaerat quia incidunt quaerat.,5
133,265376711,2025-03-01,Voluptas hic quisquam minima laudantium sit.,2
134,801784372,2024-04-26,Animi necessitatibus consequatur aut suscipit et praesentium dignissimos libero tempora enim officiis.,6
134,118421027,2024-10-08,Dolores officia nostrum accusantium voluptatibus dolor dolorem qui natus eligendi.,6
134,604679753,2024-09-21,Consequuntur error ipsa illo unde voluptates quisquam temporibus culpa quisquam inventore soluta voluptatem.,3
135,500961252,2024-05-13,Voluptate vero vel eveniet et mollitia nemo sapiente dicta.,3
135,532645603,2024-07-15,Ipsam vel laborum incidunt et quod ea id quis porro.,7
135,678358037,2024-04-28,Necessitatibus praesentium tenetur commodi ipsa repellendus fugiat placeat velit eligendi.,1
136,719733581,2025-03-23,Provident exercitationem amet dolorem occaecati dolores nobis iure laboriosam cupiditate.,2
136,123403398,2025-01-11,Esse quis neque quis nulla eaque eum quae at nobis.,5
136,52362735K,2024-12-12,Sapiente cum sit eaque cupiditate est.,1
137,288452296,2025-01-15,Deleniti tempora quas laboriosam tempore aperiam repudiandae repellendus illo esse exercitationem reiciendis praesentium cupiditate.,5
137,719733581,2025-05-06,Sit nesciunt nisi corporis rem quis illum.,6
137,424016810,2025-03-25,Dolore in consectetur nihil quam vero cum aut laudantium minus et repudiandae delectus.,4
138,500961252,2025-04-04,Ullam quas cum laboriosam repudiandae quos doloribus ab modi corrupti odio.,1
138,288452296,2025-05-02,Alias nesciunt culpa reprehenderit dolor nostrum doloribus ducimus atque porro doloribus ut sunt.,2
138,19348520,2025-04-10,Inventore voluptatem facere alias voluptas aut iste delectus commodi quis porro est inventore.,4
139,553961653,2024-09-28,Perspiciatis veritatis a iste quae voluptate illo ad velit temporibus beatae libero.,3
139,824531293,2024-11-13,Quam placeat illum quo alias quaerat repellendus autem tenetur quae sequi a.,3
139,764712099,2025-02-25,Voluptatum nihil architecto sapiente harum adipisci recusandae esse perspiciatis iusto placeat itaque.,6
140,532645603,2025-05-05,Eveniet molestias ea fuga repudiandae illo explicabo.,3
140,764712099,2025-05-02,Natus delectus adipisci accusantium rerum quas et.,2
140,717603192,2025-04-26,Laboriosam ad odit magni laudantium maxime adipisci magni ipsum sint accusamus nihil distinctio.,3
141,847822864,2023-12-22,Accusamus iusto laborum hic quis temporibus.,7
141,52362735K,2024-06-09,Odit veritatis non quam officiis quisquam nobis voluptas.,2
141,532645603,2024-03-01,Omnis nam labore dolore fuga a est incidunt.,5
142,118421027,2025-05-08,Quod veniam nemo dolorum ullam porro facere iste cum distinctio consequuntur facere.,2
142,429691303,2025-05-11,Reprehenderit occaecati suscipit dolorum tempora sapiente quod.,6
142,384963978,2025-05-06,In quo eos ullam aliquam praesentium fugit minus vel quis magnam odit est.,2
143,532645603,2024-11-24,Quisquam dolor sequi harum ex minus quis ipsum quisquam dignissimos minus perspiciatis.,7
143,308396703,2024-03-11,Laudantium eius et consectetur deserunt perspiciatis sint excepturi vitae deserunt similique eligendi.,1
143,118421027,2025-03-12,Commodi impedit molestias dolorum autem sapiente dolorem laboriosam harum qui veniam deserunt.,1
144,719733581,2025-02-18,Veritatis iste at quaerat ex accusamus aspernatur cum occaecati labore.,4
144,424016810,2025-04-10,Distinctio nam odit totam vero necessitatibus pariatur voluptas qui dolores ullam.,1
144,532645603,2025-02-28,Ut voluptatibus voluptatum rem est laudantium excepturi quis nemo.,1
145,706028730,2025-04-25,Aliquid illum aperiam autem illo fugit eius.,7
145,764712099,2025-04-15,Pariatur quos perferendis odit nobis necessitatibus adipisci possimus.,2
145,288452296,2025-04-13,Nulla minima omnis tenetur quidem minima nihil officiis delectus ex impedit et.,3
146,429691303,2025-01-22,Temporibus odit consequatur magni reprehenderit magni amet incidunt cum labore quidem.,1
146,719733581,2024-08-30,Tempora dolorem porro placeat dolor porro quasi asperiores excepturi repellat consectetur ducimus.,7
146,488481576,2025-02-12,Praesentium hic sed a porro tenetur itaque eveniet deleniti saepe ipsa.,4
147,764712099,2024-11-09,Dolores magni ullam officia tenetur tempora sint distinctio fuga.,6
147,579522135,2025-02-28,Nulla ea placeat corrupti excepturi magnam rerum unde modi laborum ab repellat.,2
147,678358037,2024-12-22,Commodi sequi aut dolor distinctio culpa error natus architecto pariatur nostrum.,3
148,649665834,2024-02-17,Eos placeat corporis dignissimos laboriosam laboriosam exercitationem.,2
148,123403398,2024-02-11,Aperiam aperiam neque non magnam nam commodi asperiores reiciendis dolorum.,4
148,310818232,2024-02-25,Nesciunt fugit minima quasi rerum soluta ad nobis neque ex quaerat quibusdam cum.,7
149,310818232,2025-01-06,Magni laboriosam pariatur atque alias in doloremque tempore vitae.,3
149,476744407,2024-06-26,Sed doloremque asperiores ad repellat commodi ratione.,5
149,488481576,2024-05-19,Officiis maiores magni provident ipsam praesentium est cumque.,3
150,118421027,2025-01-23,Voluptatum voluptatem magnam atque dicta nostrum esse odit sunt et occaecati.,5
150,706028730,2025-05-03,Dolor quidem dolorum corporis voluptatibus hic voluptatum iusto itaque fuga sapiente sed natus.,3
150,288452296,2023-11-04,Rerum repudiandae similique vitae velit quidem accusantium.,1
151,717291441,2024-11-22,Asperiores explicabo autem iusto ullam autem expedita cum aspernatur iste aut labore.,4
151,82810988K,2025-04-14,Itaque quidem maiores architecto commodi accusamus itaque adipisci porro.,7
151,500961252,2025-03-13,Iure blanditiis vitae sit voluptates tempore corrupti qui facere eius alias expedita.,1
152,52362735K,2024-07-29,Perspiciatis perspiciatis perferendis amet dolore eum occaecati eaque laboriosam consequatur vero fugiat.,4
152,532645603,2024-01-19,Itaque asperiores quam animi optio veritatis aut maxime soluta distinctio sapiente.,5
152,76761221,2025-03-31,Quam error magnam pariatur et ab deleniti officia a rerum quis minima sapiente.,7
153,502640062,2025-04-28,Praesentium ex nam officiis iste recusandae maiores minima blanditiis delectus voluptatem.,3
153,308396703,2024-11-17,Impedit ratione culpa vel ab perferendis accusantium quis.,4
153,738874307,2025-04-02,Ullam laudantium laboriosam ducimus perspiciatis esse.,2
154,488481576,2024-08-26,Sunt itaque inventore quisquam unde molestiae et alias corrupti iure voluptates illo labore.,5
154,384963978,2024-07-03,Dignissimos quas incidunt debitis sint nostrum possimus consequuntur culpa.,2
154,261965569,2025-03-12,Voluptatum odit facilis nihil magni voluptas.,6
155,500961252,2024-01-31,Iusto recusandae repellat officia quam commodi officia eos hic aut impedit explicabo facere.,3
155,288452296,2024-11-06,Fugiat itaque temporibus non nam possimus maxime quos placeat voluptatem ea.,6
155,533052614,2025-01-02,Dolore reiciendis ipsa occaecati laborum sit id.,6
156,824531293,2024-08-31,Maxime velit ex aut tenetur temporibus veniam et fuga facere mollitia.,3
156,486934158,2024-08-14,Placeat iure quisquam vitae illo cupiditate.,6
156,717291441,2024-08-23,Magnam a aliquam incidunt ullam odio sed placeat.,2
157,824531293,2024-09-01,Iste distinctio placeat nemo dolorum quos.,2
157,719733581,2024-09-07,Aspernatur corporis aut pariatur in vel.,2
157,52362735K,2025-04-03,Nihil nam architecto deserunt ratione iste.,5
158,476744407,2023-11-20,Aliquid voluptatum perferendis repudiandae odio asperiores aperiam laborum possimus.,6
158,723173418,2024-01-29,Incidunt culpa fugit laudantium omnis aperiam illo quisquam asperiores perspiciatis dicta velit.,3
158,170449924,2025-04-11,Ipsum ea harum animi voluptate beatae modi vel doloribus.,6
159,813950057,2025-01-12,Beatae culpa et nam voluptatem optio iusto reprehenderit.,2
159,579522135,2024-11-30,Ducimus laborum cum iusto at rerum ex distinctio laboriosam sint illo.,3
159,502640062,2025-04-01,Voluptatibus unde odio porro maxime inventore amet quod voluptas cumque.,1
160,563746866,2024-04-05,Asperiores a ducimus iure fuga magni saepe corporis repellat quia.,6
160,108315393,2023-11-23,Tempore possimus eveniet labore officia maiores debitis nesciunt mollitia.,3
160,19348520,2024-01-20,Placeat facilis officia velit perferendis facilis suscipit molestiae voluptas.,4
161,170449924,2023-12-11,Consequuntur incidunt totam blanditiis distinctio neque.,7
161,847822864,2024-08-03,Inventore pariatur deleniti provident perspiciatis laudantium cupiditate illo eius laudantium quibusdam explicabo officiis ipsam.,7
161,723173418,2024-05-05,Quam nihil nam ipsum adipisci alias quidem nam fugit vel sunt ea commodi.,7
162,745051308,2025-05-08,Quidem pariatur blanditiis alias ea possimus modi soluta corporis blanditiis.,1
162,579522135,2025-05-10,Optio quas tempore voluptas officiis officia.,6
162,482947700,2025-05-10,Perferendis velit vero itaque omnis laboriosam autem neque quaerat cumque minus.,7
163,717603192,2024-09-03,Inventore laudantium exercitationem architecto repudiandae provident alias voluptatem.,5
163,518808435,2025-01-17,Error aliquam inventore tenetur ratione quia.,7
163,118421027,2025-05-01,Quia assumenda sequi explicabo fugiat tenetur tenetur repellendus dolorum quis a placeat.,6
164,579522135,2025-04-19,Quasi laudantium officiis enim dolorum tenetur perspiciatis cupiditate.,7
164,563746866,2025-03-29,Blanditiis cupiditate culpa labore nesciunt fugit similique aspernatur fugit id.,3
164,19348520,2025-03-27,Modi sunt expedita pariatur vitae dolor animi laudantium officiis.,3
165,108315393,2024-11-09,Voluptas veritatis commodi accusamus eos modi quia praesentium accusamus impedit eveniet illum.,5
165,170449924,2024-06-23,Necessitatibus quibusdam neque sint nostrum modi.,2
165,678358037,2025-04-14,Aperiam ratione iure minima exercitationem quod architecto omnis.,4
166,706028730,2025-05-07,Tempore corrupti magnam neque non aliquam nulla veritatis.,6
166,801784372,2025-04-19,Consequatur accusantium eius mollitia recusandae autem quis.,1
166,310818232,2025-05-09,Voluptatibus beatae error quisquam autem in repellendus libero dolor.,1
167,288452296,2025-03-17,Aliquid cum repellendus odit laboriosam magnam eligendi molestias tempora provident quos.,2
167,738874307,2024-12-28,Qui nesciunt dignissimos libero molestiae nam.,6
167,563746866,2025-01-26,Alias assumenda aliquam excepturi quis cum velit suscipit.,1
168,563746866,2025-02-06,Qui beatae porro numquam expedita sunt eum harum.,4
168,82810988K,2025-04-18,Facere totam aut facere assumenda repellendus illo.,7
168,579522135,2025-03-24,Eius dolore asperiores quam dicta fugiat eum maiores sunt libero perferendis molestiae.,5
169,288452296,2024-02-12,Officiis quibusdam velit eos et esse nisi voluptatem ducimus cumque ex.,3
169,706028730,2025-03-13,Reprehenderit autem id aliquam deleniti accusantium illum eveniet enim cum maiores non.,4
169,649665834,2024-06-30,Earum beatae voluptas in eligendi ratione quaerat.,5
170,486934158,2025-03-27,Earum minima voluptatum quis ratione eum excepturi corrupti corporis assumenda iste quos animi.,5
170,824531293,2025-03-22,Enim corrupti quos voluptate libero ullam fugiat alias reprehenderit reprehenderit magnam similique.,2
170,813950057,2025-04-15,Id possimus inventore ut assumenda quasi omnis veritatis ipsa blanditiis quidem tenetur molestias.,4
171,717291441,2025-04-19,Quod illum nobis ducimus maxime quis itaque error.,7
171,19348520,2025-03-17,Velit inventore non id cupiditate doloribus praesentium maxime dolore.,4
171,579522135,2025-01-11,Aliquam quibusdam tempora rem veritatis totam aperiam dicta.,7
172,579522135,2024-09-04,Ab placeat eaque doloremque magni esse ducimus doloremque quas.,5
172,476744407,2024-04-12,Dicta cum porro asperiores et aspernatur recusandae quas minima impedit expedita dolores.,4
172,429691303,2025-04-01,Ullam aperiam iste dignissimos delectus nulla totam nobis recusandae animi.,6
173,7493924,2024-09-23,Consequuntur esse esse ex impedit vero ducimus laborum dolor omnis.,5
173,723173418,2024-09-19,Incidunt laboriosam quas saepe optio quisquam.,3
173,719733581,2024-12-15,Voluptate consequatur illum earum quis sequi tempora.,5
174,486934158,2025-05-06,Sint aliquid iure harum quidem pariatur unde sunt expedita in labore.,7
174,579522135,2025-05-02,Quia officiis debitis tempora accusamus animi itaque eaque aperiam at a velit optio.,1
174,532645603,2025-05-03,Iure iure iusto laborum error quidem magnam in alias non ducimus culpa.,1
175,500961252,2024-05-05,Ipsum aspernatur voluptates odio labore suscipit repellendus magni magni ducimus iure voluptas molestias.,4
