id_articulo,rut_revisor,fecha_revision,comentarios,calificacion
175,429691303,2024-11-24,Delectus possimus exercitationem aperiam ipsum nesciunt accusantium non odio dolorum occaecati.,6
175,717291441,2024-11-19,Officia iusto maxime aliquam possimus dignissimos sit.,1
176,717291441,2024-12-20,Quam dignissimos natus necessitatibus nesciunt facilis corrupti sint quis nostrum autem.,6
176,563746866,2024-10-03,Veritatis ratione aspernatur impedit voluptates reiciendis nesciunt deserunt facere odio.,2
176,764712099,2025-02-09,Dicta doloribus fugiat ratione ut corporis labore maiores est maxime labore odio cum.,7
177,738874307,2025-02-27,Culpa qui animi distinctio dolorum molestias sed natus reiciendis.,2
177,265376711,2025-04-19,Quasi consequuntur aspernatur magnam error quas rerum.,2
177,384963978,2025-02-16,Quidem odit nisi cupiditate architecto voluptatibus a explicabo iusto modi quasi.,7
178,500961252,2025-02-17,Quis temporibus quas recusandae vel consectetur numquam laboriosam facere velit.,6
178,532645603,2024-02-09,Alias eligendi qui modi aspernatur inventore minus nihil.,1
178,717291441,2024-02-28,Explicabo itaque dolorem aperiam asperiores ducimus ducimus omnis.,7
179,606167458,2024-12-02,Maiores alias quisquam accusamus rem numquam.,1
179,424016810,2024-11-13,Reprehenderit aut tempore dicta et quas explicabo esse ad perferendis blanditiis commodi neque.,3
179,678358037,2024-11-10,Dolorem sunt occaecati quia corporis magnam.,4
180,502640062,2024-08-27,Asperiores sunt unde omnis enim dolore harum.,1
180,649665834,2024-07-16,Totam minima dolores sed unde quibusdam architecto.,6
180,813950057,2024-12-12,Qui a ducimus consequuntur omnis laudantium sapiente.,1
181,486934158,2024-09-21,Numquam sunt aliquam ut provident molestias reiciendis dolorum.,1
181,308396703,2024-09-06,Suscipit voluptatibus neque explicabo vero voluptas maiores consequatur non numquam.,5
181,717291441,2023-10-21,Provident delectus illo rerum natus eaque fuga.,3
182,52362735K,2024-06-21,Minus necessitatibus error provident accusantium quidem maxime.,6
182,429691303,2023-12-15,Nulla enim perferendis facere est facilis cum eligendi occaecati ut minus unde.,4
182,265376711,2025-04-06,Quod eius ducimus at rem ea.,2
183,553961653,2025-05-04,Reprehenderit laboriosam error aut soluta quasi.,5
183,335015215,2025-02-28,Alias inventore explicabo aperiam sint laudantium beatae corporis dolores suscipit.,4
183,468498243,2025-05-03,Officiis distinctio asperiores excepturi iusto beatae distinctio quam quae voluptatibus optio odio.,6
184,429691303,2025-03-09,Animi libero eos voluptate inventore voluptatibus odio doloremque sit cupiditate.,1
184,502640062,2024-07-01,Alias odit debitis nam aliquam distinctio magnam eius.,3
184,764712099,2024-12-11,Molestias consequatur ut eos delectus animi tempora ad explicabo animi vitae occaecati neque.,5
185,719733581,2023-11-18,Veniam aperiam voluptates facilis quis placeat provident.,3
185,488481576,2024-06-17,Maxime necessitatibus odio placeat dolores harum.,7
185,604679753,2023-09-30,Dolor fugit soluta hic sint officia maxime possimus quis accusamus debitis consequuntur molestiae.,1
186,717291441,2025-01-21,Natus amet dolorum possimus iusto quos exercitationem nesciunt aperiam sunt quas impedit totam.,4
186,678358037,2023-08-31,Quod necessitatibus rerum rerum quibusdam quam accusantium ad amet beatae natus accusamus.,7
186,261965569,2024-10-03,Dolores amet doloribus est et illo unde fuga laudantium sunt eligendi pariatur.,4
187,19348520,2025-05-11,Repellendus ipsam blanditiis harum voluptatibus eum.,7
187,502640062,2024-10-04,Unde hic ut ex odit rerum.,6
187,429691303,2024-06-24,Quam distinctio tempora eveniet quaerat vero itaque cumque ipsa unde unde quae maiores.,1
188,563746866,2025-04-01,Asperiores quibusdam omnis reprehenderit voluptatum sunt eligendi dolores dolore pariatur suscipit tenetur.,6
188,719733581,2024-11-11,Ut adipisci ducimus tempore recusandae dolores veniam delectus nisi dolorum.,6
188,429691303,2024-12-25,Recusandae amet rerum nisi reiciendis amet quo quaerat nihil ratione in.,6
189,553961653,2025-03-01,Maiores labore ipsam eum debitis placeat tempore eaque veritatis aliquam.,2
189,488481576,2025-02-10,Alias soluta voluptatem blanditiis cum exercitationem soluta cupiditate porro aut iure.,4
189,82810988K,2025-03-30,Mollitia quod praesentium ipsa aut recusandae vel cumque officia nulla saepe sapiente.,5
190,606167458,2024-09-12,Vel veniam consectetur numquam modi ipsa nisi.,7
190,801784372,2025-04-10,Harum rerum reprehenderit vero nihil enim impedit ad eius aliquam quos.,1
190,719733581,2024-10-29,Quod quo nesciunt doloremque dolor nobis eius delectus tempora vel.,4
191,308396703,2024-10-12,Accusamus quae ullam accusantium alias recusandae.,5
191,738874307,2024-03-05,Repellat alias sint fugit laboriosam quasi provident modi saepe rerum adipisci cumque.,3
191,764712099,2024-02-16,Optio dolorum ex porro laborum nisi esse accusamus odio recusandae facilis aliquam dolores.,4
192,76761221,2024-12-03,Ex perferendis reprehenderit deserunt dicta assumenda a repellendus voluptate quidem.,7
192,429691303,2024-09-28,Quos occaecati a nulla nemo veniam sapiente assumenda aspernatur voluptas.,6
192,19348520,2024-10-22,Nam natus sequi quis laborum omnis eius voluptatum blanditiis voluptatum illum.,4
193,847822864,2025-05-05,Sed qui ex quos velit ducimus.,3
193,678358037,2025-01-10,Ipsam maxime minima quis quia dolor.,2
193,265376711,2024-10-12,Ipsam quas doloribus quisquam debitis deserunt delectus quo possimus nostrum quaerat voluptatibus.,4
194,717291441,2025-03-10,Dolorum velit voluptate libero blanditiis laudantium.,1
194,308396703,2025-04-17,Accusamus error laboriosam corporis repellat rerum.,7
194,476744407,2025-03-24,Accusamus ratione adipisci facere nostrum molestiae nisi ipsa vero illo impedit non similique.,7
195,52362735K,2025-04-26,Nobis autem distinctio ad et odit accusantium corrupti consequatur.,7
195,717291441,2025-04-28,Quasi ducimus cupiditate voluptate fuga quasi repudiandae architecto et totam unde.,1
195,429691303,2025-04-25,Est dolore laboriosam veritatis libero praesentium consequuntur dolorem suscipit.,6
196,602868621,2024-01-14,Aliquid commodi error fugit velit alias quod impedit corporis quaerat sequi impedit odit.,2
196,486934158,2024-01-07,Est laudantium natus occaecati nemo fugit culpa assumenda neque sunt amet.,7
196,847822864,2023-10-17,Eveniet delectus voluptatibus deserunt excepturi id doloremque placeat saepe fugiat cupiditate et tenetur.,6
197,170449924,2025-02-28,Quia minus facere quibusdam laudantium atque.,3
197,384963978,2025-01-10,Corrupti explicabo quae natus a dolore voluptatibus labore.,5
197,123403398,2025-01-12,Eligendi sequi error consequatur sint autem eum officia pariatur occaecati laboriosam.,6
198,602868621,2025-05-11,Exercitationem odit consequuntur sapiente quis sint.,7
198,468498243,2025-03-19,Odio vel unde aspernatur perferendis quod.,6
198,738874307,2025-04-25,Ipsa consequatur cumque asperiores tempore iure vitae magni a iusto minus non voluptate.,6
199,723173418,2025-02-05,Nihil vitae soluta voluptatibus facilis nesciunt illo aspernatur illum eos rerum sint impedit.,6
199,476744407,2024-01-09,Perspiciatis ipsum quisquam at provident aliquid nihil neque aliquam.,7
199,429691303,2023-12-16,Impedit libero perferendis tenetur facere reprehenderit maxime quasi.,1
200,310818232,2025-02-05,Omnis occaecati soluta aliquam cum nesciunt eos velit quod.,2
200,824531293,2024-12-28,Vitae ex eligendi dolorum deserunt porro tempore libero.,1
200,678358037,2025-04-03,Velit voluptate quaerat minus deleniti totam modi quis fuga doloremque.,2
201,602868621,2025-05-09,Quos molestiae nostrum labore incidunt fuga quidem ipsa.,6
201,847822864,2025-04-30,Officiis aspernatur mollitia dicta voluptatem ad doloremque officiis assumenda.,7
201,738874307,2025-04-27,Odit dignissimos culpa perspiciatis a expedita aut.,4
202,563746866,2025-03-10,Expedita quasi provident eaque maiores alias praesentium id officiis.,2
202,764712099,2024-10-21,Corrupti distinctio a veniam non veritatis odit aut natus vitae soluta porro quaerat.,6
202,261965569,2024-12-31,Dolorem unde aliquid qui recusandae voluptas dolorum animi.,7
203,518808435,2024-12-12,Quos laborum rem reprehenderit mollitia quae numquam rerum aspernatur corrupti possimus ratione quas.,5
203,764712099,2025-01-14,Vero ea facere voluptatem expedita eveniet dolorum.,3
203,706028730,2024-12-31,Repellat illum natus corporis quis ut eaque similique molestiae blanditiis velit blanditiis.,3
204,82810988K,2024-04-07,Cupiditate cumque sed quia in aut architecto quidem libero quos saepe fugit dicta.,7
204,717291441,2024-01-21,Rerum asperiores vero dignissimos tempora minus distinctio dicta magni.,4
204,723173418,2024-05-11,Quae necessitatibus est ex aliquid aspernatur sint praesentium reprehenderit.,6
205,579522135,2025-05-09,Voluptates voluptas sit dolorum odio laudantium itaque.,6
205,19348520,2025-04-08,In blanditiis dolor earum iste deleniti omnis sed provident officia dolorem deserunt inventore.,4
205,717291441,2025-04-25,Veritatis iusto inventore quidem reiciendis fugiat vitae voluptatem delectus harum.,1
206,502640062,2024-10-10,Cupiditate natus repudiandae culpa ipsa nulla eius totam rerum.,2
206,118421027,2024-06-07,Libero fugiat at amet sit facere non quia vitae saepe.,2
206,604679753,2025-01-08,Porro voluptatibus quia officia corporis minus ut.,4
207,706028730,2024-05-08,Sed in voluptas cum dolorum unde pariatur animi.,4
207,678358037,2024-02-01,Voluptatibus exercitationem modi quia commodi et ipsam esse quaerat eum unde ab molestiae.,4
207,52362735K,2024-12-18,Vero repudiandae veniam mollitia quae laboriosam dicta dignissimos.,2
208,468498243,2025-02-15,Hic vel molestiae corrupti beatae itaque quibusdam earum.,1
208,482947700,2024-10-10,Quo dignissimos ut hic iure tempora accusantium.,3
208,486934158,2024-11-01,Adipisci quaerat nobis quibusdam dolorum labore molestiae.,1
209,518808435,2024-08-22,Odio molestiae nobis in iusto recusandae.,6
209,500961252,2025-01-28,Possimus a magni quibusdam soluta natus.,2
209,649665834,2024-11-02,Eius eos assumenda deleniti alias rerum natus.,4
210,384963978,2024-03-17,Eum nesciunt perspiciatis a voluptate eum perferendis quidem tempore.,3
210,82810988K,2024-03-21,Nulla ratione mollitia cumque incidunt esse aliquid aliquid ipsa deleniti.,5
210,261965569,2024-07-02,Fugit numquam tempore sapiente consequatur impedit.,1
211,717291441,2024-12-29,Deleniti quos vel odit doloremque pariatur esse reprehenderit temporibus illum ea molestiae.,4
211,553961653,2025-03-12,Suscipit praesentium explicabo quia fugiat assumenda reprehenderit blanditiis vitae voluptate dolorem ratione.,3
211,482947700,2024-06-11,Quibusdam asperiores dicta adipisci quia quam unde totam consequuntur est doloremque.,7
212,123403398,2025-05-07,Reiciendis est nostrum at quidem illo harum dolor.,1
212,801784372,2025-05-05,Deleniti a reiciendis placeat autem hic ad totam dicta nihil accusantium impedit.,3
212,606167458,2025-04-29,Alias maiores assumenda quia ratione repellat eum ratione omnis nam porro libero libero.,6
213,7493924,2024-01-18,Veritatis ipsam quis excepturi atque enim aliquam ipsam vero porro possimus hic.,5
213,602868621,2024-09-23,Neque non harum maiores quidem corrupti saepe dolore ad itaque vel.,5
213,482947700,2024-01-23,Officia natus corrupti dolor deserunt aperiam.,2
214,717291441,2024-06-19,Provident sequi deserunt blanditiis sapiente ut quaerat veritatis consequatur officia similique.,7
214,579522135,2024-09-23,Voluptas molestiae enim explicabo ex voluptatibus natus saepe nihil tenetur quasi perferendis delectus.,7
214,19348520,2024-06-24,Fugit officiis exercitationem ea aliquid magnam ipsa rerum laboriosam impedit.,3
215,563746866,2024-03-01,Eveniet accusamus et optio soluta dolorem perferendis quidem commodi recusandae.,5
215,723173418,2024-03-31,Minima enim porro ratione vel quo architecto nam.,4
215,533052614,2024-03-02,Adipisci odit qui dolorem ipsam ipsum ea vel id perspiciatis labore minima quas.,6
216,518808435,2024-05-10,Distinctio amet quae repellendus doloribus neque.,2
216,706028730,2024-07-21,Repellat doloremque voluptatem occaecati ex sequi similique quos aperiam.,6
216,606167458,2024-07-17,Quo nam commodi debitis occaecati dignissimos quibusdam provident.,4
217,502640062,2024-11-06,Ab incidunt expedita placeat autem accusantium quis dolorem atque aut.,7
217,579522135,2025-05-07,Ratione ut quaerat occaecati voluptates fuga exercitationem laudantium odio.,7
217,764712099,2024-07-27,Suscipit aliquam dolor cum tenetur fugiat esse.,3
218,170449924,2025-05-01,Adipisci ut repudiandae incidunt delectus nostrum voluptate.,6
218,723173418,2025-05-06,Non corrupti modi asperiores pariatur dolorem quis ipsam voluptate nulla aperiam.,5
218,847822864,2025-04-23,Itaque exercitationem ad incidunt quisquam quisquam.,4
219,482947700,2024-03-11,Ratione molestiae explicabo eius sed sapiente hic alias vero incidunt temporibus.,6
219,261965569,2024-11-16,Explicabo repudiandae atque possimus ipsa repellat voluptas itaque quae sapiente.,3
219,310818232,2025-01-02,Cupiditate corrupti veritatis aperiam consectetur iusto.,3
220,108315393,2025-03-30,Quisquam sed consequuntur numquam temporibus recusandae a debitis voluptatem.,6
220,82810988K,2025-05-11,Eveniet accusantium eos ut facere in eius laborum tempora.,4
220,476744407,2025-04-14,Maiores eum dolore iusto eos veritatis ratione dolorum expedita sit.,3
221,738874307,2024-11-23,Ut ab doloribus delectus ut facere eligendi nihil error consequatur accusamus ipsam.,2
221,308396703,2024-11-22,Ea est est assumenda veniam cum excepturi nostrum neque facilis.,6
221,553961653,2024-09-18,Quas consequatur eos officiis amet dolores deserunt.,3
222,476744407,2025-05-01,Modi exercitationem sint reprehenderit rerum sequi voluptatum provident.,7
222,429691303,2025-03-22,Similique praesentium ab molestiae ducimus error consectetur praesentium possimus est adipisci molestiae.,1
222,649665834,2025-03-06,Dolores fugit possimus porro iure eaque quo magnam beatae facilis impedit et exercitationem.,4
223,486934158,2024-10-01,Recusandae asperiores sed quia ab sed aperiam eos dolores pariatur.,3
223,604679753,2025-01-20,Natus consequuntur adipisci ea reiciendis rem minima reiciendis mollitia earum eaque.,7
223,502640062,2025-04-08,Distinctio tenetur animi exercitationem velit voluptatibus quod.,4
224,719733581,2024-10-05,Culpa at blanditiis expedita nesciunt optio non occaecati.,1
224,265376711,2024-07-18,Provident libero quis veniam nam sapiente labore delectus molestias soluta voluptate.,1
224,502640062,2024-12-22,Alias at tempore officia nemo occaecati nulla eligendi.,3
225,738874307,2025-05-04,Accusantium eveniet occaecati nisi commodi est ex.,5
225,308396703,2025-05-04,Reprehenderit dignissimos optio aperiam veritatis nam enim dolor accusamus praesentium accusantium.,5
225,553961653,2025-04-12,Magnam laudantium provident impedit deleniti nihil ab consequuntur nesciunt distinctio.,3
226,602868621,2024-07-03,Quod accusantium ullam aliquid nam excepturi.,7
226,604679753,2023-10-24,Debitis ullam sequi ut a labore eligendi explicabo.,1
226,486934158,2025-02-16,Porro et distinctio consequatur nemo nisi adipisci magnam temporibus accusamus quidem.,7
227,52362735K,2023-10-13,Reiciendis expedita magni autem hic voluptates ab exercitationem repudiandae provident fugiat deleniti.,5
227,717291441,2024-01-10,Tenetur laudantium commodi nostrum voluptas assumenda iste minima cupiditate.,1
227,170449924,2024-01-20,Ab ipsa esse praesentium fugiat debitis impedit reiciendis voluptate.,2
228,123403398,2025-04-07,Rerum voluptas in vitae amet voluptatem quia aliquam animi optio recusandae.,4
228,604679753,2024-05-12,Officiis quam velit vel reprehenderit perferendis molestias fuga sed unde atque libero odio.,1
228,82810988K,2024-07-19,Similique qui at commodi blanditiis eius provident.,5
229,579522135,2024-10-17,Ratione modi aliquid aperiam quis qui mollitia doloremque.,2
229,500961252,2024-12-04,Magni excepturi amet cum facilis facilis incidunt rerum officia voluptate veritatis eos quo.,7
229,533052614,2024-10-16,Sit repudiandae ullam molestias vitae aut dolor commodi alias deleniti dolor explicabo.,6
230,649665834,2025-01-25,Laboriosam asperiores itaque rerum repellendus repellendus facere.,2
230,801784372,2024-11-25,Voluptas occaecati quis sint rerum dignissimos cumque quia reprehenderit impedit iste deleniti porro.,2
230,518808435,2025-03-06,Exercitationem natus cum minus autem ad eos recusandae.,1
231,532645603,2025-04-20,Accusantium id quibusdam at repellendus eum nisi sapiente similique.,3
231,813950057,2025-04-16,Illo magnam asperiores in natus a voluptas minima molestiae assumenda harum.,4
231,649665834,2025-05-02,Saepe aliquam id soluta suscipit accusantium possimus doloribus.,3
232,335015215,2024-06-03,Ab mollitia illo omnis quasi laborum dolorum.,7
232,486934158,2024-06-28,Ex dolorem at laborum nostrum dicta.,2
232,602868621,2025-04-15,Maxime voluptatum quidem unde rem rem optio ducimus ipsa at voluptatibus.,5
233,801784372,2025-03-20,At ducimus necessitatibus a voluptatum iure odit commodi dolor unde nulla.,2
233,502640062,2025-03-12,Magnam laborum itaque amet quos quia omnis laboriosam velit consectetur accusantium nesciunt.,7
233,52362735K,2025-04-05,Tenetur ea asperiores culpa repellendus animi nobis nihil.,5
234,719733581,2023-10-20,Commodi id occaecati odit similique tempore laboriosam impedit officia.,7
234,723173418,2024-07-01,Fuga exercitationem quae ut ipsam eligendi ad enim amet accusamus recusandae.,5
234,288452296,2024-07-16,Magnam officiis similique totam non dolorem quisquam et.,5
235,170449924,2025-03-20,Consequatur reprehenderit nihil eum nulla et tempora corporis illum dolorum alias.,4
235,602868621,2024-01-29,Sunt sequi ullam quam rem a neque debitis.,7
235,533052614,2024-04-29,Iure illo ad cupiditate recusandae enim ut maiores blanditiis commodi corrupti.,6
236,706028730,2024-04-08,Deserunt placeat enim quidem alias cum eum nihil laborum sequi.,7
236,19348520,2024-03-13,Placeat recusandae dolorum provident placeat eius consequatur molestiae eum consectetur.,1
236,518808435,2025-04-25,Consectetur commodi repudiandae corporis et minus consequuntur sit totam assumenda aliquam.,3
237,429691303,2024-11-16,Ipsum ullam aspernatur recusandae deleniti totam accusantium.,4
237,719733581,2024-01-27,Libero doloremque laborum saepe molestias architecto harum dolor.,4
237,533052614,2025-04-16,Nesciunt provident ut totam commodi fugit.,6
238,335015215,2025-04-08,Animi sed tenetur quae nulla tenetur voluptates hic cumque doloribus ea.,3
238,310818232,2025-01-02,Repudiandae alias ea reiciendis provident pariatur dignissimos saepe praesentium nobis ad perspiciatis.,7
238,19348520,2025-01-07,Accusantium sunt cumque sit ipsum officiis cumque.,7
239,602868621,2025-03-28,Tempora quia porro cumque dicta voluptatum magni nobis pariatur.,2
239,518808435,2025-05-09,Cupiditate ea libero officiis ducimus asperiores perferendis labore temporibus a asperiores accusamus.,1
239,488481576,2025-03-25,Laborum omnis veritatis animi ratione earum aperiam vel autem.,4
240,463840083,2024-08-30,Itaque minima adipisci placeat veritatis itaque eligendi quod magnam ipsa.,7
240,745051308,2024-12-17,Ullam velit itaque saepe ullam aliquam tempore corporis odio accusamus.,3
240,717291441,2024-06-13,Consequuntur porro culpa odio quasi distinctio voluptates.,4
241,486934158,2024-09-16,Fuga commodi accusantium vel totam minima ex.,2
241,801784372,2024-11-15,Adipisci impedit itaque reiciendis consectetur illum debitis nesciunt.,1
241,170449924,2025-03-19,Praesentium voluptate recusandae dolores et harum maiores debitis consectetur harum quibusdam.,6
242,723173418,2024-12-23,Quas neque repudiandae quia officia cumque.,7
242,717291441,2024-06-12,Expedita exercitationem consequatur dolor corporis iure ducimus in ab nulla est aliquam saepe.,7
242,649665834,2024-12-16,Et beatae fugit reiciendis aut distinctio veritatis ipsum dolorem unde.,3
243,801784372,2025-04-30,Impedit sequi unde commodi nobis nobis.,6
243,502640062,2025-01-27,Asperiores adipisci ut sapiente necessitatibus dolore rerum.,5
243,824531293,2024-10-25,Iure dolores omnis aut amet nobis veniam.,1
244,468498243,2025-02-05,Nobis dolores incidunt rem dignissimos veritatis.,2
244,123403398,2025-04-19,Modi necessitatibus minima atque officia porro atque temporibus modi.,7
244,170449924,2025-03-31,Quas nostrum nihil minima molestias cum eligendi quia provident quibusdam quos quia.,3
245,468498243,2025-04-30,Soluta rerum unde facere sequi animi iusto possimus esse aliquam totam animi voluptates.,1
245,463840083,2025-04-24,Distinctio consectetur quae at reprehenderit accusamus veritatis.,6
245,719733581,2025-04-16,Autem id esse unde natus accusamus nulla excepturi libero.,7
246,108315393,2025-03-30,Culpa dolore blanditiis consectetur dicta in cum ex ea.,2
246,717291441,2025-03-17,Eum modi expedita dolorum expedita facere blanditiis ab similique nostrum officia.,6
246,19348520,2025-03-24,Velit minus impedit et molestiae placeat laborum repellendus eum et.,4
247,76761221,2024-11-16,Odio ratione sunt enim sequi vero nostrum.,3
247,723173418,2025-03-26,Reprehenderit quos saepe saepe deleniti porro maxime quam eum quas.,4
247,649665834,2023-10-05,Delectus sapiente quam fugit quidem voluptatum temporibus tenetur fuga.,1
248,717291441,2024-09-09,Soluta nesciunt quis iste officia fuga dignissimos placeat iure saepe est nesciunt.,6
248,19348520,2023-11-23,Non debitis doloremque repellat architecto quidem illo suscipit reiciendis.,1
248,108315393,2023-10-26,Quae saepe ad doloribus doloribus fugiat incidunt esse.,7
249,108315393,2025-04-15,Tempora fugit unde debitis explicabo atque fugiat est eius distinctio ut rerum voluptate.,5
249,488481576,2025-03-19,Enim dicta aliquid explicabo similique repellendus vero.,5
249,606167458,2025-04-16,Omnis vitae impedit veniam tempora expedita accusamus explicabo ducimus.,1
250,579522135,2025-02-12,Nesciunt consequatur sit dolor placeat nobis voluptas consequatur libero aut fugit.,7
250,563746866,2024-09-06,Ad temporibus modi ducimus quibusdam facere in soluta debitis placeat blanditiis id sint.,5
250,717291441,2024-07-08,Expedita laboriosam culpa quos et dolorum molestias labore corrupti.,4
251,261965569,2025-03-12,Mollitia aperiam ab ea dolorum culpa perferendis placeat rerum cumque ducimus.,3
251,52362735K,2025-02-19,Dolorum vero vitae et doloremque debitis laboriosam molestias est minus.,2
251,482947700,2025-01-08,Sunt dolor magni temporibus cupiditate cumque aliquid.,5
252,824531293,2025-05-10,Aperiam ipsam rerum ad recusandae sit dolores provident vero.,5
252,606167458,2025-05-10,Inventore magni maxime cum sunt repellendus atque accusamus odit possimus.,5
252,801784372,2025-04-16,Recusandae aliquam beatae similique suscipit architecto ad iure.,5
253,533052614,2025-03-29,Sed expedita eius atque ratione adipisci provident ipsam reiciendis quaerat consequatur occaecati.,1
253,764712099,2025-03-10,Nam magnam porro ut nihil deserunt ullam.,2
253,500961252,2025-03-04,Nesciunt temporibus libero quasi aperiam consequuntur fuga eligendi saepe rerum quia sequi fugit eaque.,6
254,486934158,2024-09-29,Provident possimus voluptatibus recusandae dolores nisi nihil eum.,6
254,108315393,2023-10-28,Alias quia quia accusamus nisi ex ipsam.,1
254,563746866,2025-01-14,Alias aliquam facilis alias culpa repudiandae.,6
255,82810988K,2024-08-16,A nulla cum cupiditate provident dolorem commodi dolore ad totam voluptatibus officia.,1
255,170449924,2025-01-31,Ad ipsum corrupti rerum voluptates excepturi sint.,1
255,801784372,2025-02-12,Reiciendis facilis eveniet eum commodi perferendis ratione at laboriosam corrupti facilis in.,7
256,801784372,2025-02-19,Laboriosam perferendis praesentium similique quis quos eos laudantium ex quia.,5
256,476744407,2025-03-04,Doloremque numquam voluptas impedit ullam molestiae aut inventore dolores libero fuga laboriosam accusantium.,5
256,723173418,2024-12-25,Dolorem perferendis sint odio voluptates maxime sapiente sunt.,1
257,19348520,2025-05-08,Eligendi repudiandae quia minima quidem nobis in accusantium.,2
257,723173418,2025-03-30,Tempora minus dicta nemo architecto velit est distinctio.,6
257,76761221,2025-03-18,Perferendis sed repellat at architecto esse illo sit dolor.,7
258,847822864,2025-01-20,Nobis corrupti quaerat impedit laboriosam accusantium consequuntur ipsam praesentium esse.,4
258,170449924,2024-02-07,Ad fugit esse officiis maiores totam quas nulla.,7
258,723173418,2025-02-12,Illo aut fuga magnam ipsam reprehenderit laborum architecto perferendis.,5
259,606167458,2024-06-23,Laudantium quas numquam consectetur nisi nobis labore iste.,2
259,265376711,2024-08-20,Nihil voluptates voluptas odio quia doloribus nihil fugiat voluptas architecto.,7
259,170449924,2025-04-13,Non consectetur in itaque inventore corporis non voluptatum nam autem omnis assumenda.,2
260,500961252,2024-12-30,Odit inventore sint excepturi corrupti quos officia voluptate.,4
260,606167458,2024-12-27,Quibusdam quia cupiditate ut itaque sed natus cum explicabo occaecati optio ex quidem.,3
260,76761221,2025-02-02,Voluptatum voluptatum quidem eius odit fuga consequuntur delectus consequatur illo commodi alias nostrum.,6
261,719733581,2025-03-26,Dolorem hic non dignissimos necessitatibus provident nemo.,3
261,518808435,2025-03-20,Voluptatem similique maxime ipsum consectetur cupiditate omnis laboriosam repudiandae nisi ipsam repellendus.,6
261,606167458,2025-04-13,Neque veniam deserunt dolorum ut maxime.,3
262,288452296,2025-03-27,Cumque voluptatibus enim id dolor sequi saepe labore fugiat ut.,3
262,261965569,2024-10-16,Doloremque reprehenderit quidem magnam quod illo ullam quos tempora praesentium ullam itaque.,6
262,476744407,2024-11-20,Quas vitae cupiditate iste reiciendis odio consequatur maxime.,3
263,261965569,2024-11-03,Veritatis nisi doloremque dolorem molestiae veritatis consequuntur ducimus sequi facere optio.,3
