id_articulo,rut_revisor,fecha_revision,comentarios,calificacion
1,52362735K,2024-11-18,Natus sequi impedit quidem saepe dolorem.,3
1,170449924,2025-04-25,Repellendus quia consectetur commodi ducimus deleniti ratione accusamus.,5
1,261965569,2024-08-06,Facere enim id amet earum nisi voluptates error laudantium suscipit.,7
2,604679753,2024-08-04,Esse est tempore consequuntur esse velit possimus dolore.,2
2,429691303,2024-05-14,Placeat veniam porro possimus nesciunt in magnam.,7
2,424016810,2024-08-12,Doloremque repudiandae quaerat laboriosam corrupti saepe repellat porro a quia illum.,3
3,745051308,2025-05-08,Qui quia voluptatum fuga amet eveniet molestias rerum aut numquam.,6
3,170449924,2025-05-09,Aliquam iste ad iusto repellat ipsum error aut.,1
3,108315393,2025-05-09,Voluptate delectus qui consequatur vero iusto.,1
4,118421027,2025-01-20,Possimus quo illo rem distinctio itaque minus deleniti quidem at vitae veritatis quaerat.,5
4,429691303,2024-12-26,Fugiat pariatur fugiat numquam recusandae nam omnis est assumenda doloremque quasi fugiat.,5
4,19348520,2025-02-13,Laborum esse asperiores facere officiis iusto tempora cum mollitia voluptatum sint et eum.,3
5,723173418,2025-01-15,In natus dignissimos nemo hic eius cum minus.,5
5,649665834,2025-02-22,Voluptatibus vero repellendus ut assumenda cum animi quae adipisci iste eligendi laudantium neque.,1
5,604679753,2025-03-10,Harum consectetur voluptatum aut nesciunt quae totam voluptates.,7
6,118421027,2025-02-02,Eius assumenda delectus sed quibusdam at molestias voluptate deserunt.,2
6,764712099,2024-11-02,Repellendus accusantium eum inventore magni placeat.,5
6,553961653,2025-04-13,Blanditiis maxime nemo rem aliquam sed quasi laborum nostrum in ab fugit eveniet inventore.,2
7,52362735K,2025-03-23,Numquam nisi ullam doloribus sequi velit quisquam ducimus.,5
7,261965569,2024-11-02,Aliquid omnis molestias occaecati ipsam impedit odit necessitatibus.,5
7,518808435,2025-01-20,Exercitationem sint delectus voluptas fuga dignissimos assumenda nisi.,6
8,123403398,2024-08-23,Optio voluptatum consequatur voluptates quasi fugit quo ipsam officiis facilis esse repellat.,3
8,602868621,2025-03-06,Ipsam illo earum et voluptates porro aperiam odit sequi.,5
8,745051308,2024-12-05,Nemo in occaecati a harum quos iure nihil beatae commodi labore vitae suscipit.,3
9,649665834,2024-08-09,Sint quam similique aliquid sunt beatae.,2
9,579522135,2024-07-19,Tempore soluta voluptates temporibus aliquam repudiandae recusandae distinctio animi.,4
9,502640062,2025-01-03,At nostrum rem repudiandae ad impedit repellendus tempore soluta molestias deleniti quidem id.,5
10,738874307,2025-04-02,Ab maiores itaque dolor eius maxime beatae et rem sint cupiditate eos accusamus.,1
10,719733581,2025-04-10,Nulla laboriosam commodi dignissimos odio asperiores nostrum excepturi nobis maxime nisi.,6
10,82810988K,2023-12-28,At sequi earum magnam natus velit fugiat.,3
11,649665834,2025-01-05,Iusto quo ab tempore molestias quo.,2
11,76761221,2024-09-14,Optio vel quis nostrum corporis optio.,3
11,801784372,2024-09-11,Libero accusamus porro odit impedit sed iure sit aspernatur minima dolores tempora dolor.,3
12,719733581,2025-01-25,Laborum illum veniam ut ratione quia sapiente necessitatibus officia iure ipsum.,2
12,261965569,2024-10-17,Perspiciatis impedit maxime eaque pariatur blanditiis tempora officia suscipit iure.,5
12,502640062,2024-12-23,Soluta sed aspernatur reiciendis delectus fuga illum saepe molestiae at asperiores nam.,7
13,310818232,2024-07-19,Illum amet illum a placeat voluptate hic ipsa minima tempore vitae exercitationem omnis.,1
13,518808435,2024-10-14,Nulla quae sit soluta corporis voluptate natus quod distinctio quis in voluptates dolor.,4
13,463840083,2025-01-03,Deleniti dignissimos eveniet quas aut sunt iusto assumenda amet.,5
14,108315393,2025-03-23,Illum quibusdam culpa quam quae praesentium corrupti.,1
14,706028730,2023-12-02,Aut quibusdam laboriosam repudiandae fugit occaecati ab unde consequatur repellendus quod.,6
14,118421027,2024-02-12,Officiis dolores temporibus quibusdam adipisci ut similique fugit doloribus.,1
15,649665834,2025-01-19,Vel ut tempora repellendus harum numquam quaerat atque asperiores eum.,3
15,719733581,2025-02-02,Voluptates asperiores quidem incidunt nisi ex voluptatum voluptatibus temporibus fuga laborum adipisci.,4
15,706028730,2025-03-28,Eveniet perspiciatis repudiandae nam autem quasi ut nostrum expedita temporibus possimus.,2
16,723173418,2024-12-20,Commodi illum atque corrupti vitae ducimus laudantium.,7
16,801784372,2024-07-18,Tenetur in earum dignissimos nobis expedita voluptatibus atque dolorem adipisci.,1
16,649665834,2025-05-07,Ad harum debitis odit reprehenderit sunt natus quidem voluptate enim.,4
17,764712099,2024-08-11,Repellendus dolore ad nemo sapiente non hic minima perspiciatis tempore illum.,6
17,604679753,2024-01-15,Dolorem eos nisi ipsam fugiat commodi voluptatibus architecto.,6
17,649665834,2024-12-16,Natus sint facere minus eius exercitationem aliquid fugiat voluptate pariatur commodi.,6
18,738874307,2025-03-21,Aut dolorum soluta itaque sit in itaque rem quasi dolorum voluptas.,1
18,19348520,2024-11-20,Architecto similique possimus deleniti vel corrupti esse voluptas quod consectetur illum.,3
18,719733581,2024-09-11,Tenetur praesentium doloremque eligendi numquam necessitatibus hic nihil cum facilis voluptatibus fugiat atque.,1
19,717291441,2024-07-27,Ad culpa inventore molestias quos eaque dignissimos cumque.,1
19,7493924,2025-04-14,Nisi fugit similique quibusdam maxime quaerat laudantium.,4
19,476744407,2025-01-12,Saepe alias nobis quia voluptatum a accusantium culpa sed autem atque.,1
20,518808435,2025-04-24,Doloremque perspiciatis atque ut doloribus illo nesciunt rerum in quidem.,2
20,745051308,2025-04-28,Minus assumenda voluptas consectetur dignissimos velit fugit quia reiciendis ipsum incidunt atque magnam.,1
20,170449924,2025-04-29,Dolorem error veniam suscipit accusantium beatae omnis minima numquam unde dolore sed nemo.,5
21,486934158,2025-04-22,Distinctio maiores quis repudiandae iste tempora perspiciatis dolor ipsam.,1
21,553961653,2025-02-20,Sapiente odit explicabo officia dicta qui ducimus pariatur ipsa placeat.,1
21,310818232,2025-02-12,Sit facilis eius a ea autem.,3
22,579522135,2024-12-20,Perspiciatis praesentium quae non dolor incidunt repudiandae.,6
22,19348520,2024-09-27,Architecto minus qui quo blanditiis tenetur laudantium.,2
22,532645603,2025-03-05,Nam iure magnam voluptates facere quidem quod facere.,1
23,265376711,2025-02-13,Harum rem repellendus odit vero consequatur.,3
23,308396703,2024-11-21,Facere alias laborum provident voluptatum laborum itaque libero.,2
23,738874307,2024-05-28,Occaecati reprehenderit cumque provident ad ea rerum voluptatum magnam.,7
24,82810988K,2025-03-31,Mollitia accusamus nesciunt ad quos accusamus reprehenderit voluptate ipsam.,5
24,310818232,2024-06-17,Sunt accusantium dolores corporis hic asperiores distinctio corporis fugiat atque rerum.,2
24,335015215,2024-10-10,Aperiam beatae similique officia ab animi alias quos placeat.,4
25,604679753,2024-08-18,Voluptate sit dolores excepturi consectetur cum harum accusamus.,3
25,486934158,2024-12-07,Necessitatibus facere vitae fugiat provident aut veniam commodi ducimus alias aut.,4
25,468498243,2025-03-20,Explicabo dolore natus harum eos nesciunt.,1
26,463840083,2025-02-02,Repellendus reprehenderit odit sit fugiat pariatur veniam doloremque ipsa modi quod.,5
26,468498243,2024-05-13,Quas iure doloremque odit rerum odit natus.,6
26,706028730,2024-11-08,Quisquam officia quibusdam temporibus illum aliquam nisi consectetur dicta voluptas.,5
27,824531293,2024-11-10,Tempore quaerat ratione id corrupti delectus rerum aliquid iusto velit molestias consectetur.,2
27,335015215,2025-04-02,Voluptas magnam unde voluptatibus repudiandae ea minus magnam suscipit asperiores.,5
27,723173418,2025-05-10,Asperiores libero magni hic placeat consequatur reprehenderit eius voluptatem iste.,4
28,606167458,2025-02-11,Illo dolorum nisi commodi veniam qui voluptates voluptatibus sint harum magnam.,1
28,502640062,2025-02-24,Fuga similique eos veniam minus maiores officiis officia.,7
28,308396703,2025-01-24,Quisquam odio magnam sint similique impedit earum nemo corrupti sit temporibus nostrum occaecati.,5
29,265376711,2025-04-08,Delectus veniam laudantium necessitatibus hic unde eius cum dicta eum.,3
29,801784372,2024-12-29,Magnam quas saepe doloribus numquam tempora dolores.,3
29,463840083,2025-03-16,Sint impedit soluta atque velit aut libero eos impedit.,1
30,500961252,2025-04-06,Dolor ratione optio fugiat illum sequi similique.,5
30,764712099,2024-12-03,Eveniet dolores architecto aliquid vitae saepe eius maxime provident odit aliquid.,1
30,288452296,2025-03-14,Quisquam quod quis harum exercitationem doloribus assumenda aliquid unde.,5
31,745051308,2024-06-19,Voluptatem ut molestias praesentium magni voluptatem deleniti dolorum enim illo assumenda consectetur accusamus.,3
31,604679753,2025-04-12,Commodi ut alias pariatur facilis suscipit ipsam eaque deserunt dolores.,7
31,502640062,2025-04-22,Repudiandae dicta cupiditate ducimus similique accusamus corporis at vero.,3
32,261965569,2024-08-11,Impedit molestiae earum nostrum deserunt quibusdam rem ex culpa a saepe.,3
32,500961252,2025-05-06,Fugit quis eveniet perspiciatis illum vel est quas ullam in sit sunt accusantium.,1
32,265376711,2024-10-07,Doloribus quia voluptatem aut quasi mollitia reiciendis expedita quis natus aliquam modi.,1
33,801784372,2024-06-07,Officiis modi odit vero earum ullam recusandae.,7
33,602868621,2024-12-28,Autem similique culpa culpa illo facilis ex.,5
33,553961653,2024-05-02,Quae maxime quisquam odio optio facere occaecati beatae maxime porro qui sint voluptatibus.,5
34,602868621,2025-04-28,Consectetur vitae assumenda qui quisquam explicabo quidem dolorum occaecati.,2
34,717291441,2025-04-28,Quidem fugit maxime reprehenderit perspiciatis voluptate exercitationem sequi vero molestias reprehenderit totam ullam nisi.,6
34,310818232,2025-05-01,Necessitatibus assumenda modi impedit optio laborum accusamus nisi expedita saepe.,3
35,602868621,2025-05-01,Nisi quibusdam ad consectetur eos aut perferendis at magni.,7
35,488481576,2025-03-11,Ducimus delectus voluptas molestias eius inventore nesciunt unde similique officia pariatur quis ex.,1
35,482947700,2023-10-14,Aliquam natus veniam tenetur nesciunt saepe quae optio aut unde.,4
36,19348520,2025-02-12,Illo asperiores numquam nobis aut quis fuga ea numquam mollitia libero iusto cum.,1
36,429691303,2024-08-08,Quas dolorem provident ducimus magni at cum error et.,2
36,813950057,2024-12-02,Cum deserunt voluptates maxime maxime dolorem blanditiis illo fuga numquam.,2
37,170449924,2024-10-21,Cumque ducimus dicta corrupti repellat ad magnam odio earum at necessitatibus incidunt.,5
37,261965569,2025-03-11,Dolores occaecati ad nesciunt commodi blanditiis.,3
37,604679753,2025-02-21,Reiciendis minima vero architecto delectus voluptatibus laborum accusantium veniam hic ipsum.,5
38,579522135,2024-12-27,Maiores deserunt nihil fugit laudantium magnam.,7
38,468498243,2024-12-23,Voluptate facere possimus soluta explicabo ad ex quasi voluptate beatae cumque aliquid.,6
38,602868621,2025-01-28,Libero ratione placeat enim ab placeat porro ullam odio impedit tempora.,5
39,310818232,2024-11-14,Repudiandae quo eius repudiandae laborum delectus alias eveniet minima.,5
39,486934158,2024-12-05,Quam dolorum ratione placeat aliquam ipsum optio.,6
39,706028730,2025-02-17,Vero adipisci optio minima hic itaque enim necessitatibus mollitia eligendi ipsam.,1
40,52362735K,2025-05-09,Maiores eius alias quae sint error ratione doloremque beatae excepturi.,2
40,649665834,2024-12-30,Quaerat molestias numquam accusamus saepe aut neque in beatae eaque.,4
40,532645603,2025-04-26,Natus debitis quos quae repudiandae debitis quis qui.,4
41,738874307,2024-11-16,Pariatur veniam quas aspernatur illum omnis quasi.,2
41,335015215,2025-04-22,Veniam iure nisi numquam voluptate quidem voluptatem.,2
41,82810988K,2024-07-14,Reprehenderit perferendis fugit nobis maxime nesciunt unde recusandae accusantium.,1
42,719733581,2024-04-13,Sunt libero cupiditate dignissimos quidem id iure.,7
42,123403398,2025-03-21,Harum tempora magnam nisi tempora cupiditate ex eius assumenda placeat distinctio repellat sunt.,2
42,602868621,2025-03-21,Culpa unde nulla distinctio nobis dolores dolore praesentium neque consectetur eos voluptatum suscipit.,6
43,579522135,2024-10-21,Reiciendis pariatur exercitationem est omnis amet cupiditate earum aliquid animi consequuntur.,1
43,170449924,2025-04-17,Maiores quos odio necessitatibus corrupti nostrum minus vitae sint assumenda inventore.,1
43,745051308,2024-12-01,Adipisci in ab maxime repellat culpa animi esse eveniet ex.,2
44,553961653,2025-03-28,Rem at illo similique inventore accusantium at.,6
44,579522135,2025-03-27,Debitis facilis nostrum et laboriosam porro aliquam saepe.,2
44,335015215,2025-04-19,Corporis ipsa dignissimos cupiditate dolores laudantium error amet.,1
45,745051308,2024-11-06,At corrupti corporis natus aspernatur suscipit aliquid deleniti debitis recusandae debitis.,4
45,604679753,2025-03-13,Dolorem provident fuga iure qui ex dolor natus molestias vel adipisci.,4
45,500961252,2025-02-26,Alias non rem illo officiis recusandae illo aliquam eveniet blanditiis.,1
46,717603192,2025-02-01,Soluta ipsa exercitationem quia ea et eligendi quidem nesciunt molestiae dicta voluptas.,2
46,52362735K,2025-01-11,Fugiat dolores eius accusantium asperiores dignissimos reiciendis nesciunt reiciendis eveniet vitae officia cupiditate.,6
46,738874307,2024-11-20,Consectetur impedit quidem necessitatibus at laboriosam praesentium soluta quam reprehenderit rerum deleniti.,7
47,468498243,2025-04-19,Occaecati ad culpa modi impedit earum totam eaque temporibus.,7
47,261965569,2025-03-30,Ipsa sit natus natus eos eos beatae illo esse.,7
47,717291441,2025-03-14,Rerum minima animi perferendis minima error.,2
48,706028730,2024-07-01,Assumenda modi nihil voluptatum culpa illum neque.,2
48,335015215,2024-05-09,Aperiam eos dolore in quidem inventore dignissimos ea hic.,5
48,820677293,2024-04-16,Quibusdam dolore aut impedit ex fugiat maxime aut repudiandae.,7
49,518808435,2024-09-22,Eum quae sed laboriosam ab culpa.,2
49,719733581,2025-03-05,Quam rem dolor illo nesciunt inventore ipsam non.,7
49,847822864,2024-07-09,Accusantium error facere veritatis deleniti veritatis voluptates necessitatibus.,7
50,82810988K,2025-04-12,Dignissimos quae ullam tenetur nostrum totam illum amet maxime iure.,2
50,288452296,2025-01-06,Ullam rem alias occaecati facere ducimus odio nostrum.,3
50,482947700,2024-11-12,Quas ab tempora in blanditiis alias.,4
51,847822864,2024-01-13,Reiciendis aut ullam quibusdam eligendi repellendus deleniti commodi error hic aliquam consequuntur voluptate.,2
51,717603192,2025-04-11,Ullam voluptate qui at nisi laboriosam repudiandae tempore quas dicta.,4
51,261965569,2025-05-04,Corrupti aperiam delectus odio omnis ratione temporibus dolorem voluptas ullam quia.,6
52,533052614,2024-10-18,Nam accusamus quos aspernatur reiciendis fuga odit.,7
52,288452296,2025-01-20,Adipisci vel debitis quam cupiditate alias reprehenderit mollitia molestiae.,7
52,579522135,2024-07-01,Eligendi voluptates corporis iusto repudiandae expedita neque.,3
53,486934158,2024-06-30,Doloremque quas veritatis aliquid asperiores et totam ut non expedita omnis neque explicabo.,2
53,502640062,2024-05-25,Illo corporis accusantium distinctio enim aliquid doloremque nam at ducimus earum dolores.,1
53,532645603,2024-01-28,Earum molestias soluta architecto ab blanditiis asperiores autem.,7
54,502640062,2024-10-11,Aliquam eum placeat aliquid ipsum quos.,5
54,429691303,2024-12-03,Perspiciatis corporis cumque totam laborum corporis dolores aperiam dolorum sunt ad ea.,4
54,82810988K,2024-04-12,Quia in expedita ipsum aliquid ipsum dolorum iusto ut laboriosam.,6
55,170449924,2025-04-06,Quae optio inventore provident quasi sequi.,7
55,429691303,2025-05-08,Placeat ad quisquam nihil est itaque neque minima voluptas veniam laborum ut voluptatum.,6
55,745051308,2025-04-07,Voluptate itaque deleniti tempore rem quia voluptatibus laudantium recusandae.,7
56,118421027,2025-03-10,Natus accusamus sint occaecati perspiciatis nam consectetur excepturi quae.,4
56,265376711,2024-06-02,Quis eaque cumque atque in porro occaecati.,3
56,801784372,2024-07-08,Laudantium maiores similique eligendi vero error cupiditate voluptatum commodi dolorum accusamus et asperiores.,3
57,288452296,2025-04-30,Sequi quam corrupti cum quasi incidunt.,6
57,717291441,2024-09-29,Cumque asperiores ipsa saepe quibusdam asperiores tempora voluptas animi accusamus cum rem.,2
57,429691303,2025-03-24,Consectetur vel corporis tempore quam debitis neque rerum praesentium qui quis nisi.,7
58,717291441,2024-09-13,Voluptate praesentium blanditiis fuga ratione nihil tenetur necessitatibus.,7
58,108315393,2024-08-04,Ipsum enim deleniti modi sunt adipisci officiis enim asperiores et mollitia.,3
58,563746866,2025-03-06,Laborum quisquam vitae accusantium quibusdam ea odio suscipit cum.,6
59,723173418,2024-10-24,Error aut illum dolor sapiente quis.,7
59,719733581,2023-11-21,Dignissimos officiis soluta recusandae magnam amet ullam dolore.,1
59,429691303,2024-06-02,Itaque harum doloremque occaecati nostrum possimus labore occaecati rem vero accusantium qui.,7
60,717291441,2025-03-11,Eligendi aperiam eum distinctio odit a iste possimus reprehenderit debitis.,7
60,108315393,2025-05-05,Praesentium inventore recusandae nisi harum minima impedit accusantium earum maxime molestias.,6
60,764712099,2025-04-10,Qui fugit aspernatur repellendus occaecati eaque deserunt fugit dolore.,6
61,563746866,2024-11-06,Qui voluptatum animi corrupti quam consequuntur.,7
61,384963978,2024-12-13,Hic sapiente placeat cum omnis quisquam commodi repudiandae beatae aperiam animi.,6
61,424016810,2025-01-13,Sapiente optio dolore adipisci veritatis dolor.,7
62,604679753,2025-03-29,Quibusdam illo cum iure eos distinctio voluptatem dolores quod vitae recusandae maxime aliquam.,5
62,801784372,2024-07-05,Autem velit aliquid in fuga officia dicta commodi tenetur.,6
62,424016810,2024-12-11,Qui quasi iure exercitationem incidunt non laborum ut maxime.,7
63,678358037,2025-05-03,Corporis facilis quasi earum unde officia occaecati itaque cupiditate corporis adipisci voluptates.,4
63,602868621,2025-04-29,Fugiat optio laboriosam doloremque expedita ad illum velit laborum saepe.,7
63,335015215,2025-05-07,Nobis minima officia expedita nam libero velit quod hic est perferendis dolores.,5
64,604679753,2024-12-12,Ea tempore atque sit amet ratione vel nam magnam eius.,6
64,170449924,2025-04-05,Culpa nemo iste fugit excepturi harum accusamus.,1
64,384963978,2024-10-25,Eveniet voluptas nam ducimus quasi adipisci ex facilis hic quia expedita.,4
65,820677293,2024-03-28,Quasi quo sit ratione corporis quae exercitationem modi nam rem possimus.,7
65,678358037,2023-10-03,Expedita commodi doloremque quibusdam dicta dolore a nihil ea similique cupiditate fuga.,5
65,261965569,2023-08-26,Ratione suscipit minima minus fugiat asperiores veniam laboriosam dolores molestias eum rerum.,5
66,288452296,2025-04-30,Veritatis officia labore et laudantium reiciendis nam unde quos.,4
66,429691303,2025-04-15,Nobis eligendi laboriosam molestiae dolorum accusantium quod odit non ea doloribus repudiandae.,3
66,533052614,2025-05-10,Odio omnis error possimus exercitationem culpa iusto.,1
67,265376711,2025-01-30,Enim amet cum asperiores ea aspernatur tempore architecto ullam sapiente voluptatem est.,6
67,308396703,2025-03-22,Veniam temporibus sapiente modi eos distinctio sequi ea sapiente.,1
67,738874307,2025-03-22,Blanditiis reprehenderit explicabo voluptates sequi eaque dolorem tempore a sit voluptas ad quisquam.,1
68,706028730,2024-08-03,Velit laborum animi iure voluptate facilis rem consectetur aliquid atque corrupti molestiae.,1
68,813950057,2025-04-13,Fugit doloremque dicta impedit eaque adipisci explicabo quisquam adipisci quo nemo at minima.,4
68,429691303,2024-12-21,Tempora itaque culpa occaecati est incidunt tempora saepe sapiente.,2
69,602868621,2024-10-24,Odio mollitia ratione impedit facere fugit beatae temporibus.,3
69,482947700,2024-09-25,Alias neque eveniet asperiores temporibus in neque accusantium praesentium accusamus deserunt.,6
69,118421027,2024-12-02,Culpa aperiam accusantium distinctio repudiandae explicabo ut quasi error at hic reiciendis autem.,5
70,533052614,2023-10-06,Quo tempora aperiam culpa voluptates doloremque.,1
70,500961252,2024-06-10,Numquam aperiam nisi voluptatum debitis asperiores nemo.,2
70,265376711,2023-09-25,Ratione sint placeat aut natus fugiat facilis eaque possimus totam maiores.,2
71,602868621,2025-04-10,Alias rem praesentium eos dolor eaque tempore non error minus.,2
71,118421027,2025-02-07,Cumque consequatur doloribus provident laborum provident eveniet culpa.,1
71,824531293,2025-04-12,Ad beatae nam ratione in tempora libero facere distinctio consectetur eius libero.,5
72,738874307,2025-02-11,Hic animi similique minima enim veritatis nulla quod sequi soluta.,3
72,308396703,2025-03-07,Deleniti ratione repellat ea eum dicta omnis.,6
72,265376711,2024-12-26,Harum eius laborum neque velit voluptates rerum.,2
73,468498243,2025-01-20,Iure similique minima molestiae molestiae ratione atque.,2
73,606167458,2024-04-03,Facere corrupti amet dolorum qui laboriosam.,6
73,265376711,2024-08-04,A occaecati tempore voluptates perferendis eum ipsa iure labore sint asperiores asperiores praesentium.,7
74,261965569,2025-04-28,Fuga vel aperiam libero eum cumque.,2
74,76761221,2024-11-25,Nihil eveniet nam eveniet iure beatae amet itaque libero consectetur harum hic.,7
74,764712099,2023-10-15,Natus quaerat minima assumenda eius consectetur sequi inventore.,4
75,424016810,2024-06-01,Omnis ad iusto ad alias eius repellat.,4
75,82810988K,2025-03-01,Libero sit aut harum fugiat nobis ad illo nemo ipsa occaecati.,7
75,719733581,2024-09-22,Dolorem fugit quidem pariatur rem molestias exercitationem debitis nisi.,6
76,738874307,2025-04-29,Quos placeat consectetur sapiente labore vero nemo labore laudantium occaecati architecto facilis sit.,4
76,310818232,2025-04-25,Minima quam ab natus beatae provident.,6
76,476744407,2025-03-26,Corporis ipsa tempora dicta sunt dolorem pariatur ex.,4
77,108315393,2024-07-04,Incidunt vel ullam odio laborum nostrum dolore deleniti optio repellat.,5
77,429691303,2023-09-28,Reiciendis necessitatibus quo enim porro dignissimos consequatur eveniet nesciunt fugiat facere illum maiores.,6
77,19348520,2024-12-30,Laboriosam autem eveniet tenetur suscipit aspernatur voluptate atque.,5
78,649665834,2024-08-10,Nisi voluptatem dicta fuga quis blanditiis aperiam deleniti provident ipsum ipsam alias.,3
78,579522135,2024-03-09,Distinctio nihil corporis inventore eos consequuntur.,4
78,261965569,2024-04-30,Beatae voluptatum repellat aut magni amet explicabo odio nihil.,6
79,7493924,2025-03-10,Nobis culpa dignissimos exercitationem id eaque tempora minus aperiam.,3
79,482947700,2024-05-09,Minus enim non aut deserunt tempora voluptates cum.,1
79,723173418,2024-05-09,Mollitia veritatis dignissimos voluptates reprehenderit est possimus.,2
80,649665834,2024-09-28,Cumque asperiores nam consequatur quos quod temporibus rerum illo.,3
80,678358037,2024-08-24,Dolor numquam itaque vel eius eaque voluptates laudantium rem.,4
80,52362735K,2024-07-01,Repellat id placeat explicabo possimus voluptatibus ratione.,7
81,335015215,2024-11-09,Aspernatur saepe officia ullam nostrum odit aliquid totam quibusdam perferendis tempore tempora.,1
81,486934158,2024-12-05,Recusandae iure sunt quasi occaecati culpa id laudantium sit blanditiis repellat veritatis voluptate.,3
81,717291441,2024-07-13,Repudiandae quisquam beatae blanditiis reiciendis eos.,5
82,719733581,2024-11-01,Quisquam numquam architecto animi cupiditate ducimus quam tempore.,7
82,602868621,2025-03-07,Facere corporis cupiditate sequi aperiam iste consequatur architecto.,2
82,649665834,2024-07-15,Exercitationem eos omnis tempora a facilis placeat officia pariatur exercitationem illo voluptate.,6
83,288452296,2024-02-24,Nihil asperiores minima illum cum distinctio vero quod corporis.,2
83,108315393,2024-02-26,Id similique dolore nam molestias nesciunt omnis soluta blanditiis.,4
83,482947700,2025-03-30,Sunt ratione iure placeat illo optio iusto nam cupiditate dignissimos.,6
84,706028730,2025-02-17,Quia ad neque dolorum vel pariatur.,3
84,717603192,2024-11-16,Quos autem nesciunt vitae hic eum culpa officiis cupiditate.,6
84,118421027,2025-05-08,Accusamus ex animi distinctio beatae eos et officiis.,5
85,717291441,2025-03-12,Suscipit dolorum ab aliquid beatae eos natus non ea sequi illo quisquam.,1
85,764712099,2025-02-10,Doloremque molestiae soluta neque exercitationem nisi dolor quas numquam.,2
85,820677293,2025-04-07,Nostrum voluptatibus quis ullam voluptatum asperiores incidunt eos doloribus beatae.,7
86,764712099,2025-03-11,Vero neque qui commodi neque eius odio beatae error temporibus impedit deleniti.,1
86,847822864,2024-09-09,Deleniti accusantium fugit accusamus deleniti reprehenderit molestiae inventore.,4
86,76761221,2024-09-06,Quos nemo perferendis accusantium nam odio.,5
87,717291441,2025-01-20,Fugit ex consequuntur doloribus vitae expedita.,7
87,502640062,2023-09-06,Recusandae ut iste doloribus eum eius enim est.,5
87,335015215,2024-05-11,Dolore asperiores nulla hic animi odit esse nulla laboriosam eaque eligendi.,2
88,518808435,2024-03-16,Inventore maxime maxime eaque neque neque id similique.,5
88,824531293,2025-02-22,In distinctio explicabo nam perspiciatis totam nemo modi veritatis nulla debitis repudiandae.,6
88,606167458,2025-03-13,Et iusto quidem error voluptatem ut consequatur.,4
89,649665834,2025-04-16,Soluta incidunt molestiae iure alias numquam deserunt recusandae earum quod commodi quam facere.,3
