id_articulo,rut_revisor,fecha_revision,comentarios,calificacion
1,877648990,2025-02-07,Nobis eaque fugit asperiores dolorem dolor eveniet molestias.,5
1,768141746,2024-05-29,Reprehenderit illo quia praesentium quam labore.,7
1,506342201,2024-12-22,Autem recusandae adipisci reiciendis repellendus consequatur cupiditate.,7
2,892844682,2025-03-07,Commodi rerum accusamus placeat sit consectetur hic explicabo vero dicta.,7
2,592753936,2025-03-19,Enim nobis corrupti nisi optio enim facilis culpa accusantium omnis deserunt.,5
2,808227355,2025-04-02,Hic dignissimos eligendi rem enim dolorum neque quos delectus.,6
3,721081540,2025-03-09,Quos natus error architecto necessitatibus consequuntur ex aliquid.,2
3,862875117,2024-08-28,Rem accusantium incidunt consequuntur eum doloremque voluptate praesentium hic animi quae saepe.,2
3,949663183,2025-01-19,Fugiat harum iusto deserunt corrupti ea eaque dolore aut voluptatem nisi.,4
4,470086734,2025-03-23,Deleniti praesentium sapiente repellat dolorum debitis doloremque repellat et dolores debitis.,4
4,450557234,2025-04-15,In aperiam aliquid tempore id similique consectetur sapiente veniam cupiditate reiciendis in.,7
4,177614769,2025-03-08,Sunt quasi odio qui ex enim.,5
5,569915724,2024-10-07,At quisquam error debitis iusto quia consequuntur.,2
5,949663183,2024-10-03,At nihil recusandae culpa commodi pariatur autem cumque nobis facilis.,3
5,991843914,2024-10-13,Aut laboriosam possimus placeat voluptate quam nulla dicta.,4
6,661478306,2025-04-30,Inventore cupiditate dolore ducimus totam molestias eligendi dolore tenetur vel.,3
6,246261849,2024-10-30,Neque tenetur ratione sapiente est ipsa temporibus accusamus.,1
6,470086734,2025-03-07,Similique repellendus architecto voluptatibus doloremque doloremque sit unde saepe maiores.,1
7,960262786,2025-03-27,Unde quis nemo voluptatum aliquid fugiat commodi beatae porro perferendis consectetur aspernatur.,4
7,708305499,2025-02-02,Enim velit dolores cum perferendis harum.,7
7,215759008,2024-12-18,Distinctio animi deserunt perferendis deleniti aspernatur eius aspernatur nam.,1
8,592753936,2024-12-14,Itaque iste magnam quam temporibus veritatis officia dolor odit consequatur dolorem provident.,1
8,808227355,2025-01-21,Molestiae facilis ab aliquam tenetur expedita commodi.,6
8,470086734,2024-04-15,Optio laudantium voluptatibus autem dignissimos quia doloribus.,7
9,81249905K,2024-09-15,Dicta adipisci deleniti mollitia libero voluptates fuga enim assumenda architecto saepe culpa.,4
9,215759008,2024-10-22,Nihil sint maiores magni hic repellendus ipsa veniam eveniet aut.,3
9,755771K,2025-02-15,Dolorum laborum repellat sed possimus blanditiis nisi odio aliquam hic dolor.,4
10,70958872,2025-04-28,Impedit voluptatem in aperiam quisquam itaque.,6
10,960262786,2025-03-10,Fuga distinctio dolores error enim porro rerum sed corrupti suscipit aliquid quos.,6
10,162244973,2025-05-04,Cum quidem tempora non quibusdam aperiam consequuntur repudiandae quae.,6
11,470086734,2025-01-18,Optio laudantium laboriosam eaque quibusdam illum cumque natus.,1
11,708305499,2024-10-28,Eveniet libero tempora omnis ut modi adipisci officiis odit magni perferendis nisi in.,6
11,768141746,2025-01-01,Possimus rerum quaerat quisquam nisi totam ducimus.,3
12,811361135,2025-04-16,Numquam veritatis sapiente accusamus similique odit quaerat ex corporis facilis error.,7
12,70958872,2025-05-02,Deserunt doloribus cumque numquam in temporibus.,5
12,506342201,2025-04-01,Asperiores quia corporis doloremque animi pariatur dolores debitis.,4
13,661478306,2025-04-05,Sapiente quidem fugiat omnis sunt sapiente illo quas.,6
13,138996832,2025-04-07,Temporibus aspernatur velit esse rem impedit nemo.,6
13,768141746,2025-04-05,Animi quaerat dignissimos dolore veniam veritatis ratione facere ipsum fugiat.,7
14,548798477,2025-03-12,Deleniti aspernatur perspiciatis hic rem minus.,5
14,850748896,2024-02-12,Laudantium iure nihil dolores dignissimos veritatis atque quisquam ipsam similique distinctio dolorem.,6
14,433800532,2024-07-30,Maiores sit quia voluptatum iusto aliquam.,7
15,28930715K,2025-04-11,Eius tempora odio repudiandae fuga aliquam quia iusto sit sed.,7
15,450557234,2025-05-10,Perspiciatis at qui voluptates in fuga dicta.,2
15,131282516,2025-02-24,Quidem ratione amet ea repellat possimus excepturi nostrum vel.,3
16,915957536,2024-12-24,Perferendis voluptates deserunt eaque incidunt accusamus tempora suscipit nisi alias numquam fugiat unde.,5
16,215759008,2023-12-21,Assumenda incidunt aut quia quia hic adipisci quaerat facere nihil voluptas debitis.,2
16,991843914,2024-07-26,Aut vero nisi sint veniam magni eveniet aperiam.,7
17,81249905K,2025-01-29,Magni autem libero nesciunt ipsa eum saepe assumenda dolorum.,7
17,808227355,2023-12-22,Omnis vel quaerat officia quod veritatis distinctio.,1
17,592753936,2024-08-15,Labore architecto perspiciatis iusto mollitia ducimus.,5
18,246261849,2025-03-08,Quaerat necessitatibus maxime exercitationem minima voluptatem veritatis ipsam consectetur pariatur consectetur.,1
18,28930715K,2025-01-09,Asperiores corrupti tempore ab totam reprehenderit voluptatibus quod laboriosam dicta commodi saepe nisi.,1
18,543383023,2024-12-07,Pariatur sunt officiis dolore atque facilis assumenda consectetur.,7
19,28930715K,2024-12-16,Doloremque beatae voluptates quia reiciendis explicabo explicabo.,4
19,355429725,2025-04-20,Praesentium consequuntur neque quis vitae dicta.,5
19,543383023,2025-02-19,Quasi esse aut officia nobis accusantium corporis officia ea aliquid.,1
20,496401530,2024-12-11,Eveniet ipsa numquam a nesciunt fugit atque a neque nisi.,7
20,241803562,2025-04-13,Corporis asperiores non non hic totam ea.,6
20,506342201,2025-03-29,Quo dolorem non accusantium officiis eius eum.,7
21,177614769,2025-04-13,Eum eum debitis repellendus minima est perspiciatis soluta expedita impedit.,4
21,708305499,2025-02-19,Dolorum odio pariatur ducimus consequuntur corrupti explicabo possimus repudiandae fugiat dolorem architecto aspernatur.,3
21,768141746,2025-03-19,In blanditiis culpa molestiae fugit asperiores sunt distinctio nostrum voluptates.,6
22,450557234,2025-04-25,Vero error quis cum nesciunt voluptatum eos.,6
22,928198014,2024-12-27,Consectetur dolor in hic molestiae iure veniam nulla.,4
22,912363694,2025-01-07,Quasi deleniti sequi at dolorem quia nostrum atque aspernatur labore.,1
23,991843914,2024-11-07,Asperiores ratione architecto asperiores hic fuga voluptates inventore culpa vero.,4
23,598225230,2025-05-01,Sit ducimus vel id vero rem accusamus necessitatibus facere culpa quae temporibus.,3
23,70958872,2024-09-21,Omnis repellat ab aperiam aspernatur corporis officia.,5
24,177614769,2024-10-30,Perferendis culpa incidunt officiis commodi sed fuga explicabo omnis iure eveniet.,4
24,949663183,2025-04-13,Quasi harum quisquam earum itaque commodi.,1
24,768141746,2024-10-25,Odit laborum deleniti tenetur vitae eaque.,2
25,592753936,2024-07-08,Eius impedit ea perspiciatis voluptatum eum praesentium.,6
25,20964147K,2024-05-21,Perspiciatis nobis vitae quasi commodi voluptatem tenetur debitis quisquam sunt laboriosam voluptate dolore.,1
25,928198014,2024-11-28,Sed ex ratione culpa numquam placeat cum inventore autem nam eveniet error.,7
26,548798477,2025-01-05,Accusantium incidunt ipsam molestiae placeat cupiditate beatae.,5
26,928198014,2025-03-22,Dolorem natus molestiae optio ducimus laborum quas illum explicabo vitae voluptas tempora.,3
26,131282516,2025-01-24,Ex hic aperiam nemo hic labore voluptatibus asperiores.,3
27,506342201,2025-04-18,Quasi natus commodi vitae asperiores dolore possimus dolorum odio fugit similique.,4
27,569915724,2025-03-05,Autem sint voluptatum possimus eos neque laborum quibusdam sint.,5
27,949663183,2025-02-25,Labore distinctio suscipit quidem eaque quaerat.,2
28,20964147K,2025-05-12,Minus corrupti mollitia accusantium dicta veritatis recusandae commodi fuga sint voluptas.,5
28,912363694,2025-05-11,Adipisci vero neque consequuntur doloribus illum temporibus harum odit optio.,1
28,862875117,2025-05-09,Totam facilis omnis illo quia consectetur vero.,3
29,70958872,2025-05-07,Neque fugit occaecati asperiores praesentium tempore corrupti occaecati pariatur.,5
29,138996832,2025-05-10,Esse ex doloremque odio animi veritatis vel at modi vitae molestiae itaque porro.,1
29,755771K,2025-05-08,Quo perferendis voluptatem eveniet magni cum neque perspiciatis incidunt velit vitae omnis recusandae.,5
30,28930715K,2025-02-18,Ut ipsa ad illo fugit commodi.,2
30,808227355,2025-03-02,Accusantium magnam sunt culpa nam in eos necessitatibus quibusdam harum ex facilis.,4
30,470086734,2024-12-30,Cumque tempore magni tempora consectetur modi quibusdam iusto.,6
31,592753936,2024-02-07,Ad dolorem impedit reiciendis optio impedit ipsa dicta tempora expedita quisquam veritatis deserunt.,2
31,215759008,2024-04-02,Dolore enim commodi nobis minima quasi asperiores nesciunt laborum velit ad amet.,2
31,496401530,2023-07-15,Sed minus adipisci ea velit incidunt a dignissimos ab accusantium enim.,7
32,693767296,2025-01-31,Rerum modi delectus vero nemo voluptas libero molestias cum voluptate veniam veniam.,5
32,215759008,2025-01-10,Neque id enim quod dolor sint in voluptatum veniam perferendis sapiente quo.,1
32,63303232,2024-12-12,Nobis corporis dolore aliquam itaque officia maiores a aliquam.,3
33,928198014,2025-04-20,Quibusdam pariatur in odit soluta dolore saepe cupiditate officiis iste.,2
33,654001588,2025-03-20,Placeat quas quam provident officia esse delectus.,3
33,241803562,2025-02-11,Hic fuga atque eius magni a.,5
34,215759008,2024-03-08,Harum qui rerum et maiores itaque.,2
34,686369072,2024-11-23,Ipsum aliquid delectus sit rerum temporibus commodi voluptatibus amet sint quia nostrum in.,6
34,506342201,2025-01-13,Pariatur voluptas perspiciatis magni nostrum quas.,7
35,241803562,2025-02-06,Quod mollitia eligendi fugit similique nesciunt assumenda dolore.,2
35,592753936,2025-01-27,Rem porro iste fuga animi culpa maxime dolorum sed.,2
35,70958872,2025-04-27,Totam hic eos autem cumque optio labore.,3
36,131282516,2024-06-08,Atque ut tempore nihil eum libero.,5
36,355429725,2024-02-19,Eveniet nulla similique velit beatae dolorem dolores pariatur cupiditate architecto cumque.,4
36,215759008,2024-12-20,Nihil molestiae eius vel reiciendis hic fuga.,3
37,910763059,2025-02-04,Tempore voluptatem maxime porro quae nostrum dignissimos voluptatum suscipit voluptate harum et blanditiis.,7
37,28930715K,2025-03-31,Nostrum aperiam eum ipsam et ut labore maxime quod ex impedit tempore dignissimos.,4
37,246261849,2025-02-21,Officiis consequuntur cum officiis magnam nobis ducimus alias aperiam laboriosam odio.,2
38,909825660,2025-03-18,Harum sequi explicabo distinctio asperiores accusantium assumenda quia veniam enim unde.,3
38,506342201,2024-03-14,Unde officiis nostrum totam doloremque rerum expedita culpa quibusdam velit occaecati.,2
38,949663183,2024-04-04,Hic expedita fuga sit totam minus officiis harum optio iusto.,7
39,877648990,2025-04-04,Quia occaecati veniam odio illum vel illum nam numquam porro suscipit ea nihil.,4
39,850748896,2023-12-14,Ut maxime fugiat tempore eius odit totam rem.,2
39,246261849,2024-12-17,Veritatis sapiente rerum aut sed quis repudiandae ducimus.,7
40,960262786,2025-03-06,Nihil occaecati cumque nulla eos suscipit expedita quod voluptatibus.,5
40,450557234,2025-03-23,Suscipit fugit alias aspernatur exercitationem consectetur.,2
40,598225230,2025-03-08,Optio quia quam nostrum quam aut maiores voluptatibus delectus accusantium possimus reiciendis dolorum.,3
41,892844682,2025-03-20,Corporis asperiores unde corporis officiis ab rem reprehenderit occaecati sapiente cumque ducimus minus.,4
41,928198014,2025-04-20,Ullam reprehenderit corporis tempore incidunt nostrum.,2
41,592753936,2025-04-07,Molestiae vitae dignissimos repudiandae laudantium aspernatur provident praesentium voluptas provident itaque.,1
42,470086734,2025-04-26,Eius vitae aliquam ad quidem sit a.,5
42,131282516,2024-07-12,Provident nisi corrupti porro aperiam aut tempora neque tempore.,5
42,569915724,2024-04-13,Aspernatur neque quaerat delectus nemo dolore tempora quaerat facere.,5
43,215759008,2024-11-27,Tempora ratione esse qui optio architecto unde excepturi animi vel accusamus nam.,6
43,928198014,2025-04-15,Ullam placeat expedita dolores eaque incidunt assumenda rerum.,1
43,81249905K,2024-10-07,Dolorem amet quidem cupiditate minus quo quidem animi nesciunt exercitationem dolores quod.,1
44,28930715K,2024-06-07,Accusamus quidem minus earum eaque sequi quasi ex dolorum et.,7
44,661478306,2024-12-02,Facere vitae odio nostrum tempora aspernatur quod quidem.,6
44,892844682,2024-04-22,Et officiis quasi impedit aut commodi sit praesentium sunt.,2
45,162244973,2025-02-05,Accusantium repellendus eos provident officiis ab consequatur.,2
45,928198014,2025-03-13,Numquam recusandae aliquid perferendis quibusdam impedit voluptate placeat mollitia tenetur id tempore.,6
45,569915724,2024-11-23,Laborum rerum harum pariatur quo vel eum recusandae optio quia.,1
46,138996832,2024-12-19,Voluptas unde ratione praesentium similique iusto nemo suscipit reiciendis error.,4
46,548798477,2025-04-19,Beatae voluptate maxime perspiciatis quibusdam numquam eligendi reprehenderit porro laboriosam nobis.,7
46,693767296,2024-12-25,Assumenda consequuntur consequuntur deserunt corporis possimus amet.,1
47,81249905K,2024-07-17,Veritatis natus voluptatum rerum harum inventore error explicabo culpa.,5
47,598225230,2025-02-15,Consectetur fugit accusamus consectetur nulla nostrum temporibus culpa fugit consequatur.,1
47,808227355,2024-07-06,Nihil id totam fugit neque natus inventore ratione earum in a facere.,6
48,877648990,2025-03-02,Doloremque sapiente nisi explicabo molestiae repellendus.,4
48,131282516,2025-03-01,Tempora quam doloribus delectus explicabo laudantium suscipit tenetur.,7
48,433800532,2025-05-11,Iusto quaerat dicta atque et expedita dicta provident reprehenderit eius.,2
49,177614769,2024-03-13,Iste eius velit corporis quae recusandae dolore quibusdam vel minus quia distinctio voluptatibus.,3
49,768141746,2024-08-08,Impedit ratione praesentium perferendis itaque molestias magni praesentium in totam culpa aliquam.,3
49,755771K,2024-01-23,Aliquam voluptate eaque possimus nulla distinctio tenetur delectus eum.,7
50,246261849,2025-04-25,Vel quisquam ut modi laborum ipsam consectetur praesentium magni aspernatur.,5
50,960262786,2025-04-17,In nesciunt assumenda labore eligendi quas vero vero at fugit minus.,4
50,433800532,2025-02-12,Impedit non vitae minus excepturi doloremque consequatur aspernatur ipsam.,1
51,138996832,2025-03-06,Ducimus facilis rerum pariatur vel quidem.,2
51,877648990,2025-04-05,Accusamus esse in aspernatur neque nihil nostrum quas earum.,3
51,991843914,2025-03-25,Similique natus excepturi recusandae quam atque inventore repellat.,2
52,450557234,2024-04-05,Repellat nihil adipisci rerum reprehenderit provident vitae reprehenderit.,5
52,991843914,2025-04-18,Exercitationem exercitationem possimus hic aut sapiente accusamus quam.,4
52,569915724,2024-06-19,Omnis sequi cupiditate dolor iure soluta nisi reprehenderit maiores dolor vel deserunt delectus.,5
53,592753936,2024-12-07,Odit quae accusantium iste sunt dolores consequatur rem quisquam dignissimos.,7
53,543383023,2025-02-05,Id natus laudantium minima est culpa eius animi illo accusantium.,4
53,850748896,2025-04-08,Facere aliquam nihil quo doloremque vitae.,7
54,850748896,2024-05-15,Iure nihil autem iste molestias tempora.,7
54,81249905K,2024-07-12,Itaque possimus commodi nihil odio natus repudiandae doloremque magnam quasi.,6
54,960262786,2025-02-04,Quam deleniti sapiente saepe iste ratione facilis.,3
55,246261849,2025-04-27,Inventore ut molestias architecto sunt expedita ipsa occaecati fugit id ad odio voluptate.,2
55,661478306,2024-09-10,Debitis praesentium vitae quisquam dolore perferendis voluptatem ducimus cupiditate pariatur.,1
55,138996832,2025-03-06,Officia doloribus est non iste magni consequatur.,4
56,892844682,2024-10-19,Id temporibus dolores sequi ratione explicabo rem.,3
56,708305499,2023-12-31,Similique nisi impedit repellendus suscipit ex reprehenderit placeat facere sed.,3
56,177614769,2024-06-23,Numquam nemo laborum debitis sint natus iure.,4
57,598225230,2023-12-22,Iusto omnis cum beatae quod aut delectus.,3
57,28930715K,2024-08-14,Maiores laborum cum temporibus molestiae nesciunt possimus repudiandae nulla sapiente omnis.,1
57,991843914,2024-08-22,Possimus deleniti omnis reprehenderit corporis ab vel expedita ipsum facilis dolorum voluptatum libero.,7
58,991843914,2025-04-27,Nulla culpa vitae nam sint blanditiis rem dolore voluptatem incidunt.,3
58,960262786,2025-01-24,Itaque quod iusto magni vitae ut.,3
58,70958872,2024-12-23,Laboriosam enim magnam rem praesentium aliquam vero placeat.,1
59,215759008,2025-05-06,Fugiat perferendis eveniet facilis repellat culpa voluptates voluptatibus explicabo cumque error laboriosam.,1
59,569915724,2025-04-05,Facere quibusdam eos totam doloribus fugiat veniam eius laudantium quaerat vero atque.,1
59,686369072,2024-09-26,Omnis consequuntur voluptate laborum aut nihil quo ex blanditiis magni earum.,4
60,768141746,2024-11-01,Temporibus aspernatur explicabo maxime exercitationem tenetur perferendis sit delectus quasi eos est.,3
60,598225230,2025-03-24,Modi ullam laudantium quidem vel nisi vel architecto asperiores quia veritatis laborum incidunt ducimus.,7
60,215759008,2024-11-05,Alias praesentium dolor laboriosam eaque consequatur natus corporis maiores laborum corrupti iusto quis.,6
61,433800532,2024-05-15,Totam suscipit deserunt illo dignissimos magnam blanditiis in minus culpa esse.,5
61,808227355,2024-08-18,Ipsam et et quas natus laborum reiciendis dolore nemo.,4
61,960262786,2025-02-05,Perspiciatis aut modi voluptates perferendis ipsam.,3
62,708305499,2024-09-14,Expedita doloribus velit libero earum accusamus.,4
62,721081540,2024-12-07,Incidunt aperiam quo cum quas voluptatem in error quaerat iusto.,1
62,960262786,2024-09-26,Nulla est dolor cupiditate ipsa omnis.,5
63,661478306,2025-05-01,Nulla in quisquam omnis et laudantium rem.,4
63,470086734,2025-04-30,Iste architecto cupiditate itaque adipisci aut corporis modi voluptas quasi.,6
63,246261849,2025-05-01,Eius voluptatem aperiam exercitationem dolore voluptate voluptas alias vitae consequatur voluptas pariatur rerum.,2
64,405734389,2024-11-18,Nam perferendis error minus reiciendis veniam cupiditate similique corporis.,3
64,496401530,2024-11-09,Molestiae sed sequi molestiae laudantium a quia magni.,3
64,241803562,2024-08-13,Quis quas quod delectus nesciunt praesentium.,6
65,708305499,2025-02-10,Dolore saepe sequi qui voluptate sunt labore quo soluta minus similique quam.,4
65,569915724,2025-02-16,Laboriosam officiis fuga temporibus molestias beatae nobis animi nulla similique corrupti aspernatur.,6
65,20964147K,2025-01-10,Reprehenderit nulla corporis adipisci voluptatem qui at incidunt consectetur officiis nemo minima voluptate.,6
66,755771K,2024-11-03,Porro odit sint laudantium enim laudantium.,6
66,708305499,2025-03-29,Accusamus pariatur saepe excepturi earum sit.,1
66,177614769,2025-02-27,Laboriosam dignissimos velit neque omnis reiciendis.,3
67,138996832,2025-05-03,Assumenda quod tempora eaque ea non blanditiis officia reiciendis veniam corrupti.,4
67,960262786,2024-12-15,Nam quo nemo commodi omnis alias accusantium nemo impedit qui quaerat architecto.,5
67,708305499,2024-12-10,Nisi nemo provident modi suscipit aliquam molestias laborum quam expedita sequi quas rem.,7
68,892844682,2025-03-18,Corrupti accusantium accusantium sapiente libero quos.,7
68,909825660,2025-03-27,Ab accusantium commodi omnis impedit occaecati dolorum numquam numquam vero eum non.,4
68,949663183,2025-04-06,Nam eaque non corrupti dignissimos corrupti porro rem saepe harum consectetur.,1
69,28930715K,2024-10-23,Quasi nam commodi atque ea repellendus ut deleniti amet saepe labore.,1
69,661478306,2024-07-29,Asperiores labore molestiae debitis minus saepe odio perspiciatis magnam.,5
69,768141746,2025-04-10,Vitae illo in non ipsam perferendis error velit minus tempora vero perspiciatis.,5
70,70958872,2024-05-19,Iusto repellendus esse neque distinctio quae consectetur.,7
70,892844682,2024-07-12,Consequuntur aliquam facilis aperiam eveniet labore quisquam optio iste quaerat unde iusto.,7
70,241803562,2024-11-25,Quis tempore sunt ex ex eos voluptate minus.,6
71,850748896,2024-10-27,Alias eaque repudiandae maxime ut repellat aperiam praesentium impedit excepturi numquam.,5
71,506342201,2024-10-17,In vero enim sapiente quidem omnis illum quasi ipsam dicta.,6
71,768141746,2024-09-26,Nihil ex nisi facilis necessitatibus debitis occaecati sint corrupti cumque aspernatur modi deserunt.,1
72,450557234,2025-01-03,Commodi voluptas minima esse vero quae expedita reprehenderit dolore dolore.,4
72,755771K,2024-08-24,Eius at officia maiores impedit aliquid pariatur veniam quis porro suscipit quod tempore.,3
72,81249905K,2024-10-27,Aperiam unde sit magni nemo corporis molestias aperiam autem alias eum.,7
73,138996832,2025-03-25,Qui et architecto quod et aperiam quos et debitis.,1
73,661478306,2024-11-06,Aliquid aut id cumque cupiditate possimus consectetur esse mollitia.,3
73,708305499,2024-12-12,Officia consequuntur repudiandae iste officiis consequuntur.,7
74,686369072,2024-10-11,Eius quia cum saepe inventore hic in eius ipsa aliquam vitae quos.,3
74,892844682,2025-01-29,Eius aspernatur commodi vel doloremque adipisci voluptates ducimus assumenda animi quisquam.,4
74,70958872,2025-04-23,Voluptates officiis consectetur cum dolorum sint doloribus rerum.,3
75,355429725,2024-03-15,Explicabo repellendus necessitatibus perspiciatis rerum soluta deleniti eum.,7
75,592753936,2024-06-08,Nam veritatis hic magni enim qui eius assumenda animi.,2
75,246261849,2024-04-10,Placeat repudiandae ab exercitationem ab in amet voluptatem.,1
76,28930715K,2024-12-01,Fugit laboriosam repudiandae eos alias unde in.,7
76,114634794,2025-02-01,Sapiente maxime nesciunt perspiciatis ipsam adipisci.,5
76,569915724,2024-10-23,Alias minima ea numquam et occaecati animi.,2
77,991843914,2024-04-25,Odit et eligendi magnam dolorum ipsam placeat ipsa accusamus harum enim.,7
77,960262786,2023-09-17,Ex sequi non veniam quia nobis aut exercitationem reiciendis non dolores aut.,7
77,661478306,2024-02-22,Consectetur culpa placeat molestiae distinctio minima expedita vel exercitationem architecto.,6
78,811361135,2023-09-26,Amet eligendi sunt quae non optio laborum dolor debitis ipsa incidunt.,4
78,70958872,2024-11-29,Mollitia ratione sint maiores pariatur quae maiores autem.,3
78,28930715K,2023-12-10,Dolores et veritatis dolorem nesciunt enim aperiam quisquam reiciendis.,3
79,496401530,2024-04-26,Quisquam voluptate laboriosam ratione quisquam ipsa possimus tenetur.,1
79,215759008,2025-05-02,Ea expedita rerum enim molestias dolorem cum temporibus quia eum corporis nihil ut.,4
79,162244973,2024-10-23,Pariatur neque repellat ea sed labore consectetur velit.,1
80,246261849,2024-04-24,Eos tenetur tempora culpa sapiente libero ab.,7
80,960262786,2025-05-05,Cupiditate culpa eum atque quisquam laborum eos.,6
80,355429725,2024-09-29,Ea blanditiis qui illum rem ratione.,3
81,81249905K,2025-04-02,Ab maiores unde perferendis suscipit nam quia nostrum.,5
81,598225230,2024-12-17,Adipisci doloremque maxime magni hic rem quod quibusdam reiciendis veritatis labore quos nam.,2
81,592753936,2024-12-15,Laborum sunt autem voluptatum earum natus alias eveniet.,6
82,850748896,2024-12-09,Consequatur impedit amet molestiae atque atque doloribus alias nulla aperiam odit.,3
82,433800532,2025-04-16,Doloremque porro consequatur ratione voluptates voluptatem error similique porro in omnis asperiores suscipit.,6
82,28930715K,2025-05-03,Veritatis natus sapiente aliquam harum ad deserunt.,3
83,991843914,2025-04-11,Exercitationem at nobis molestiae impedit autem molestias nemo deleniti saepe ex nihil.,7
83,138996832,2025-03-25,Facere saepe commodi consequuntur omnis soluta.,3
83,496401530,2025-02-24,Qui ea sapiente culpa minima ex asperiores distinctio.,5
84,131282516,2025-05-09,Cupiditate ea id ducimus voluptas distinctio pariatur quo cumque tempora sed.,7
84,928198014,2024-01-06,Nostrum temporibus culpa deleniti odio voluptate optio nesciunt.,6
84,598225230,2024-10-27,Repudiandae aliquam quod possimus rerum est aliquam cumque accusantium.,2
85,808227355,2025-05-06,Accusamus culpa earum maiores veritatis dolore alias blanditiis.,5
85,506342201,2025-05-08,Ut illum ea aliquam repudiandae rerum numquam recusandae molestiae eius animi similique.,4
85,592753936,2025-05-01,Qui soluta aliquam autem maxime corporis magni totam cum cum.,7
86,862875117,2024-11-27,Dolorem molestias corporis dolore perferendis porro.,2
86,63303232,2025-03-30,Alias eum sit delectus eius voluptates accusamus exercitationem iusto sint dicta.,3
86,808227355,2025-03-21,Cumque quae delectus sed tenetur doloremque rerum nemo repellendus.,2
87,433800532,2024-03-27,Numquam necessitatibus ad nam quo id recusandae voluptatibus incidunt labore sed dolorum nemo.,1
87,450557234,2024-06-28,Iusto cupiditate soluta iure tempora temporibus perspiciatis mollitia.,1
87,114634794,2025-01-24,Eveniet sapiente in debitis inventore earum optio eveniet vero.,3
88,991843914,2025-02-17,Quos placeat optio ex distinctio magni repellat minus quidem qui distinctio fugit.,6
88,177614769,2023-12-22,Accusamus aliquam eum facere quisquam nemo totam voluptates soluta saepe tempora.,4
88,661478306,2024-01-22,Culpa sed numquam pariatur iure repellat totam animi.,5
89,808227355,2023-07-08,Rerum cupiditate facilis voluptatibus facere magni ducimus consequatur.,5
89,598225230,2024-11-17,Animi officia dolor optio quos minus reprehenderit magni sapiente.,5
89,877648990,2024-02-08,Earum quae ab suscipit ea quod perspiciatis incidunt quibusdam autem illo suscipit ipsam.,5
90,506342201,2024-07-27,Voluptates repellendus cumque accusamus accusantium temporibus at vero temporibus.,2
