id_articulo,rut_revisor,fecha_revision,comentarios,calificacion
179,768141746,2024-07-29,Omnis aliquam mollitia nobis accusamus quam ipsam quae ducimus.,7
179,20964147K,2024-06-21,Vel placeat illo exercitationem autem laborum consequuntur esse.,2
179,496401530,2025-02-10,Recusandae provident quos soluta velit animi harum.,2
180,949663183,2025-04-03,Nobis ut neque veritatis soluta vitae doloribus nesciunt nihil.,3
180,912363694,2024-11-04,Tenetur totam earum est quam rerum consequatur consequuntur.,2
180,661478306,2025-01-29,Quisquam possimus amet dignissimos qui sequi error consequatur consequatur ipsam quae corporis.,4
181,949663183,2024-11-14,Rerum sed eveniet esse eum debitis cumque necessitatibus nobis quisquam architecto minus quidem.,6
181,81249905K,2024-04-10,Rem odit ullam soluta sint eum.,5
181,598225230,2025-01-21,Beatae delectus a nisi sed voluptatem inventore tempora eos.,1
182,907304663,2025-03-07,Nobis a consequuntur debitis natus officia placeat porro eligendi alias quo.,2
182,877648990,2025-03-21,Atque molestiae atque assumenda unde laboriosam ut qui iusto facere enim nostrum placeat.,7
182,81249905K,2025-01-03,Corporis temporibus dolore sit explicabo odit placeat commodi cupiditate neque.,4
183,28930715K,2025-01-21,Quas exercitationem nesciunt maxime voluptatum esse repellendus reprehenderit iure facilis.,5
183,81249905K,2024-11-21,Similique facilis quos repellendus possimus similique sint alias.,5
183,433800532,2024-11-22,Cupiditate voluptas neque quos nobis ullam harum distinctio possimus.,2
184,912363694,2025-03-10,Sint in eum culpa a suscipit possimus distinctio ipsa laudantium.,2
184,496401530,2024-01-07,Nisi provident iusto totam adipisci similique eius consectetur enim provident natus pariatur corrupti.,6
184,114634794,2024-04-15,Ut veniam deleniti reiciendis enim aspernatur ducimus perferendis reprehenderit vel quae maxime ex.,3
185,355429725,2024-11-06,Nobis temporibus accusantium quia blanditiis unde ipsa.,3
185,131282516,2024-04-14,Optio nobis repudiandae natus suscipit atque harum facilis laboriosam.,2
185,162244973,2024-09-15,Porro veritatis placeat modi minima deleniti laudantium nobis ab molestiae nesciunt provident cumque.,5
186,721081540,2025-04-28,Culpa vero deserunt inventore repellendus reprehenderit officiis atque excepturi explicabo dolore.,6
186,755771K,2024-10-14,Reprehenderit impedit ipsa excepturi quasi impedit a aliquam numquam.,3
186,949663183,2024-07-29,Ipsum omnis facere porro animi suscipit explicabo.,7
187,598225230,2025-02-26,Quidem eveniet repellendus quis harum fuga temporibus non culpa ipsam.,5
187,506342201,2025-01-20,Explicabo impedit vitae dicta quisquam soluta.,2
187,850748896,2025-02-18,Eligendi atque quos dignissimos ipsum laboriosam corrupti iusto molestias.,3
188,892844682,2025-05-06,Laborum nulla dolor impedit sit nisi illo.,3
188,768141746,2025-04-24,Odio quod ullam tenetur dignissimos excepturi quidem.,4
188,708305499,2025-03-25,Assumenda illum architecto nostrum explicabo sequi esse.,2
189,850748896,2025-04-17,Ullam alias praesentium quaerat consectetur provident.,3
189,768141746,2024-10-01,Magnam molestiae numquam officiis dolorum nesciunt magnam.,2
189,909825660,2023-10-11,Quas facilis magnam nam maiores voluptatibus accusamus autem perferendis iste quaerat consequuntur ipsum.,1
190,28930715K,2025-04-29,Enim error praesentium aut ullam nobis quod nemo earum.,6
190,63303232,2024-04-17,Rem totam itaque ducimus adipisci repellendus animi odit esse dolorum autem necessitatibus architecto.,6
190,246261849,2025-04-07,Quisquam impedit nihil facere voluptatum eaque.,2
191,20964147K,2025-04-28,Similique ullam nihil perspiciatis commodi ducimus qui.,4
191,928198014,2025-05-04,Aspernatur maiores dolores aperiam itaque officiis delectus nihil iure id adipisci libero.,2
191,22835581K,2025-03-18,Autem repellendus ipsam optio consequatur quam nulla inventore tempore sint cum velit.,6
192,708305499,2024-04-20,Corrupti natus doloremque odit iusto quis.,1
192,960262786,2024-09-13,Eaque soluta sapiente ad sint et impedit unde nam vero voluptate possimus.,2
192,215759008,2024-04-24,Provident blanditiis repellat natus rem molestias nisi accusamus recusandae incidunt sint.,6
193,138996832,2024-02-28,Vel quo adipisci iusto dolore quibusdam neque ea est praesentium nostrum assumenda.,5
193,991843914,2024-06-26,Porro repellat beatae maxime adipisci quae odio maiores at corporis.,1
193,81249905K,2024-02-03,Reprehenderit labore ratione consequatur eius magni autem tenetur ut molestias.,5
194,138996832,2025-04-13,Explicabo veniam similique vel atque veritatis perspiciatis odit id expedita libero quam.,1
194,912363694,2024-01-17,Quae perspiciatis repellat dolor perferendis minima eligendi.,4
194,355429725,2025-05-01,Exercitationem doloremque delectus atque impedit voluptatum aut voluptatibus molestiae assumenda minima.,5
195,355429725,2025-04-14,Maiores veritatis omnis numquam debitis rem totam.,1
195,912363694,2025-05-10,Officiis blanditiis provident animi commodi labore nihil necessitatibus perspiciatis ullam tempora.,1
195,177614769,2025-05-03,Itaque veritatis consectetur nostrum officiis esse unde soluta quam dicta.,1
196,960262786,2025-01-05,Delectus at explicabo animi voluptatem maiores natus.,3
196,569915724,2024-01-15,Amet fugit saepe in consequatur id possimus ipsum quae consequatur.,5
196,708305499,2025-02-09,Deserunt praesentium facilis aliquid delectus qui minima omnis.,2
197,138996832,2025-05-07,Magni ducimus magnam non aperiam ducimus molestias exercitationem.,5
197,506342201,2025-05-06,Debitis delectus consectetur blanditiis blanditiis aspernatur voluptate consequuntur quidem.,7
197,850748896,2025-04-10,Sed a quia doloremque itaque adipisci voluptates reprehenderit nesciunt.,5
198,960262786,2025-03-20,Reiciendis accusantium accusamus sed mollitia pariatur sapiente dolore esse ab odio.,4
198,114634794,2024-11-05,Dignissimos voluptas repellendus ea aut incidunt assumenda officia quibusdam cum.,2
198,241803562,2025-04-30,Qui ratione eaque omnis tempore quibusdam quasi suscipit earum.,2
199,241803562,2024-12-24,Voluptatem beatae exercitationem minima numquam excepturi ex non harum temporibus libero.,1
199,912363694,2024-12-05,Dolores possimus inventore velit nesciunt vel.,6
199,928198014,2025-04-01,Omnis rem non maiores rerum quo cumque eligendi.,2
200,686369072,2024-08-06,Hic occaecati corrupti earum unde rem rerum praesentium doloremque.,5
200,892844682,2024-10-27,Est nam placeat quia rem ullam molestiae voluptatem laudantium autem cumque soluta.,5
200,912363694,2025-04-10,Dolores ipsum veritatis earum dolor ea.,5
201,912363694,2024-02-25,Et vel praesentium aspernatur quasi illum et labore esse alias eaque fuga quod.,1
201,928198014,2024-02-25,Blanditiis non ab excepturi culpa asperiores ab molestias in quis.,5
201,960262786,2024-06-11,Ad quos eum magni fugit nostrum voluptatibus est ipsam.,4
202,755771K,2024-04-02,Voluptatem doloremque eligendi dignissimos consequatur nulla quaerat sunt eligendi nesciunt commodi minima officia.,7
202,912363694,2024-08-10,Commodi dignissimos aliquid est aperiam illo tenetur reiciendis.,7
202,909825660,2025-03-05,Impedit illum blanditiis facilis hic ratione sequi adipisci est.,6
203,598225230,2025-05-04,Cum veniam velit sunt cumque modi.,3
203,138996832,2024-09-26,Vitae minus alias reiciendis odio voluptates quasi a vitae delectus.,3
203,991843914,2024-07-14,Et ea suscipit ipsum minus ut quisquam veniam.,1
204,912363694,2024-12-13,Cum voluptatem occaecati consectetur placeat eaque facilis dolorum.,1
204,433800532,2025-01-24,Perferendis quod culpa molestiae labore ad ea suscipit tenetur.,2
204,450557234,2025-05-10,Mollitia a impedit facilis dicta recusandae beatae alias veniam perferendis sint accusantium numquam.,2
205,138996832,2025-04-24,Itaque assumenda laudantium perferendis ut illum provident.,1
205,768141746,2025-03-28,Voluptatibus eum voluptatem deserunt enim odit veritatis minus aliquid debitis temporibus odit.,2
205,450557234,2025-05-03,Nemo officiis dolor architecto praesentium temporibus magni explicabo numquam pariatur voluptatem.,6
206,433800532,2025-02-10,Perspiciatis quam quas deserunt mollitia nulla maiores laudantium quaerat culpa.,3
206,450557234,2025-03-31,Voluptatem rerum aliquid veritatis veniam assumenda voluptatum delectus laboriosam.,2
206,661478306,2025-02-08,Laudantium quas tempora est ut quibusdam corrupti error necessitatibus cum ipsam.,7
207,355429725,2024-08-08,Quis ipsa sit delectus neque recusandae dicta ea accusamus.,7
207,892844682,2025-01-23,Quisquam eum numquam nostrum distinctio porro nemo accusantium dolor nobis sunt.,1
207,20964147K,2024-07-18,Eaque sapiente fugiat molestias necessitatibus ullam hic quidem odit voluptate unde eaque reprehenderit.,2
208,708305499,2025-02-24,Expedita facere optio saepe expedita voluptate illum quasi quaerat unde.,7
208,892844682,2025-04-07,Debitis at harum vitae nihil quas.,7
208,960262786,2024-11-04,Blanditiis consectetur reiciendis minima autem inventore numquam repudiandae animi.,5
209,20964147K,2023-12-09,Laboriosam ducimus temporibus fugiat animi doloribus natus voluptatem eum neque.,6
209,496401530,2024-08-30,Esse a modi soluta accusamus incidunt ipsa provident quis repudiandae non distinctio consequatur.,1
209,654001588,2024-09-28,Occaecati aliquam nisi molestiae quas laborum consectetur unde saepe.,4
210,708305499,2024-01-29,Voluptates debitis harum vitae nisi iste provident unde.,1
210,506342201,2023-10-27,Inventore rem dicta quod non distinctio quia deserunt vel nemo totam rerum provident.,7
210,949663183,2024-07-12,Quo necessitatibus dolore voluptatem at amet.,3
211,960262786,2025-03-21,Repudiandae quasi quidem labore eos est ducimus.,4
211,928198014,2025-03-25,Porro distinctio atque nemo facilis harum aliquid quia voluptatibus modi amet et cum nostrum.,7
211,912363694,2025-04-07,Dolorum sapiente error dolorem consequuntur illo placeat tenetur facere suscipit quod qui suscipit.,2
212,693767296,2024-10-26,Harum dicta voluptatum ipsa maiores odit.,6
212,70958872,2024-08-10,Aspernatur quisquam libero ea maiores placeat cum repudiandae nulla exercitationem perferendis necessitatibus.,3
212,686369072,2024-09-23,Rem est vitae doloremque laudantium magnam at soluta.,5
213,949663183,2024-10-20,Cumque excepturi alias suscipit sequi consectetur quam quae.,4
213,892844682,2025-02-18,Est nulla dolorem adipisci expedita earum modi eaque deserunt iure ab praesentium.,7
213,433800532,2024-03-13,Debitis magnam animi harum odio ratione sit nemo nobis architecto laudantium.,3
214,28930715K,2025-04-28,Nisi accusantium delectus nihil fuga quas blanditiis ratione voluptatibus.,1
214,215759008,2024-06-12,Tempore ipsum repellendus veritatis sed iste molestias quam esse.,1
214,177614769,2024-06-07,Incidunt voluptate ea aperiam ratione delectus sit necessitatibus vitae dolores tenetur placeat vel.,3
215,81249905K,2025-03-16,Praesentium inventore aliquid doloribus aperiam ea sit consequuntur voluptatibus rem quidem quia officia.,7
215,892844682,2025-03-06,Ad nostrum nulla cum libero totam assumenda.,3
215,960262786,2025-02-25,Ipsa debitis omnis minima unde nam ex repellendus debitis modi pariatur quasi.,6
216,70958872,2024-06-08,Occaecati officia praesentium distinctio temporibus fuga voluptas totam temporibus placeat.,7
216,598225230,2024-08-15,Deserunt doloremque alias reprehenderit similique quibusdam quasi occaecati.,3
216,755771K,2024-01-26,Hic sint aliquam ipsum veniam id facilis amet dolorem perferendis.,4
217,355429725,2024-11-30,Maiores non velit veritatis dolore architecto molestiae ea ullam perferendis laboriosam.,2
217,215759008,2024-11-17,In corrupti nobis praesentium beatae sint reiciendis saepe possimus accusamus porro laudantium debitis.,7
217,808227355,2024-12-10,Saepe eum quisquam corrupti fugit aliquid iusto.,1
218,450557234,2025-03-30,Voluptatem eos eveniet nisi quia accusamus iste necessitatibus repellendus nostrum error sit aspernatur perferendis.,7
218,433800532,2025-05-12,Voluptatibus tempora officiis explicabo illo numquam nobis inventore.,6
218,808227355,2025-05-11,Earum quidem mollitia voluptatibus voluptates alias iure iure tenetur cum voluptatum.,7
219,506342201,2024-12-04,Doloribus praesentium suscipit sint ea aliquam suscipit modi consectetur nemo distinctio.,1
219,661478306,2024-12-20,Officiis qui nam beatae inventore libero adipisci assumenda necessitatibus cum.,7
219,877648990,2025-04-02,Autem blanditiis hic odio incidunt ad vitae eligendi quod modi cupiditate.,6
220,768141746,2025-04-11,Cum ab voluptatibus cupiditate nemo ullam quasi possimus harum cumque qui quo.,2
220,506342201,2025-04-08,Error ipsa sunt aspernatur error inventore alias qui.,3
220,960262786,2025-05-07,Maxime natus non esse dicta dicta minima.,7
221,246261849,2025-03-18,Est sint necessitatibus eum quisquam eveniet sed fuga provident suscipit esse.,4
221,138996832,2024-07-28,Maxime architecto vel veniam laudantium veniam nostrum pariatur necessitatibus ea alias tempore sunt.,3
221,506342201,2024-09-24,Cum eos maiores odio consectetur nesciunt quaerat accusamus explicabo harum ad.,7
222,928198014,2025-04-05,Neque quisquam architecto labore quis ratione ullam similique nulla explicabo nemo accusamus repudiandae.,4
222,907304663,2025-01-25,Ut voluptatem praesentium error inventore ratione eligendi officia odit.,5
222,949663183,2025-03-19,Fugiat corrupti occaecati voluptate unde voluptatem beatae repellendus quia unde nihil.,1
223,22835581K,2023-11-07,Ipsam doloribus libero quam pariatur quasi iure minima distinctio.,7
223,892844682,2024-08-23,Et minus qui et nobis explicabo ut necessitatibus commodi provident quos.,6
223,592753936,2023-09-29,Voluptates voluptatum iste quasi provident provident itaque consectetur est ipsam animi placeat harum.,1
224,215759008,2024-08-31,Laudantium maiores quis sed deserunt laborum dolores delectus laboriosam amet sed.,7
224,592753936,2025-01-25,Earum necessitatibus saepe recusandae non tempora.,4
224,598225230,2024-05-04,Sint eveniet ipsa non ducimus hic earum tenetur.,4
225,592753936,2025-04-28,Blanditiis officiis aut optio exercitationem eius.,5
225,131282516,2025-01-03,Accusantium porro ea facilis omnis possimus culpa repellendus commodi optio vel commodi.,2
225,215759008,2025-01-14,Temporibus voluptatem voluptatibus omnis in iusto iure hic placeat.,7
226,991843914,2023-08-23,Quia itaque commodi numquam cupiditate temporibus veniam illo laborum necessitatibus blanditiis iste.,7
226,755771K,2024-02-09,Minus quibusdam quibusdam quaerat nesciunt iure est dignissimos consectetur.,3
226,768141746,2025-04-20,Eaque non dolor iure voluptas amet tenetur voluptates ullam.,4
227,215759008,2025-04-07,Minima alias aliquam dolor labore sunt.,7
227,28930715K,2024-09-12,Repudiandae non rem aspernatur sed quasi dolor.,5
227,433800532,2024-04-03,Animi ratione sapiente suscipit excepturi in repellat.,1
228,138996832,2025-03-17,Expedita a praesentium dolore architecto voluptas nihil quo tenetur.,2
228,928198014,2025-04-27,Esse voluptates repudiandae in delectus pariatur ut commodi.,1
228,960262786,2025-05-03,Voluptatum officiis veniam saepe quo maiores voluptatem rerum error.,4
229,991843914,2024-10-04,Dolorum corporis inventore quae maxime nihil odio assumenda ratione accusantium animi nisi.,4
229,892844682,2025-04-27,Iste sit unde laboriosam distinctio fugiat dolorem officiis aspernatur quis.,3
229,355429725,2025-05-10,Occaecati quod odio minima facilis dicta.,3
230,808227355,2025-05-07,Non et accusamus molestiae ducimus aliquam debitis placeat.,6
230,70958872,2024-12-28,Odit consequuntur occaecati officia sunt necessitatibus.,1
230,355429725,2025-01-24,Aperiam debitis illum temporibus eius magnam laborum saepe omnis sapiente praesentium.,5
231,569915724,2024-11-07,Nobis deleniti repellendus expedita repellendus maxime corporis ducimus omnis quibusdam a occaecati.,6
231,808227355,2024-10-12,Atque amet itaque nisi sequi corrupti.,2
231,177614769,2024-11-13,Maiores laborum unde accusantium veniam quasi.,4
232,241803562,2025-04-25,Velit eaque nihil accusamus quae esse temporibus molestias commodi cupiditate sint dolorem quae.,7
232,405734389,2025-04-27,Sapiente dolore provident distinctio harum enim non quo sint animi alias nesciunt.,5
232,960262786,2025-04-26,Aperiam asperiores laudantium praesentium placeat necessitatibus unde incidunt cum quas magni ea dicta.,2
233,960262786,2025-02-03,Inventore recusandae similique dolorum fugit maxime maxime sit excepturi nisi.,2
233,708305499,2025-01-01,Numquam adipisci sapiente incidunt harum magnam voluptas.,1
233,470086734,2025-03-05,Repudiandae consequuntur quod numquam modi quidem nemo ipsum.,5
234,114634794,2024-10-10,Sequi dolor iure odit fuga recusandae tempora tenetur tempora omnis reiciendis fugit maxime.,1
234,496401530,2025-02-20,Eos error perspiciatis consequatur perferendis voluptate.,2
234,912363694,2024-12-17,Reprehenderit eos minima facere commodi necessitatibus voluptates est.,3
235,598225230,2024-03-21,Minima dicta saepe ducimus velit harum animi tempora voluptate dolorem culpa eligendi.,6
235,138996832,2023-11-12,Veniam neque eos veritatis magnam voluptatum aut iste.,5
235,131282516,2025-01-03,Soluta cumque vero delectus natus voluptas alias a.,4
236,768141746,2024-02-22,Culpa placeat blanditiis alias debitis recusandae sit illo illum sunt expedita animi.,3
236,960262786,2024-05-24,Omnis consequuntur accusantium ipsam sequi quisquam reiciendis hic voluptatibus ipsa.,2
236,246261849,2024-02-18,Saepe voluptatem nam rerum modi magni dolorum eum expedita possimus.,5
237,598225230,2024-07-21,Hic culpa architecto distinctio aperiam illum doloribus.,3
237,912363694,2023-12-25,Commodi dolorum eligendi amet perspiciatis libero itaque.,6
237,686369072,2025-02-01,Id facilis corporis nulla pariatur culpa.,6
238,70958872,2025-05-09,Repellat quasi non optio optio consequatur molestiae odit beatae excepturi eos laboriosam dolorum.,1
238,912363694,2024-12-14,Iste officia soluta voluptas aspernatur maxime quasi rerum modi nulla fuga.,5
238,755771K,2024-11-16,Magni corporis numquam dignissimos alias doloremque perspiciatis vitae nihil doloremque.,6
239,654001588,2024-11-25,Sunt veritatis ut impedit at rerum vitae reprehenderit odit.,6
239,496401530,2023-08-04,Rem consectetur explicabo necessitatibus qui molestias iusto nihil accusamus dolore vel voluptatum.,3
239,114634794,2025-01-27,Dolorum rem molestias voluptas ipsam iure aperiam natus.,4
240,215759008,2023-10-30,Consequuntur doloribus dolores natus sequi quod vel dolor nemo inventore nesciunt iure.,2
240,506342201,2024-01-11,Eaque beatae esse autem nobis repellendus.,7
240,450557234,2024-06-27,Voluptate atque soluta nesciunt eveniet recusandae suscipit iste minima temporibus odit.,2
241,661478306,2024-04-10,Et veniam deserunt itaque suscipit debitis eligendi sequi veniam earum corporis libero.,2
241,928198014,2024-10-29,Accusamus accusantium saepe provident fugiat voluptates pariatur iusto mollitia perspiciatis.,7
241,915957536,2024-03-21,At magnam pariatur sint labore nisi vero facere.,7
242,506342201,2024-05-11,Fuga nulla enim iste illo corporis.,5
242,450557234,2023-09-28,Numquam minus repudiandae minima necessitatibus placeat quae earum deleniti doloribus qui non vero.,5
242,850748896,2024-10-01,Consectetur quam illo alias porro quas architecto tempore vel aspernatur ducimus.,1
243,215759008,2025-01-11,Labore in odio veritatis expedita minima ab eum.,2
243,862875117,2025-01-08,Eligendi placeat fuga in ipsam numquam ipsam ratione illum amet.,2
243,721081540,2025-01-23,Facere voluptate quaerat officia sunt maxime aliquid reprehenderit laboriosam quas reiciendis inventore aliquid.,7
244,215759008,2025-04-18,Ipsum eos numquam dolorum quisquam delectus esse quasi quae.,6
244,960262786,2024-06-28,Reprehenderit molestiae quam soluta at totam ex voluptatum repellat ratione ea iure.,7
244,138996832,2024-07-16,Debitis cupiditate quas aliquam aut recusandae voluptas minima odit ratione distinctio fuga eum.,3
245,569915724,2025-04-25,Id molestias debitis vero porro quasi laudantium distinctio ab.,2
245,928198014,2025-03-19,Itaque eos quia dicta quibusdam tempora atque eveniet eaque.,4
245,131282516,2025-05-03,Ab eaque natus alias blanditiis magnam libero.,2
246,506342201,2024-12-07,Quasi commodi tenetur reiciendis consectetur quasi.,2
246,215759008,2025-02-18,Eum dicta laborum nobis debitis repellendus culpa.,1
246,450557234,2025-01-20,Beatae pariatur tenetur nostrum aut nam ipsum eaque.,7
247,912363694,2025-04-06,Quod aliquid dolorem ab sint possimus accusantium et culpa ex minus.,4
247,433800532,2024-05-09,Distinctio doloremque consectetur amet magni ea blanditiis blanditiis similique dolorum.,5
247,470086734,2023-11-10,Odio aliquam explicabo sit necessitatibus exercitationem.,6
248,708305499,2025-04-14,Corrupti suscipit neque explicabo sed maiores.,2
248,912363694,2025-01-28,Quod iure soluta odio dolorem quod dolore maxime dolor voluptates velit.,3
248,991843914,2025-04-01,Beatae tempora commodi quod est fugit sit odio architecto placeat voluptas nobis.,4
249,768141746,2024-06-26,Deserunt ad similique repudiandae corporis placeat.,2
249,949663183,2024-10-15,Vel sequi distinctio quod iste molestiae omnis reprehenderit velit exercitationem ad facere reiciendis.,2
249,569915724,2023-11-13,Dolorum repellendus nihil eaque sint cumque accusantium enim minus quibusdam.,2
250,915957536,2023-10-27,Praesentium libero cumque est facere corrupti deleniti.,5
250,548798477,2025-02-18,Architecto laborum facilis ut dolorum soluta.,6
250,755771K,2025-03-29,Reiciendis dolores facere reiciendis et odit ipsum dignissimos quaerat vel.,2
251,960262786,2024-02-08,Consequuntur sequi quasi enim quo reiciendis.,5
251,850748896,2024-07-07,Dolorum quasi consequuntur vitae quas dolorum doloribus nihil atque quisquam.,2
251,131282516,2024-05-04,Laboriosam doloribus voluptatibus deserunt consequuntur distinctio tempora rerum qui.,7
252,496401530,2025-02-01,Quo maiores atque laborum quaerat in modi eaque eveniet.,3
252,991843914,2025-02-24,Illum nisi enim vitae magnam blanditiis dicta eveniet.,4
252,162244973,2025-04-30,Aperiam iste sapiente aliquam culpa rem.,6
253,162244973,2025-03-06,Voluptates maiores occaecati laborum veritatis quia cumque alias libero.,3
253,131282516,2024-09-18,Error itaque eum voluptas unde fuga.,3
253,661478306,2025-01-12,Adipisci iste hic et est tenetur totam asperiores vel ratione odit nihil neque.,7
254,768141746,2025-05-07,Inventore ex veritatis illum optio officia atque ut corporis tenetur fugiat veritatis.,1
254,450557234,2024-12-19,Tempora tempore esse necessitatibus odit facilis eum quos fugiat.,1
254,850748896,2024-12-12,Ipsam ratione adipisci et quia error.,7
255,949663183,2025-01-25,Aliquid optio sequi officia distinctio perferendis tempore porro sit totam eligendi.,6
255,506342201,2024-07-29,Quia cupiditate quo nihil dolorem assumenda.,6
255,755771K,2024-08-18,Error dolorem quas molestias beatae excepturi eos temporibus reiciendis quibusdam in beatae optio.,1
256,768141746,2024-08-15,Labore vel explicabo odit laudantium delectus laudantium non velit minima eligendi iste.,1
256,131282516,2024-11-03,Culpa dolor magnam ab qui saepe.,3
256,912363694,2024-08-24,Totam optio asperiores tempora voluptatem repellendus.,3
257,991843914,2024-09-08,Modi cumque harum ducimus hic ab ex repellat architecto hic eum quam.,3
257,569915724,2024-12-29,Vel iste minus nulla sapiente suscipit commodi maxime ullam.,1
257,506342201,2024-09-11,Nam magni esse quidem voluptates ex.,3
258,768141746,2024-06-06,Pariatur dignissimos in natus non repellendus aliquam reiciendis quam voluptatem placeat.,2
258,755771K,2023-11-19,Unde harum voluptatum nulla itaque officiis voluptates vero.,4
258,892844682,2024-10-20,Corrupti aut distinctio magnam cupiditate voluptatem excepturi rem corrupti voluptas inventore vero recusandae.,2
259,355429725,2025-04-19,Eaque quasi fugiat aliquid accusantium veritatis nulla perspiciatis.,5
259,162244973,2025-04-27,Voluptatem corporis ad quasi ipsam repudiandae numquam fuga exercitationem doloribus nisi dolor aperiam.,3
259,215759008,2025-05-11,Sapiente explicabo ab amet amet temporibus ratione cupiditate.,2
260,177614769,2025-04-11,Reprehenderit perspiciatis unde amet illum et ab recusandae dolores ea quibusdam officia omnis.,2
260,450557234,2025-03-08,Ut nobis deleniti eaque repellat repudiandae labore quae occaecati.,3
260,114634794,2024-08-31,Dignissimos iusto voluptatibus debitis provident illo pariatur nesciunt cum mollitia voluptate.,6
261,63303232,2024-01-18,Occaecati eaque occaecati in atque voluptate.,5
261,138996832,2025-02-15,Quidem non eaque quaerat odit sint cum aliquam facilis ipsa unde dicta.,3
261,506342201,2024-06-23,Cum pariatur corrupti in labore laudantium inventore hic nihil architecto.,1
262,949663183,2025-05-04,Sint eum doloremque harum eum nobis praesentium ea ut praesentium repellat illo et.,2
262,808227355,2025-05-05,A porro exercitationem dolores corporis neque tenetur nam sit laborum deserunt quidem doloribus.,5
262,721081540,2025-05-12,Velit veniam adipisci quibusdam maxime reprehenderit quo natus voluptatum ducimus similique debitis culpa.,5
263,912363694,2024-10-07,In vero libero veniam nostrum placeat dolore veniam qui.,1
263,960262786,2023-10-09,Nesciunt dolor voluptates eaque sit veritatis officiis iure sequi.,2
263,949663183,2025-02-07,Labore sed odio quaerat quam quia.,6
264,246261849,2024-11-18,Cum voluptatibus impedit esse esse dolorum quasi beatae adipisci voluptate doloremque.,5
264,850748896,2024-03-20,Vero eum error minima dolores amet ipsa aliquam reprehenderit assumenda ipsa quisquam incidunt.,3
264,768141746,2024-04-18,Ad porro quibusdam optio iusto quidem pariatur aliquid veritatis quas.,4
265,768141746,2025-04-08,Odio unde blanditiis eius a id doloribus fugiat velit.,1
265,215759008,2025-05-11,Minus tenetur et earum voluptates harum quis quod sequi dolore saepe enim quam.,5
265,808227355,2025-02-24,Eligendi dolorem vel necessitatibus fuga nesciunt ad repellendus.,2
