id_articulo,rut_revisor,fecha_revision,comentarios,calificacion
90,850748896,2024-12-28,Nesciunt minima expedita recusandae ducimus corrupti rerum animi ipsam nostrum eius alias praesentium.,5
90,892844682,2025-01-03,Officia voluptas neque quo est illo quisquam.,6
91,506342201,2025-04-01,Ea quaerat aperiam at necessitatibus maiores.,2
91,991843914,2025-04-25,Quis iure consectetur exercitationem voluptate quas nulla ut aliquid aliquid ad rem.,4
91,569915724,2025-03-13,Reprehenderit nostrum nulla laboriosam accusamus culpa animi saepe excepturi eius.,1
92,949663183,2025-04-07,Numquam facere dolores animi rerum modi quidem.,7
92,721081540,2025-01-01,Voluptas in illum natus voluptates suscipit eligendi unde unde quos praesentium.,4
92,808227355,2025-03-23,Fugiat ut cum voluptatem dolorum rem earum consectetur provident quibusdam qui architecto ut.,4
93,915957536,2024-06-11,Numquam distinctio voluptas illo molestias enim sed.,3
93,506342201,2024-06-28,Vel laudantium voluptatibus accusamus exercitationem accusantium ipsum laborum aliquam reprehenderit architecto.,4
93,708305499,2024-09-17,Odit porro deserunt libero in nisi aperiam aspernatur dolores sequi commodi.,6
94,450557234,2024-06-20,Consequatur placeat soluta accusantium amet maxime sequi suscipit natus veritatis necessitatibus.,1
94,991843914,2024-12-28,Necessitatibus tenetur animi velit sit dignissimos necessitatibus id iure.,3
94,506342201,2024-11-03,Impedit ab aperiam ipsam soluta commodi.,2
95,177614769,2024-12-01,Mollitia repudiandae aspernatur sit nihil quaerat iure dolor asperiores reiciendis nam modi voluptatem.,4
95,70958872,2023-10-31,Voluptatibus veniam eaque harum qui quas optio praesentium doloremque quam earum.,5
95,470086734,2024-01-25,Earum sunt quos praesentium mollitia voluptatibus reiciendis sunt vel dolore tempore.,2
96,598225230,2024-07-02,Sed architecto sed animi adipisci eveniet.,2
96,960262786,2024-04-12,Facilis nobis voluptate provident reiciendis alias minus delectus quia.,6
96,22835581K,2025-02-03,Labore qui quos magnam asperiores deleniti.,5
97,892844682,2025-04-25,Nam temporibus fuga accusantium quasi architecto mollitia illum porro vel adipisci libero culpa.,7
97,569915724,2025-04-20,Quos est commodi et voluptatibus occaecati eum quisquam.,2
97,548798477,2025-04-02,Enim at tenetur quidem excepturi magni.,1
98,949663183,2025-04-12,Atque esse numquam consectetur voluptatem nisi et voluptatum.,1
98,892844682,2024-07-09,Deleniti qui veniam eos repellendus consectetur.,1
98,686369072,2024-09-28,Fugiat qui rerum blanditiis commodi deserunt voluptatum autem quisquam asperiores magni.,6
99,177614769,2024-09-17,Corrupti consequuntur velit nam enim occaecati nam non iure.,1
99,892844682,2023-11-26,Architecto vitae a repellat officia sit ipsum itaque.,6
99,949663183,2024-07-31,Temporibus rerum ex magnam fugit sapiente doloribus.,7
100,81249905K,2025-03-20,Vero qui delectus velit explicabo doloribus magnam deleniti.,7
100,877648990,2024-12-28,Adipisci corporis tenetur nobis aut laboriosam suscipit consequatur voluptates impedit doloremque.,4
100,907304663,2024-11-03,Quos velit voluptatem molestiae deserunt qui saepe asperiores.,2
101,433800532,2025-05-08,Tempore assumenda sit itaque exercitationem provident ullam accusantium sed.,2
101,912363694,2025-04-30,Facilis modi iste aut ipsum delectus possimus numquam hic aspernatur.,5
101,177614769,2025-04-14,Ad ea adipisci perferendis magnam beatae blanditiis excepturi rem harum.,2
102,177614769,2025-03-03,Voluptas eos velit sunt qui unde beatae sequi cum.,3
102,433800532,2025-03-15,Modi magnam exercitationem voluptatem occaecati aperiam consequatur saepe harum minima sint.,6
102,70958872,2025-02-22,Ad modi numquam placeat ab ratione libero quo quasi officia velit incidunt dolorum.,6
103,915957536,2025-04-18,Dolor odio odit impedit perferendis pariatur nulla nam ducimus autem corporis.,7
103,808227355,2025-02-08,In quis esse cum nisi dolorem architecto quis similique dolorum.,6
103,598225230,2024-11-16,Mollitia qui perferendis enim natus totam totam facere ad quod perferendis sapiente quam.,4
104,131282516,2025-01-30,Atque ea amet fugiat commodi necessitatibus incidunt nulla voluptas ducimus eius sint exercitationem.,5
104,949663183,2025-03-09,Doloremque voluptate rem provident veniam nemo omnis recusandae architecto repellat iste.,2
104,177614769,2024-10-01,Illum maiores adipisci officiis incidunt non temporibus aspernatur aut assumenda at aspernatur.,7
105,909825660,2025-01-18,Ducimus rem quaerat facilis autem aliquam facere architecto magnam incidunt.,5
105,496401530,2025-03-20,Expedita debitis quia voluptate temporibus quas itaque eveniet ut magni.,7
105,114634794,2024-10-14,Quae eos deserunt eos dolor perspiciatis repudiandae asperiores voluptas neque minima.,1
106,433800532,2024-11-06,Repellendus eveniet inventore at deserunt culpa nesciunt dolore quod laborum.,7
106,755771K,2024-11-01,Aut cumque eaque cupiditate iste accusamus voluptatem debitis modi rerum.,5
106,569915724,2024-07-14,Praesentium eos aut doloribus iusto debitis.,2
107,241803562,2025-04-02,Sunt fugiat similique corporis necessitatibus nesciunt vero ab.,6
107,20964147K,2025-04-16,Maxime provident inventore voluptatum nostrum tempora.,4
107,496401530,2025-03-19,Blanditiis aspernatur expedita in explicabo necessitatibus natus.,6
108,131282516,2024-02-20,Eaque nesciunt molestias optio assumenda corporis quos.,2
108,912363694,2024-08-18,Omnis explicabo veniam perferendis amet ex similique possimus.,6
108,569915724,2023-07-03,Id incidunt maiores mollitia iste fugiat officiis earum sunt.,6
109,450557234,2024-12-28,Ipsam quidem assumenda laboriosam temporibus amet.,6
109,246261849,2024-12-04,Eligendi ad sed dolores eum alias ipsa.,2
109,862875117,2024-11-04,Doloribus reiciendis suscipit sit ducimus expedita ullam similique esse dolorem atque.,6
110,131282516,2024-02-10,Commodi commodi expedita enim quasi dolores qui.,3
110,22835581K,2025-04-11,Nam repellendus facere consequuntur deserunt delectus.,7
110,808227355,2023-12-17,Nostrum aliquam voluptate quae totam totam ipsam sit similique eum omnis cum.,6
111,215759008,2025-01-26,Quia ratione dolores cum voluptate atque.,3
111,892844682,2025-03-07,Unde eligendi velit unde odio facilis itaque ipsa blanditiis.,7
111,138996832,2025-05-07,Excepturi sequi quod ad maxime amet distinctio omnis at reprehenderit in unde qui illum.,1
112,598225230,2025-03-17,Mollitia harum iusto fuga cumque incidunt dolore quo sint ducimus voluptates aliquam.,2
112,496401530,2025-01-25,Nesciunt reiciendis dicta recusandae assumenda placeat perspiciatis unde quidem ab labore hic.,3
112,131282516,2023-12-11,Sunt nesciunt odio reprehenderit recusandae voluptates eius commodi doloremque consectetur corrupti reiciendis.,7
113,960262786,2025-04-15,Autem aliquid fuga rerum repellat quos modi esse iure iste.,5
113,405734389,2023-12-09,Ad eius quam nobis eius saepe laboriosam.,4
113,912363694,2024-11-27,Unde labore fugiat saepe dignissimos autem inventore ipsum eveniet.,1
114,177614769,2025-03-07,Dignissimos aliquam itaque placeat explicabo laudantium pariatur aspernatur aliquid ratione quia ut.,7
114,949663183,2025-01-26,Assumenda enim nobis culpa sed deleniti in.,7
114,162244973,2025-03-29,Dolorum maiores quos voluptates corrupti numquam atque esse cumque similique nemo molestias in.,4
115,450557234,2024-12-24,Itaque fuga voluptates explicabo repellendus illo cumque blanditiis distinctio repellendus.,6
115,912363694,2025-02-20,Recusandae quaerat odit soluta magni voluptas dolore voluptatem aperiam quod assumenda cum ab laborum.,3
115,177614769,2025-05-07,Eum voluptatem eum id id eos ut officiis.,3
116,661478306,2024-10-19,Corrupti cum occaecati illo iusto nemo.,7
116,450557234,2024-07-24,Odio fugit tempora numquam ab ut.,4
116,949663183,2025-04-01,Excepturi in veritatis sed nam totam vero molestiae provident aperiam soluta unde.,5
117,686369072,2024-11-10,Illo totam quis nesciunt repellendus aperiam debitis natus voluptatibus.,1
117,808227355,2024-09-16,Culpa quas rerum ipsam tempora eius nemo perspiciatis optio quam id.,3
117,960262786,2024-09-12,Saepe placeat maiores debitis velit quis explicabo quisquam.,1
118,991843914,2024-10-08,Maiores tempore laboriosam assumenda maxime quibusdam aliquam officia vel voluptate doloribus minus.,3
118,138996832,2025-03-10,Labore eum sit doloribus recusandae ut sint corrupti dignissimos.,5
118,506342201,2025-05-10,Labore consequatur libero nesciunt consequuntur beatae necessitatibus.,3
119,661478306,2025-04-27,Cum possimus ratione ullam facilis optio nam.,1
119,811361135,2025-03-01,Provident labore alias dolores ad quisquam natus iure reiciendis velit doloremque.,6
119,991843914,2025-04-21,Error nisi quibusdam itaque ex repellat non.,2
120,661478306,2024-08-04,Possimus doloribus asperiores tempore officiis rem accusantium beatae placeat autem mollitia id veniam.,1
120,131282516,2024-08-26,Magnam amet culpa illum inventore nostrum exercitationem dicta reprehenderit odio explicabo.,1
120,755771K,2024-08-01,Blanditiis quisquam non tempore rem fuga neque minima libero adipisci suscipit minus.,3
121,138996832,2025-03-24,Praesentium vero est voluptas illum praesentium assumenda atque sunt reprehenderit.,1
121,506342201,2025-04-21,Soluta vel cupiditate quaerat quaerat magni quis deserunt ratione fugiat nulla totam possimus.,7
121,470086734,2025-04-12,Rem reprehenderit vero quam repellat vitae modi laudantium.,3
122,70958872,2024-02-04,Quis illum harum reprehenderit eveniet fugiat libero porro molestiae inventore a beatae placeat.,5
122,693767296,2024-11-07,Doloremque eius esse maxime ad minima laudantium.,3
122,912363694,2023-12-04,Ipsum fugiat animi non molestiae id nemo fuga tempore error.,7
123,862875117,2024-08-01,Tempora ab incidunt occaecati deserunt impedit.,5
123,450557234,2023-08-10,Eligendi quibusdam modi doloribus unde perferendis dolores quaerat doloremque voluptatum.,3
123,506342201,2023-12-22,Pariatur incidunt natus consectetur explicabo laboriosam ex.,1
124,81249905K,2025-04-06,Laudantium laudantium magni nisi earum veniam nobis magnam fuga perferendis maiores quidem.,2
124,686369072,2025-05-02,Cum odit eum mollitia illum ducimus necessitatibus sit impedit nulla nam.,1
124,960262786,2025-03-21,Totam mollitia maxime illum atque repellendus similique itaque cupiditate quasi modi modi.,7
125,991843914,2025-05-10,Unde eius nostrum dolores doloribus nobis quidem aspernatur aspernatur.,3
125,569915724,2025-04-20,Quidem perspiciatis nulla quia rerum voluptates cumque accusamus aspernatur.,3
125,450557234,2025-04-22,Dolor earum dolores adipisci nemo molestias quos reiciendis atque vel earum iure.,6
126,928198014,2025-04-07,In esse sint optio earum nulla officiis quasi aut temporibus.,1
126,241803562,2025-04-14,Expedita quia similique harum voluptatum provident numquam facilis.,2
126,114634794,2025-03-27,Officia molestiae nesciunt voluptas vero pariatur nesciunt quaerat nostrum.,4
127,28930715K,2024-04-23,Delectus alias quo veritatis minima aperiam ea quidem nostrum in libero dolor sit.,4
127,850748896,2024-07-27,Quos repudiandae voluptate saepe ipsam amet nihil nesciunt.,6
127,910763059,2025-02-27,Harum exercitationem libero cumque maiores doloribus ut iure incidunt quam aut doloremque debitis.,7
128,405734389,2025-01-08,Consequatur placeat vel quos dolorum cupiditate commodi cum quisquam.,2
128,543383023,2024-08-04,Nesciunt fuga quidem autem quos nam quia nostrum.,7
128,808227355,2023-11-30,Molestiae esse reiciendis voluptas itaque occaecati delectus veritatis voluptate est iure similique autem.,1
129,811361135,2023-12-12,Illo saepe tempora quibusdam labore ab itaque quibusdam numquam velit.,3
129,991843914,2024-01-13,Inventore corrupti error autem amet provident molestiae.,4
129,661478306,2023-12-17,Tempore maxime vitae delectus error voluptas excepturi accusamus facere eaque.,4
130,569915724,2025-04-22,Aliquid similique reprehenderit nobis porro fugit.,3
130,81249905K,2023-11-25,Illum ex hic cumque dolorem qui quod.,1
130,850748896,2024-09-17,Vitae optio optio quidem repudiandae a deleniti repellat dolorem iure nesciunt.,1
131,506342201,2024-12-17,Consequatur at iste fuga magni iste asperiores enim.,5
131,450557234,2024-09-13,Eligendi consequatur nihil quae eos nulla dolore praesentium accusamus quaerat dolorum.,2
131,976806999,2025-02-19,Consequatur nostrum exercitationem culpa ea earum iure necessitatibus excepturi officiis.,7
132,912363694,2024-08-16,Ipsam eveniet repellat non consectetur vitae est nostrum soluta delectus.,2
132,215759008,2024-12-08,Veniam vero minus natus quisquam hic amet minima exercitationem voluptates ducimus nam.,4
132,131282516,2025-05-09,Similique expedita nostrum eos repellat enim.,2
133,177614769,2024-09-06,Unde odit magnam iure est esse itaque quibusdam.,6
133,450557234,2024-07-31,Exercitationem expedita at voluptatem nam cupiditate necessitatibus consectetur debitis adipisci laborum.,2
133,470086734,2024-04-01,Nostrum deleniti quibusdam odio accusamus repellendus vitae exercitationem fugiat.,4
134,569915724,2025-01-12,Magni ut fuga deserunt rem velit deserunt labore.,1
134,470086734,2025-02-18,Beatae laborum tenetur quo sint quos neque quos eos unde.,5
134,138996832,2024-12-04,Soluta nisi et porro pariatur totam doloribus id inventore in ea.,5
135,70958872,2025-02-16,Illum sit enim libero magni consequuntur ab deleniti porro error.,7
135,598225230,2025-02-11,Animi doloremque quaerat iusto asperiores eligendi magnam sunt commodi.,1
135,138996832,2025-04-21,Veniam magnam corrupti iste ad nulla occaecati voluptate pariatur.,7
136,976806999,2025-01-06,Debitis autem at consectetur quis id eius assumenda.,7
136,138996832,2023-09-18,Incidunt consequatur provident sit earum aliquid earum itaque blanditiis.,4
136,949663183,2024-03-04,Voluptas qui doloremque nemo nulla quod debitis reprehenderit saepe maxime sequi.,3
137,949663183,2024-06-24,Voluptatibus veniam nulla ut repudiandae magni.,5
137,928198014,2025-04-04,Placeat unde error iste impedit rerum mollitia similique.,4
137,960262786,2025-01-25,Unde nam eius tenetur explicabo distinctio minus consequatur nisi libero quisquam.,5
138,949663183,2024-04-21,Rerum omnis suscipit laborum corporis autem quod aliquid minima cumque ullam quisquam nostrum commodi.,7
138,912363694,2024-03-26,Reiciendis corrupti non natus nihil ipsa atque quibusdam.,2
138,355429725,2024-01-22,Consectetur non perferendis et placeat velit vero maiores.,4
139,991843914,2025-03-14,Iusto neque quo quasi voluptatibus quam officia hic mollitia.,6
139,915957536,2024-09-06,Totam reprehenderit eos corporis soluta nam sequi ex aut fugiat.,3
139,598225230,2025-04-29,Dicta consequatur occaecati sint debitis iusto voluptatem laboriosam eum doloremque commodi.,7
140,246261849,2025-01-01,Sapiente et maiores deleniti inventore possimus.,6
140,862875117,2024-08-10,Deleniti quod vel odio modi quia occaecati excepturi ipsa officia quos nemo.,1
140,63303232,2024-12-05,Neque facere eum ut placeat necessitatibus est optio accusantium veritatis itaque officiis.,3
141,241803562,2024-07-30,Dolorum doloremque nobis velit eaque error dolorum autem nobis repudiandae soluta laborum dolore.,4
141,405734389,2024-03-04,Id atque voluptates eius voluptates ipsa quaerat consectetur corrupti dolor maiores nemo.,4
141,928198014,2025-01-09,Optio inventore consectetur eligendi accusamus vitae autem.,7
142,949663183,2024-10-14,Soluta aspernatur tempora eaque delectus placeat eum ut.,6
142,755771K,2024-12-17,Nostrum nostrum architecto eius vero consectetur dignissimos aut saepe voluptas.,1
142,177614769,2025-02-09,Ut laborum sunt quia quo sequi quibusdam iusto laudantium aspernatur perspiciatis.,6
143,81249905K,2024-11-05,Similique ipsum incidunt beatae numquam ducimus.,4
143,808227355,2025-05-01,Natus qui libero perspiciatis fugit dicta rerum velit.,3
143,28930715K,2024-12-23,Nostrum quaerat saepe optio qui ex alias nihil quisquam.,5
144,960262786,2024-11-03,Iusto eos deleniti mollitia blanditiis ipsa ea voluptatum neque repellendus autem.,1
144,548798477,2025-01-19,Eaque quibusdam nemo laboriosam ullam ducimus pariatur minus.,2
144,355429725,2024-12-14,Dolore est corporis corporis reiciendis qui error magni corrupti.,6
145,755771K,2025-05-07,Rerum animi dignissimos a nam error facere.,4
145,70958872,2024-10-07,Ex soluta possimus optio tempore neque eius eum optio.,6
145,877648990,2024-09-10,Natus ipsum ipsam reprehenderit laboriosam nihil ex porro deserunt aliquam.,2
146,470086734,2025-02-07,Numquam commodi sed veniam adipisci doloremque quas repudiandae dolor alias.,6
146,960262786,2025-02-14,Ducimus atque tenetur deleniti quae libero cupiditate excepturi tenetur doloribus enim placeat.,7
146,569915724,2025-03-01,Architecto commodi tempora alias animi nesciunt dolore quisquam.,5
147,598225230,2024-03-02,Corporis excepturi nobis quidem at voluptates.,1
147,877648990,2025-01-20,Numquam labore aliquam eaque magni nulla.,2
147,892844682,2024-05-23,Mollitia aliquam minus debitis eos ipsum itaque doloribus sed quam occaecati sit voluptatem.,2
148,450557234,2025-02-26,Velit adipisci cupiditate ex explicabo nostrum eligendi temporibus deleniti.,3
148,131282516,2025-01-20,Sint voluptatem dignissimos ullam ipsum totam laudantium.,5
148,892844682,2025-05-05,Sed vitae sed labore natus nisi.,5
149,569915724,2025-02-06,Occaecati tempore nulla quasi dolores occaecati doloremque laboriosam placeat.,6
149,470086734,2024-11-13,Dolores reprehenderit aut possimus ex aspernatur minima voluptas.,4
149,598225230,2024-02-04,Quia exercitationem porro vel et sed praesentium.,7
150,28930715K,2024-08-15,Impedit unde atque laborum itaque cumque.,2
150,114634794,2025-05-09,Soluta ducimus consequuntur facilis nulla voluptates labore magnam nihil quae odit.,2
150,70958872,2025-04-06,Autem ipsa perferendis molestias nihil dolorum voluptatibus fugiat exercitationem.,7
151,131282516,2024-10-18,Quaerat sint quasi natus odit tempora velit aliquam commodi.,2
151,598225230,2025-01-03,Ad ratione qui odio nobis id incidunt quo nobis rerum minus.,2
151,592753936,2024-05-26,Vero quod beatae quis saepe culpa nulla vitae facere ad.,1
152,355429725,2024-11-26,Sit deleniti repellendus sunt perferendis mollitia aliquid.,1
152,912363694,2024-09-27,Similique sapiente repudiandae numquam eaque nisi accusantium iusto temporibus.,7
152,892844682,2024-08-25,Voluptates necessitatibus ea mollitia dolor asperiores asperiores officiis nihil.,7
153,138996832,2024-04-30,Cum eaque non occaecati alias officiis animi suscipit quae natus odit nihil.,7
153,246261849,2024-07-16,Ducimus fugiat cupiditate perspiciatis delectus earum.,4
153,850748896,2025-03-19,Excepturi alias voluptatum labore quidem eaque illum iusto debitis ipsum.,4
154,991843914,2025-05-03,Laboriosam eligendi ex veniam in natus ratione quo quisquam minus perspiciatis.,6
154,20964147K,2025-05-06,Iusto harum pariatur dolorem non delectus quaerat odio veniam ad blanditiis repellendus autem.,7
154,433800532,2025-04-28,Debitis voluptate cupiditate necessitatibus necessitatibus delectus deserunt ipsa.,7
155,215759008,2023-08-21,Accusamus et cumque impedit tempore nostrum nisi modi corrupti adipisci.,6
155,708305499,2024-08-13,Tempora nesciunt saepe eos repellat quasi repellendus deleniti at fugit est.,7
155,548798477,2024-12-21,Deleniti atque debitis alias natus soluta ducimus nemo vero.,3
156,928198014,2024-11-23,Aut porro eius maiores non voluptates iusto nihil ab ipsam repellendus est.,7
156,949663183,2024-08-02,Aperiam repudiandae possimus numquam aliquid magnam.,6
156,960262786,2024-08-15,Assumenda similique temporibus omnis eaque molestias neque excepturi eum.,7
157,877648990,2024-08-05,Atque hic deleniti fugiat magni quasi ut.,4
157,470086734,2025-04-20,Corrupti quam exercitationem excepturi nobis minima.,1
157,506342201,2025-03-14,Numquam animi doloremque ratione maiores reprehenderit distinctio eius recusandae.,7
158,928198014,2025-03-16,Sint accusantium deleniti minima tenetur unde molestias nesciunt nostrum ducimus quas culpa praesentium.,1
158,991843914,2024-05-19,Fugiat sunt pariatur dolore magnam alias ullam.,2
158,470086734,2024-11-11,Non recusandae soluta earum corporis praesentium debitis assumenda qui aliquid ipsum tenetur enim.,4
159,131282516,2024-11-23,Magnam totam et numquam at debitis quo sit deleniti dolorem sequi voluptate aliquid.,7
159,755771K,2024-10-05,Explicabo dicta voluptatibus harum voluptatem cumque.,7
159,808227355,2025-03-17,Nemo delectus beatae quis dolores laboriosam suscipit.,2
160,548798477,2025-05-05,Natus iure vel tempora ipsam est soluta.,3
160,177614769,2025-03-21,Quisquam quasi cumque nesciunt in quia vero unde.,1
160,592753936,2025-04-22,Nemo debitis sunt facere reprehenderit voluptate dolor fugiat commodi iure.,6
161,915957536,2024-02-28,Officia odit nostrum pariatur eos inventore.,3
161,131282516,2024-01-25,Voluptates maxime accusamus quasi quis reiciendis unde maxime ea quam.,1
161,892844682,2024-01-27,Rerum nobis labore libero provident debitis illum occaecati aliquid.,3
162,433800532,2025-04-26,Dignissimos iste esse harum numquam commodi consectetur voluptas fuga dolorem.,1
162,949663183,2025-04-18,Repellendus dolor voluptate qui deleniti alias enim quasi culpa minima odio.,5
162,131282516,2025-04-13,Minus sed similique occaecati sint dolorum nesciunt cumque.,6
163,892844682,2024-11-01,Nobis quod dolor architecto sapiente ex quas quis natus veritatis voluptates porro.,2
163,907304663,2024-10-16,Nam magni voluptatem nihil nesciunt est placeat sit delectus dolor ipsum.,4
163,215759008,2024-08-09,Ratione deserunt veniam nam ipsum quibusdam in autem harum incidunt.,3
164,138996832,2024-06-07,Doloremque ullam dolor sed nisi repellat beatae veritatis corrupti atque.,3
164,506342201,2024-03-13,Dolorem ab placeat nulla ex maiores quam nemo aut.,7
164,768141746,2024-07-25,Iste quasi necessitatibus dignissimos eos illo quidem praesentium tempora itaque quam.,1
165,496401530,2024-03-09,Qui beatae laudantium nesciunt tenetur magni delectus.,5
165,892844682,2024-02-13,Aspernatur molestias aperiam reiciendis pariatur dignissimos adipisci autem.,7
165,63303232,2025-04-14,Ab nulla porro repellat assumenda repellat vel velit voluptatibus.,2
166,215759008,2024-07-02,Explicabo illo reprehenderit ab temporibus consequuntur labore eligendi vitae tempore.,3
166,693767296,2024-06-05,Ut pariatur velit assumenda est vero.,5
166,63303232,2025-01-11,Aliquam quos praesentium ipsa id repudiandae placeat.,7
167,63303232,2024-02-13,Nisi aperiam non optio iure autem laboriosam expedita non.,6
167,496401530,2024-05-26,Odio amet totam non error nam molestiae harum blanditiis quaerat in magnam.,7
167,592753936,2025-04-10,Natus laborum consectetur voluptatem adipisci iusto omnis doloribus molestias dolorem tenetur nemo amet.,1
168,949663183,2024-05-22,Nisi cumque rem minus eaque eius.,1
168,892844682,2024-03-12,Repellendus quod unde aliquam facilis et fugit labore odit labore ratione accusantium distinctio.,6
168,755771K,2024-01-02,Quas quibusdam sit natus sunt eius maxime quia veritatis qui error natus veniam.,6
169,991843914,2025-05-07,Eaque quidem ab fugit nobis quis ea suscipit beatae.,5
169,433800532,2025-05-09,Atque non necessitatibus corrupti ad qui autem iste pariatur.,7
169,877648990,2025-05-06,Harum blanditiis esse maxime adipisci laborum at.,7
170,991843914,2025-05-12,Iure delectus quisquam nemo tempore sint labore nihil eos provident nostrum nostrum.,3
170,877648990,2025-05-11,Ut praesentium voluptatibus dignissimos quibusdam odit suscipit saepe dolorem.,1
170,162244973,2025-05-10,Culpa praesentium eum fuga debitis corrupti architecto.,1
171,569915724,2025-04-29,Reiciendis non similique recusandae aperiam tenetur suscipit minus aspernatur dolore cupiditate.,6
171,991843914,2024-11-20,Nobis quisquam quas dolorum consequatur quod assumenda labore delectus fugiat illum.,4
171,246261849,2025-04-09,Voluptate qui expedita expedita iusto vel alias laborum eveniet ipsum unde numquam voluptatem.,3
172,960262786,2024-03-30,Quidem possimus rerum beatae nisi iusto.,1
172,910763059,2024-07-14,Eum nobis omnis incidunt reprehenderit impedit velit sint.,2
172,862875117,2024-11-06,Adipisci eum modi minus aut amet cumque vitae suscipit ut necessitatibus corporis voluptates.,3
173,215759008,2023-10-09,Inventore magni mollitia sapiente esse animi.,2
173,81249905K,2023-11-02,Consectetur molestias molestias molestiae ex impedit.,5
173,470086734,2025-01-14,Saepe possimus nobis voluptatem cumque dolorem explicabo molestiae cupiditate dolor aliquid aliquam.,3
174,661478306,2024-11-28,Repellendus velit maxime sed perferendis hic culpa dolorem iste vero.,2
174,598225230,2024-09-12,Nesciunt nihil eveniet quae delectus mollitia alias tenetur asperiores eligendi molestias veritatis.,6
174,991843914,2024-05-09,Veniam possimus neque in a beatae quisquam quae dolorum aliquid odio nostrum adipisci.,4
175,850748896,2024-10-04,Mollitia exercitationem voluptatum omnis consectetur officia eos.,4
175,949663183,2025-01-20,Vitae ratione nemo nostrum adipisci alias temporibus.,4
175,138996832,2025-03-06,Rerum similique quidem ullam quo minima optio ad a maxime vero accusantium.,4
176,693767296,2024-03-01,Molestiae non quo officia quas mollitia.,5
176,912363694,2024-02-04,Repellat odit quis illum placeat veritatis modi quo quasi necessitatibus repudiandae.,6
176,215759008,2023-11-05,Veniam hic voluptatibus expedita dolores porro saepe architecto explicabo sapiente consequatur doloremque.,7
177,960262786,2024-08-12,Officia soluta quidem fugiat in consequuntur tempora quos non.,2
177,569915724,2024-02-20,Saepe accusamus nisi corrupti in ex.,6
177,949663183,2024-02-13,Quas amet eum facilis quisquam dolorum.,7
178,28930715K,2025-05-09,Vitae quidem nesciunt assumenda odit reiciendis iusto.,7
178,960262786,2025-05-10,Quas soluta accusantium officia dignissimos reiciendis temporibus earum dolore facilis incidunt architecto.,6
178,450557234,2025-05-08,Distinctio doloribus iure animi tempora labore.,1
